,Unnamed: 0.1,pub_year,pub_month,journal_name,paper_title,author
3090,3090,2018,11,Science advances,Autocrine-based selection of ligands for personalized CAR-T therapy of lymphoma,"alexey_v.stepanov.russia.moscow,oleg_v.markov.russia.novosibirsk,ivan_v.chernikov.russia.novosibirsk,daniil_v.gladkikh.russia.novosibirsk,hongkai.zhang.usa.north,teresa.jones.usa.north,alexandra_v.senkova.russia.novosibirsk,elena_l.chernolovskaya.russia.novosibirsk,marina_a.zenkova.russia.novosibirsk,roman_s.kalinin.russia.moscow,maria_p.rubtsova.russia.moscow,alexey_a.belogurov.russia.moscow,jia.xie.usa.north,alexander_g.gabibov.russia.moscow,richard_a.lerner.usa.north"
3092,3092,2018,11,Science advances,Time-space-displaced responses in the orangutan vocal system,"adriano_r.lameira.united_kingdom.scotland,josep.call.united_kingdom.scotland"
3093,3093,2018,11,Science advances,Thanatin targets the intermembrane protein complex required for lipopolysaccharide transport in <i>Escherichia coli</i>,"stefan_u.vetterli.switzerland.zurich,katja.zerbe.switzerland.zurich,maik.mller.switzerland.zurich,matthias.urfer.switzerland.zurich,milon.mondal.switzerland.zurich,shuangyan.wang.switzerland.zurich,kerstin.moehle.switzerland.zurich,oliver.zerbe.switzerland.zurich,alessandra.vitale.switzerland.zurich,gabriella.pessi.switzerland.zurich,leo.eberl.switzerland.zurich,bernd.wollscheid.switzerland.zurich,john_a.robinson.switzerland.zurich"
3106,3106,2018,11,Cell reports,DNA-PK Is Targeted by Multiple Vaccinia Virus Proteins to Inhibit DNA Sensing,"simon_r.scutts.united_kingdom.cambridge,stuart_w.ember.united_kingdom.cambridge,hongwei.ren.united_kingdom.cambridge,chao.ye.united_kingdom.cambridge,christopher_a.lovejoy.united_kingdom.cambridge,michela.mazzon.united_kingdom.cambridge,david_l.veyer.united_kingdom.cambridge,rebecca_p.sumner.united_kingdom.cambridge,geoffrey_l.smith.united_kingdom.cambridge"
3107,3107,2018,11,Cell reports,Microanatomic Distribution of Myeloid Heme Oxygenase-1 Protects against Free Radical-Mediated Immunopathology in Human Tuberculosis,"krishna_c.chinta.usa.birmingham,md_aejazur.rahman.south_africa.durban,vikram.saini.usa.birmingham,joel_n.glasgow.usa.birmingham,vineel_p.reddy.usa.birmingham,jeremie_m.lever.usa.birmingham,shepherd.nhamoyebonde.south_africa.durban,alasdair.leslie.south_africa.durban,ryan_m.wells.usa.birmingham,amie.traylor.usa.birmingham,rajhmun.madansein.south_africa.durban,gene_p.siegal.usa.birmingham,veena_b.antony.usa.birmingham,jessy.deshane.usa.birmingham,gordon.wells.south_africa.durban,kievershen.nargan.south_africa.durban,james_f.george.usa.birmingham,pratistadevi_k.ramdial.south_africa.durban,anupam.agarwal.usa.birmingham,adrie_j_c.steyn.usa.birmingham"
3109,3109,2018,11,Cell reports,Smchd1 Targeting to the Inactive X Is Dependent on the Xist-HnrnpK-PRC1 Pathway,"natasha.jansz.australia.melbourne,andrew.keniry.australia.melbourne,megan.iminitoff.australia.melbourne,peter_f.hickey.australia.melbourne,osamu.masui.japan.yokohama,simon.kobelke.australia.crawley,niall.geoghegan.australia.melbourne,kelsey_a.breslin.australia.melbourne,tracy_a.willson.australia.melbourne,kelly.rogers.australia.melbourne,graham_f.kay.australia.brisbane,archa_h.fox.australia.crawley,haruhiko.koseki.japan.yokohama,james_m.murphy.australia.melbourne,marnie_e.blewitt.australia.melbourne"
3111,3111,2018,11,Cell reports,Dissecting Molecular and Circuit Mechanisms for Inhibition and Delayed Response of ASI Neurons during Nociceptive Stimulus,"min.guo.china.wuhan,minghai.ge.china.wuhan,michael_a.berberoglu.china.wuhan,jie.zhou.china.wuhan,long.ma.china.wuhan,juan.yang.china.wuhan,qiyan.dong.china.wuhan,yanni.feng.china.wuhan,zhengxing.wu.china.wuhan,zhiqiang.dong.china.wuhan"
3114,3114,2018,11,Cell reports,The Dynamics of TGF-β Signaling Are Dictated by Receptor Trafficking via the ESCRT Machinery,"daniel_s_j.miller.united_kingdom.london,robert_d.bloxham.united_kingdom.london,ming.jiang.united_kingdom.london,ilaria.gori.united_kingdom.london,rebecca_e.saunders.united_kingdom.london,debipriya.das.united_kingdom.london,probir.chakravarty.united_kingdom.london,michael.howell.united_kingdom.london,caroline_s.hill.united_kingdom.london"
3117,3117,2018,11,Cell reports,Mitochondrial p32/C1qbp Is a Critical Regulator of Dendritic Cell Metabolism and Maturation,"kazuhito.gotoh.japan.fukuoka,takafumi.morisaki.japan.fukuoka,daiki.setoyama.japan.fukuoka,katsuhiko.sasaki.japan.fukuoka,mikako.yagi.japan.fukuoka,ko.igami.japan.tokyo,soichi.mizuguchi.japan.fukuoka,takeshi.uchiumi.japan.fukuoka,yoshinori.fukui.japan.fukuoka,dongchon.kang.japan.fukuoka"
3120,3120,2018,11,Cell reports,Brd4's Bromodomains Mediate Histone H3 Acetylation and Chromatin Remodeling in Pluripotent Cells through P300 and Brg1,"tao.wu.usa.newyork,yasunao_f.kamikawa.usa.newyork,mary_e.donohoe.usa.newyork"
3123,3123,2018,11,Cell reports,"Two B-Box Domain Proteins, BBX18 and BBX23, Interact with ELF3 and Regulate Thermomorphogenesis in Arabidopsis","lan.ding.china.hangzhou,shuo.wang.china.shanghai,zeting.song.china.hangzhou,yupei.jiang.china.shanghai,jiajia.han.china.hangzhou,sunjie.lu.china.shanghai,lin.li.china.shanghai,jianxiang.liu.china.hangzhou"
3125,3125,2018,11,Cell reports,Single-Molecule Turnarounds of Intraflagellar Transport at the C. elegans Ciliary Tip,"jona.mijalkovic.netherlands.amsterdam,jaap.van_krugten.netherlands.amsterdam,felix.oswald.netherlands.amsterdam,seyda.acar.netherlands.amsterdam,erwin_j_g.peterman.netherlands.amsterdam"
3126,3126,2018,11,Cell reports,Origin of Gamma Frequency Power during Hippocampal Sharp-Wave Ripples,"azahara.oliva.usa.newyork,antonio.fernndezruiz.usa.newyork,gyrgy.buzski.usa.newyork"
3127,3127,2018,11,Cell reports,Xrs2 and Tel1 Independently Contribute to MR-Mediated DNA Tethering and Replisome Stability,"julyun.oh.usa.newyork,so_jung.lee.usa.newyork,rodney.rothstein.usa.newyork,lorraine_s.symington.usa.newyork"
3129,3129,2018,11,Nature communications,Proteome-wide analysis of USP14 substrates revealed its role in hepatosteatosis via stabilization of FASN,"bin.liu.china.shanghai,shangwen.jiang.china.shanghai,min.li.china.shanghai,xuelian.xiong.china.shanghai,mingrui.zhu.china.shanghai,duanzhuo.li.china.hubei,lei.zhao.china.shanghai,lili.qian.china.shanghai,linhui.zhai.china.shanghai,jing.li.china.shanghai,han.lu.china.shanghai,shengnan.sun.china.shanghai,yan.lu.china.shanghai,xiaoying.li.china.shanghai,minjia.tan.china.shanghai"
3131,3131,2018,11,Nature communications,Experimental heatwaves compromise sperm function and cause transgenerational damage in a model insect,"kris.sales.united_kingdom.norwich,ramakrishnan.vasudeva.united_kingdom.norwich,matthew_e.dickinson.united_kingdom.norwich,joanne_l.godwin.united_kingdom.norwich,alyson_j.lumley.united_kingdom.norwich,ukasz.michalczyk.poland.krakow,laura.hebberecht.united_kingdom.norwich,paul.thomas.united_kingdom.norwich,aldina.franco.united_kingdom.norwich,matthew_j_g.gage.united_kingdom.norwich"
3133,3133,2018,11,Nature communications,Author Correction: Division of labour between Myc and G1 cyclins in cell cycle commitment and pace control,"peng.dong.usa.durham,manoj_v.maddali.usa.durham,jaydeep_k.srimani.usa.durham,franois.thlot.usa.durham,joseph_r.nevins.usa.durham,bernard.matheyprevot.usa.durham,lingchong.you.usa.durham"
3135,3135,2018,11,Nature communications,Unmasking GluN1/GluN3A excitatory glycine NMDA receptors,"teddy.grand.france.paris,sarah.abi_gerges.france.paris,mlissa.david.france.paris,marco_a.diana.france.paris,pierre.paoletti.france.paris"
3137,3137,2018,11,PLoS biology,H3K36 trimethylation mediated by SETD2 regulates the fate of bone marrow mesenchymal stem cells,"lijun.wang.china.shanghai,ningning.niu.china.shanghai,li.li.china.shanghai,rui.shao.china.shanghai,huiling.ouyang.china.shanghai,weiguo.zou.china.shanghai"
3140,3140,2018,11,PLoS computational biology,Bayesian phylodynamic inference with complex models,"erik_m.volz.united_kingdom.london,igor.siveroni.united_kingdom.london"
3142,3142,2018,11,PLoS computational biology,Moth olfactory receptor neurons adjust their encoding efficiency to temporal statistics of pheromone fluctuations,"marie.levakova.czech_republic.prague,lubomir.kostal.czech_republic.prague,christelle.monsemps.france.versailles,vincent.jacob.france.versailles,philippe.lucas.france.versailles"
3143,3143,2018,11,PLoS computational biology,Comparing Bayesian and non-Bayesian accounts of human confidence reports,"william_t.adler.usa.newyork,wei_ji.ma.usa.newyork"
3144,3144,2018,11,PLoS genetics,Evolution at two time frames: Polymorphisms from an ancient singular divergence event fuel contemporary parallel evolution,"steven_m.van_belleghem.belgium.brussels,carl.vangestel.belgium.brussels,katrien.de_wolf.belgium.brussels,zo.de_corte.belgium.brussels,markus.mst.austria.innsbruck,pasi.rastas.finland.helsinki,frederik.hendrickx.belgium.brussels"
3145,3145,2018,11,PLoS medicine,Machine learning assessment of myocardial ischemia using angiography: Development and retrospective validation,"hyeonyong.hae.south_korea.seoul,soojin.kang.south_korea.seoul,junegoo.lee.south_korea.seoul,youngoh.bae.south_korea.seoul,hyungjoo.cho.south_korea.seoul,dong_hyun.yang.south_korea.seoul,joonwon.kang.south_korea.seoul,taehwan.lim.south_korea.seoul,cheol_hyun.lee.south_korea.seoul,doyoon.kang.south_korea.seoul,pil_hyung.lee.south_korea.seoul,jungmin.ahn.south_korea.seoul,dukwoo.park.south_korea.seoul,seungwhan.lee.south_korea.seoul,younghak.kim.south_korea.seoul,cheol_whan.lee.south_korea.seoul,seongwook.park.south_korea.seoul,seungjung.park.south_korea.seoul"
3146,3146,2018,11,PLoS medicine,Machine learning to identify pairwise interactions between specific IgE antibodies and their association with asthma: A cross-sectional analysis within a population-based birth cohort,"sara.fontanella.united_kingdom.london,clment.frainay.united_kingdom.london,clare_s.murray.united_kingdom.manchester,angela.simpson.united_kingdom.manchester,adnan.custovic.united_kingdom.london"
3147,3147,2018,11,PLoS medicine,Transforming health policy through machine learning,"hutan.ashrafian.united_kingdom.london,ara.darzi.united_kingdom.london"
3150,3150,2018,11,PLoS neglected tropical diseases,Rabies post-exposure prophylaxis started during or after travel: A GeoSentinel analysis,"philippe.gautret.france.marseille,kristina_m.angelo.usa.georgia,hilmir.asgeirsson.sweden.stockholm,david_g.lalloo.united_kingdom.liverpool,marc.shaw.australia.townsville,eli.schwartz.israel.telaviv,michael.libman.canada.montreal,kevin_c.kain.canada.toronto,watcharapong.piyaphanee.thailand.bangkok,karin.leder.australia.melbourne,jean.vincelette.canada.montreal,mogens.jensenius.norway.oslo,jesse.waggoner.usa.georgia,daniel.leung.usa.utah,sarah.borwein.china.hongkong,elizabeth_d.barnett.usa.massachusetts,davidson_h.hamer.usa.massachusetts"
3151,3151,2018,11,PLoS pathogens,Delayed oseltamivir plus sirolimus treatment attenuates H1N1 virus-induced severe lung injury correlated with repressed NLRP3 inflammasome activation and inflammatory cell infiltration,"xuehong.jia.china.beijing,bo.liu.china.zibo,linlin.bao.china.beijing,qi.lv.china.beijing,fengdi.li.china.beijing,hui.li.china.beijing,yunqing.an.china.beijing,xulong.zhang.china.beijing,bin.cao.china.beijing,chen.wang.china.beijing"
3157,3157,2018,11,Nature biotechnology,High-throughput determination of the antigen specificities of T cell receptors in single cells,"shuqi.zhang.usa.texas,keyue.ma.usa.texas,alexandra_a.schonnesen.usa.texas,mingliang.zhang.china.shanghai,chenfeng.he.usa.texas,eric.sun.usa.texas,chad_m.williams.usa.texas,weiping.jia.china.shanghai,ning.jiang.usa.texas"
3158,3158,2018,11,Nature biotechnology,ClampFISH detects individual nucleic acid molecules using click chemistry-based amplification,"sara_h.rouhanifard.usa.pennsylvania,ian_a.mellis.usa.pennsylvania,margaret.dunagin.usa.pennsylvania,sareh.bayatpour.usa.pennsylvania,connie_l.jiang.usa.pennsylvania,ian.dardani.usa.pennsylvania,orsolya.symmons.usa.pennsylvania,benjamin.emert.usa.pennsylvania,eduardo.torre.usa.pennsylvania,allison.cote.usa.pennsylvania,alessandra.sullivan.usa.washington,john_a.stamatoyannopoulos.usa.washington,arjun.raj.usa.pennsylvania"
3159,3159,2018,11,Nature communications,Structural insights into the function of type VI secretion system TssA subunits,"samuel_r.dix.united_kingdom.sheffield,hayley_j.owen.united_kingdom.sheffield,ruyue.sun.united_kingdom.sheffield,asma.ahmad.united_kingdom.sheffield,sravanthi.shastri.united_kingdom.sheffield,helena_l.spiewak.united_kingdom.sheffield,daniel_j.mosby.united_kingdom.sheffield,matthew_j.harris.united_kingdom.sheffield,sarah_l.batters.united_kingdom.sheffield,thomas_a.brooker.united_kingdom.sheffield,svetomir_b.tzokov.united_kingdom.sheffield,svetlana_e.sedelnikova.united_kingdom.sheffield,patrick_j.baker.united_kingdom.sheffield,per_a.bullough.united_kingdom.sheffield,david_w.rice.united_kingdom.sheffield,mark_s.thomas.united_kingdom.sheffield"
3161,3161,2018,11,Nature communications,Neural mechanisms for learning self and other ownership,"patricia_l.lockwood.united_kingdom.oxford,marco_k.wittmann.united_kingdom.oxford,matthew_a_j.apps.united_kingdom.oxford,miriam_c.kleinflgge.united_kingdom.oxford,molly_j.crockett.united_kingdom.oxford,glyn_w.humphreys.united_kingdom.oxford,matthew_f_s.rushworth.united_kingdom.oxford"
3162,3162,2018,11,Nature communications,Defective DNA damage repair leads to frequent catastrophic genomic events in murine and human tumors,"manasi.ratnaparkhe.germany.heidelberg,john_k_l.wong.germany.heidelberg,mario.hlevnjak.germany.heidelberg,thorsten.kolb.germany.heidelberg,milena.simovic.germany.heidelberg,daniel.haag.germany.heidelberg,yashna.paul.germany.heidelberg,frauke.devens.germany.heidelberg,paul.northcott.germany.heidelberg,david_t_w.jones.germany.heidelberg,marcel.kool.germany.heidelberg,anna.jauch.germany.heidelberg,andrey.korshunov.germany.heidelberg,rajiv.kumar.germany.heidelberg,stefan_m.pfister.germany.heidelberg,marc.zapatka.germany.heidelberg,peter.lichter.germany.heidelberg,aurlie.ernst.germany.heidelberg"
3163,3163,2018,11,Nature communications,Pathway-based subnetworks enable cross-disease biomarker discovery,"syed.haider.canada.toronto,cindy_q.yao.canada.toronto,vicky_s.sabine.canada.toronto,michal.grzadkowski.canada.toronto,vincent.stimper.canada.toronto,maud_h_w.starmans.canada.toronto,jianxin.wang.canada.toronto,francis.nguyen.canada.toronto,nathalie_c.moon.canada.toronto,xihui.lin.canada.toronto,camilla.drake.canada.toronto,cheryl_a.crozier.canada.toronto,cassandra_l.brookes.united_kingdom.birmingham,cornelis_j_h.van_de_velde.netherlands.leiden,annette.hasenburg.germany.freiburg,dirk_g.kieback.germany.marl,christos_j.markopoulos.greece.athens,caroline.seynaeve.netherlands.rotterdam,daniel_w.rea.united_kingdom.birmingham,arek.kasprzyk.canada.toronto,philippe.lambin.netherlands.maastricht,pietro.lio.united_kingdom.cambridge,john_m_s.bartlett.canada.toronto,paul_c.boutros.canada.toronto"
3164,3164,2018,11,Nature communications,Calcium stabilizes the strongest protein fold,"lukas_f.milles.germany.munich,eduard_m.unterauer.germany.munich,thomas.nicolaus.germany.munich,hermann_e.gaub.germany.munich"
3167,3167,2018,11,Nature communications,Dehydrative π-extension to nanographenes with zig-zag edges,"dominik.lungerich.germany.erlangen,olena.papaianina.germany.erlangen,mikhail.feofanov.germany.erlangen,jia.liu.germany.erlangen,mirunalini.devarajulu.germany.erlangen,sergey_i.troyanov.russia.moscow,sabine.maier.germany.erlangen,konstantin.amsharov.germany.erlangen"
3169,3169,2018,11,Nature communications,REX1 is the critical target of RNF12 in imprinted X chromosome inactivation in mice,"cristina.gontan.netherlands.rotterdam,hegias.mirabontenbal.netherlands.rotterdam,aristea.magaraki.netherlands.rotterdam,catherine.dupont.netherlands.rotterdam,tahsin_stefan.barakat.netherlands.rotterdam,eveline.rentmeester.netherlands.rotterdam,jeroen.demmers.netherlands.rotterdam,joost.gribnau.netherlands.rotterdam"
3170,3170,2018,11,Nature communications,Large-area and adaptable electrospun silicon-based thermoelectric nanomaterials with high energy conversion efficiencies,"alex.morata.spain.barcelona,merc.pacios.spain.barcelona,gerard.gadea.spain.barcelona,cristina.flox.spain.barcelona,doris.cadavid.spain.barcelona,andreu.cabot.spain.barcelona,albert.tarancn.spain.barcelona"
3173,3173,2018,11,Nature communications,Publisher Correction: EMT cells increase breast cancer metastasis via paracrine GLI activation in neighbouring tumour cells,"deepika.neelakantan.usa.colorado,hengbo.zhou.usa.colorado,michael_u_j.oliphant.usa.colorado,xiaomei.zhang.usa.texas,david_m.henke.usa.texas,chad_a.shaw.usa.texas,mengfen.wu.usa.texas,susan_g.hilsenbeck.usa.texas,lisa_d.white.usa.texas,michael_t.lewis.usa.texas,heide_l.ford.usa.colorado"
3174,3174,2018,11,Nature communications,Microevolution of Neisseria lactamica during nasopharyngeal colonisation induced by controlled human infection,"anish.pandey.united_kingdom.southampton,david_w.cleary.united_kingdom.southampton,jay_r.laver.united_kingdom.southampton,alice_m.deasy.united_kingdom.sheffield,adam_p.dale.united_kingdom.southampton,paul_d.morris.united_kingdom.sheffield,xavier.didelot.united_kingdom.london,martin_c_j.maiden.united_kingdom.oxford,robert_c.read.united_kingdom.southampton"
3175,3175,2018,11,Nature communications,Genotype specific pathogenicity of hepatitis E virus at the human maternal-fetal interface,"jordi.gouilly.france.toulouse,qian.chen.france.toulouse,graldine.cartron.france.toulouse,martine.dubois.france.toulouse,reem.aldaccak.france.paris,jacques.izopet.france.toulouse,nabila.jabraneferrat.france.toulouse,hicham.el_costa.france.toulouse"
3176,3176,2018,11,Nature communications,Author Correction: Promoter interactome of human embryonic stem cell-derived cardiomyocytes connects GWAS regions to cardiac gene networks,"munkit.choy.united_kingdom.manchester,biola_m.javierre.united_kingdom.cambridge,simon_g.williams.united_kingdom.manchester,stephanie_l.baross.united_kingdom.manchester,yingjuan.liu.united_kingdom.manchester,steven_w.wingett.united_kingdom.cambridge,artur.akbarov.united_kingdom.manchester,chris.wallace.united_kingdom.cambridge,paula.freirepritchett.united_kingdom.cambridge,peter_j.rugggunn.united_kingdom.cambridge,mikhail.spivakov.united_kingdom.cambridge,peter.fraser.united_kingdom.cambridge,bernard_d.keavney.united_kingdom.manchester"
3178,3178,2018,11,Nature communications,High-throughput three-dimensional chemotactic assays reveal steepness-dependent complexity in neuronal sensation to molecular gradients,"zhen.xu.china.kowloon,peilin.fang.china.kowloon,bingzhe.xu.china.kowloon,yufeng.lu.china.kowloon,jinghui.xiong.china.kowloon,feng.gao.china.kowloon,xin.wang.china.kowloon,jun.fan.china.kowloon,peng.shi.china.kowloon"
3179,3179,2018,11,Nature communications,Light-controlled switching of the spin state of iron(III),"sreejith.shankar.germany.kiel,morten.peters.germany.kiel,kim.steinborn.germany.kiel,bahne.krahwinkel.germany.kiel,frank_d.snnichsen.germany.kiel,dirk.grote.germany.bochum,wolfram.sander.germany.bochum,thomas.lohmiller.germany.mulheim,olaf.rdiger.germany.mulheim,rainer.herges.germany.kiel"
3181,3181,2018,11,Nature communications,Dynamic Greenland ice sheet driven by pCO<sub>2</sub> variations across the Pliocene Pleistocene transition,"ning.tan.france.yvette,jeanbaptiste.ladant.france.yvette,gilles.ramstein.france.yvette,christophe.dumas.france.yvette,eystein.jansen.norway.bergen"
3186,3186,2018,11,PLoS computational biology,Oscillations in working memory and neural binding: A mechanism for multiple memories and their interactions,"jason_e.pina.usa.pennsylvania,mark.bodner.usa.california,bard.ermentrout.usa.pennsylvania"
3187,3187,2018,11,PLoS computational biology,Functional mechanisms underlie the emergence of a diverse range of plasticity phenomena,"james_a.henderson.australia.sydney,pulin.gong.australia.sydney"
3188,3188,2018,11,PLoS computational biology,Visual physiology of the layer 4 cortical circuit in silico,"anton.arkhipov.usa.washington,nathan_w.gouwens.usa.washington,yazan_n.billeh.usa.washington,sergey.gratiy.usa.washington,ramakrishnan.iyer.usa.washington,ziqiang.wei.usa.virginia,reza.abbasiasl.usa.washington,jim.berg.usa.washington,michael.buice.usa.washington,nicholas.cain.usa.washington,nuno.da_costa.usa.washington,saskia.de_vries.usa.washington,daniel.denman.usa.washington,severine.durand.usa.washington,david.feng.usa.washington,tim.jarsky.usa.washington,jrme.lecoq.usa.washington,brian.lee.usa.washington,lu.li.usa.washington,stefan.mihalas.usa.washington,gabriel_k.ocker.usa.washington,shawn_r.olsen.usa.washington,r_clay.reid.usa.washington,staci_a.sorensen.usa.washington,quanxin.wang.usa.washington,jack.waters.usa.washington,massimo.scanziani.usa.california,christof.koch.usa.washington"
3189,3189,2018,11,PLoS genetics,The zinc finger protein DCM1 is required for male meiotic cytokinesis by preserving callose in rice,"chao.zhang.china.beijing,yi.shen.china.beijing,ding.tang.china.beijing,wenqing.shi.china.beijing,dongmei.zhang.china.beijing,guijie.du.china.beijing,yihua.zhou.china.beijing,guohua.liang.china.yangzhou,yafei.li.china.beijing,zhukuan.cheng.china.beijing"
3191,3191,2018,11,PLoS genetics,Replicative and non-replicative mechanisms in the formation of clustered CNVs are indicated by whole genome characterization,"lusine.nazaryanpetersen.denmark.copenhagen,jesper.eisfeldt.sweden.stockholm,maria.pettersson.sweden.stockholm,johanna.lundin.sweden.stockholm,daniel.nilsson.sweden.stockholm,josephine.wincent.sweden.stockholm,agne.lieden.sweden.stockholm,lovisa.lovmar.sweden.gothenburg,jesper.ottosson.sweden.gothenburg,outi.mkitie.sweden.stockholm,ann.nordgren.sweden.stockholm,francesco.vezzi.sweden.stockholm,valtteri.wirta.sweden.stockholm,max.kller.sweden.stockholm,tina_duelund.hjortshj.denmark.glostrup,cathrine.jespersgaard.denmark.glostrup,rayan.houssari.denmark.glostrup,laura.pignata.denmark.glostrup,mads.bak.denmark.copenhagen,niels.tommerup.denmark.copenhagen,elisabeth_syk.lundberg.sweden.stockholm,zeynep.tmer.denmark.glostrup,anna.lindstrand.sweden.stockholm"
3193,3193,2018,11,PLoS genetics,Function and regulation of the Caenorhabditis elegans Rab32 family member GLO-1 in lysosome-related organelle biogenesis,"caitlin.morris.usa.oregon,olivia_k.foster.usa.oregon,simran.handa.usa.oregon,kimberly.peloza.usa.oregon,laura.voss.usa.oregon,hannah.somhegyi.usa.oregon,youli.jian.china.beijing,my_van.vo.usa.oregon,marie.harp.usa.oregon,fiona_m.rambo.usa.oregon,chonglin.yang.china.beijing,greg_j.hermann.usa.oregon"
3194,3194,2018,11,PLoS genetics,Identification of Elg1 interaction partners and effects on post-replication chromatin re-formation,"vamsi_k.gali.united_kingdom.aberdeen,david.dickerson.united_kingdom.dundee,yuki.katou.japan.tokyo,katsunori.fujiki.japan.tokyo,katsuhiko.shirahige.japan.tokyo,tom.owenhughes.united_kingdom.dundee,takashi.kubota.united_kingdom.aberdeen,anne_d.donaldson.united_kingdom.aberdeen"
3195,3195,2018,11,PLoS genetics,Arabidopsis class I formins control membrane-originated actin polymerization at pollen tube tips,"yaxian.lan.china.beijing,xiaonan.liu.china.beijing,ying.fu.china.beijing,shanjin.huang.china.beijing"
3196,3196,2018,11,PLoS genetics,Single-cell RNA-sequencing reveals transcriptional dynamics of estrogen-induced dysplasia in the ovarian surface epithelium,"nhung_h.vuong.canada.ottawa,david_p.cook.canada.ottawa,laura_a.forrest.canada.ottawa,lauren_e.carter.canada.ottawa,pascale.robineaucharette.canada.ottawa,joshua_m.kofsky.canada.ottawa,kendra_m.hodgkinson.canada.ottawa,barbara_c.vanderhyden.canada.ottawa"
3203,3203,2018,11,PLoS neglected tropical diseases,"Serological evidence of inter-epizootic/inter-epidemic circulation of Rift Valley fever virus in domestic cattle in Kyela and Morogoro, Tanzania","mirende_kichuki.matiko.tanzania.morogoro,linda_peniel.salekwa.tanzania.morogoro,christopher_jacob.kasanga.tanzania.morogoro,sharadhuli_idd.kimera.tanzania.morogoro,wambura_philemon.nyangi.tanzania.morogoro"
3205,3205,2018,11,PLoS neglected tropical diseases,Estimation of HTLV-1 vertical transmission cases in Brazil per annum,"carolina.rosadas.united_kingdom.london,bassit.malik.united_kingdom.london,graham_p.taylor.united_kingdom.london"
3206,3206,2018,11,PLoS neglected tropical diseases,Genetic characteristics of Bacillus anthracis isolated from northwestern China from 1990 to 2016,"huijuan.zhang.china.beijing,enmin.zhang.china.beijing,jinrong.he.china.beijing,wei.li.china.beijing,jianchun.wei.china.beijing"
3209,3209,2018,11,PLoS neglected tropical diseases,Estimating the elimination feasibility in the 'end game' of control efforts for parasites subjected to regular mass drug administration: Methods and their application to schistosomiasis,"arathi.arakala.australia.melbourne,christopher_m.hoover.usa.california,john_m.marshall.usa.california,susanne_h.sokolow.usa.california,giulio_a.de_leo.usa.california,jason_r.rohr.usa.florida,justin_v.remais.usa.california,manoj.gambhir.australia.melbourne"
3211,3211,2018,11,PLoS pathogens,Lassa virus activates myeloid dendritic cells but suppresses their ability to stimulate T cells,"justine.schaeffer.france.lyon,xavier.carnec.france.lyon,stphanie.reynard.france.lyon,mathieu.mateo.france.lyon,caroline.picard.france.lyon,natalia.pietrosemoli.france.paris,marieagns.dillies.france.paris,sylvain.baize.france.lyon"
