,Unnamed: 0.1,pub_year,pub_month,journal_name,paper_title,author
3619,3619,2018,11,Cell,Nonoscillatory Phase Coding and Synchronization in the Bat Hippocampal Formation,"tamir.eliav.israel.rehovot,maya.gevasagiv.israel.jerusalem,michael_m.yartsev.israel.rehovot,arseny.finkelstein.israel.rehovot,alon.rubin.israel.rehovot,liora.las.israel.rehovot,nachum.ulanovsky.israel.rehovot"
3620,3620,2018,11,Cell,Spatial Reconstruction of Single Enterocytes Uncovers Broad Zonation along the Intestinal Villus Axis,"andreas_e.moor.israel.rehovot,yotam.harnik.israel.rehovot,shani.benmoshe.israel.rehovot,efi_e.massasa.israel.rehovot,milena.rozenberg.israel.rehovot,raya.eilam.israel.rehovot,keren.bahar_halpern.israel.rehovot,shalev.itzkovitz.israel.rehovot"
3621,3621,2018,11,Cell,The Mevalonate Pathway Is a Druggable Target for Vaccine Adjuvant Discovery,"yun.xia.china.beijing,yonghua.xie.china.beijing,zhengsen.yu.china.beijing,hongying.xiao.china.chengdu,guimei.jiang.china.chengdu,xiaoying.zhou.china.beijing,yunyun.yang.china.beijing,xin.li.china.beijing,meng.zhao.china.beijing,liping.li.china.beijing,mingke.zheng.china.beijing,shuai.han.china.beijing,zhaoyun.zong.china.beijing,xianbin.meng.china.beijing,haiteng.deng.china.beijing,huahu.ye.china.beijing,yunzhi.fa.china.beijing,haitao.wu.china.beijing,xiaoyu.hu.china.beijing,wanli.liu.china.beijing,yan.shi.canada.calgary,yonghui.zhang.china.chengdu"
3622,3622,2018,11,Cell stem cell,SUMO Safeguards Somatic and Pluripotent Cell Identities by Enforcing Distinct Chromatin States,"jackchristophe.cossec.france.paris,ilan.theurillat.france.paris,claudia.chica.france.paris,sabela.ba_agun.france.paris,alexandra.andrieux.france.paris,gregory.jouvion.france.paris,han.li.france.paris,guillaume.bossis.france.montpellier,jacobsebastian.seeler.france.paris,anne.dejean.france.paris"
3624,3624,2018,11,Cell stem cell,"Orienting Muscle Stem Cells for Regeneration in Homeostasis, Aging, and Disease","peter.feige.canada.ottawa,caroline_e.brun.canada.ottawa,morten.ritso.canada.ottawa,michael_a.rudnicki.canada.ottawa"
3626,3626,2018,11,Cell stem cell,More than One Way to Skin a Wound,"roi.ankawa.israel.haifa,yaron.fuchs.israel.haifa"
3631,3631,2018,11,Cell stem cell,Mice from Same-Sex Parents: CRISPRing Out the Barriers for Unisexual Reproduction,"ido.sagi.israel.jerusalem,shiran.bar.israel.jerusalem,nissim.benvenisty.israel.jerusalem"
3633,3633,2018,11,Cell stem cell,Generation of Bimaternal and Bipaternal Mice from Hypomethylated Haploid ESCs with Imprinting Region Deletions,"zhikun.li.china.beijing,leyun.wang.china.beijing,libin.wang.china.beijing,guihai.feng.china.beijing,xuewei.yuan.china.harbin,chao.liu.china.beijing,kai.xu.china.beijing,yuhuan.li.china.beijing,haifeng.wan.china.beijing,ying.zhang.china.beijing,yufei.li.china.beijing,xin.li.china.beijing,wei.li.china.beijing,qi.zhou.china.beijing,baoyang.hu.china.beijing"
3638,3638,2018,11,Cell stem cell,Transcription Factors Drive Tet2-Mediated Enhancer Demethylation to Reprogram Cell Fate,"jose_luis.sardina.spain.barcelona,samuel.collombet.france.paris,tian_v.tian.spain.barcelona,antonio.gmez.spain.barcelona,bruno.di_stefano.usa.massachusetts,clara.berenguer.spain.barcelona,justin.brumbaugh.usa.massachusetts,ralph.stadhouders.spain.barcelona,carolina.seguramorales.spain.barcelona,marta.gut.spain.barcelona,ivo_g.gut.spain.barcelona,simon.heath.spain.barcelona,sergi.aranda.spain.barcelona,luciano.di_croce.spain.barcelona,konrad.hochedlinger.usa.massachusetts,denis.thieffry.france.paris,thomas.graf.spain.barcelona"
3641,3641,2018,11,Nature biomedical engineering,Muted fibrosis from protected islets,"alexander_e.vlahos.canada.toronto,michael_v.sefton.canada.toronto"
3649,3649,2018,11,Nature biotechnology,"Evaluation of 244,000 synthetic sequences reveals design principles to optimize translation in Escherichia coli","guillaume.cambray.usa.california,joao_c.guimaraes.usa.california,adam_paul.arkin.usa.california"
3651,3651,2018,11,Nature biotechnology,Conversion of staphylococcal pathogenicity islands to CRISPR-carrying antibacterial agents that cure infections in mice,"geeta.ram.usa.newyork,hope_f.ross.usa.newyork,richard_p.novick.usa.newyork,ivelisse.rodriguezpagan.usa.newyork,dunrong.jiang.usa.newyork"
3652,3652,2018,11,Nature biotechnology,Paired-cell sequencing enables spatial gene expression mapping of liver endothelial cells,"keren_bahar.halpern.israel.rehovot,rom.shenhav.israel.rehovot,hassan.massalha.israel.rehovot,beata.toth.israel.rehovot,adi.egozi.israel.rehovot,efi_e.massasa.israel.rehovot,chiara.medgalia.israel.rehovot,eyal.david.israel.rehovot,amir.giladi.israel.rehovot,andreas_e.moor.israel.rehovot,ziv.porat.israel.rehovot,ido.amit.israel.rehovot,shalev.itzkovitz.israel.rehovot"
3653,3653,2018,11,Nature biotechnology,Mood variations decoded from multi-site intracranial human brain activity,"omid_g.sani.usa.california,yuxiao.yang.usa.california,morgan_b.lee.usa.california,heather_e.dawes.usa.california,edward_f.chang.usa.california,maryam_m.shanechi.usa.california"
3655,3655,2018,11,Nature biotechnology,Efficient base editing in methylated regions with a human APOBEC3A-Cas9 fusion,"xiao.wang.china.shanghai,jianan.li.china.shanghai,ying.wang.china.shanghai,bei.yang.china.shanghai,jia.wei.china.shanghai,jing.wu.china.shanghai,ruixuan.wang.china.shanghai,xingxu.huang.china.shanghai,jia.chen.china.shanghai,li.yang.china.shanghai"
3656,3656,2018,11,Nature biotechnology,An APOBEC3A-Cas9 base editor with minimized bystander and off-target activities,"jason_m.gehrke.usa.massachusetts,oliver.cervantes.usa.massachusetts,m_kendell.clement.usa.massachusetts,yuxuan.wu.usa.massachusetts,jing.zeng.usa.massachusetts,daniel_e.bauer.usa.massachusetts,luca.pinello.usa.massachusetts,j_keith.joung.usa.massachusetts"
3658,3658,2018,11,Nature cell biology,Pancreatic islet-autonomous insulin and smoothened-mediated signalling modulate identity changes of glucagon<sup>+</sup> α-cells,"valentina.cigliola.switzerland.geneva,luiza.ghila.switzerland.geneva,fabrizio.thorel.switzerland.geneva,lon.van_gurp.switzerland.geneva,delphine.baronnier.switzerland.geneva,daniel.oropeza.switzerland.geneva,simone.gupta.india.indianapolis,takeshi.miyatsuka.japan.tokyo,hideaki.kaneto.japan.osaka,melissa_k.thomas.india.indianapolis,kenichiro.furuyama.switzerland.geneva,simona.chera.switzerland.geneva,pedro_l.herrera.switzerland.geneva"
3659,3659,2018,11,Nature cell biology,Reticular adhesions are a distinct class of cell-matrix adhesions that mediate attachment during mitosis,"john_g.lock.australia.sydney,matthew_c.jones.united_kingdom.manchester,janet_a.askari.united_kingdom.manchester,xiaowei.gong.sweden.huddinge,anna.oddone.spain.barcelona,helene.olofsson.sweden.huddinge,sara.gransson.sweden.huddinge,melike.lakadamyali.spain.barcelona,martin_j.humphries.united_kingdom.manchester,staffan.strmblad.sweden.huddinge"
3665,3665,2018,11,Nature cell biology,Sequential formation and resolution of multiple rosettes drive embryo remodelling after implantation,"neophytos.christodoulou.united_kingdom.cambridge,christos.kyprianou.united_kingdom.cambridge,antonia.weberling.united_kingdom.cambridge,ran.wang.china.shanghai,guizhong.cui.china.shanghai,guangdun.peng.china.shanghai,naihe.jing.china.shanghai,magdalena.zernickagoetz.united_kingdom.cambridge"
3666,3666,2018,11,Nature cell biology,The cryo-EM structure of intraflagellar transport trains reveals how dynein is inactivated to ensure unidirectional anterograde movement in cilia,"mareike_a.jordan.germany.dresden,dennis_r.diener.germany.dresden,ludek.stepanek.germany.dresden,gaia.pigino.germany.dresden"
3668,3668,2018,11,Nature cell biology,CRISPR-Cas9-mediated base-editing screening in mice identifies DND1 amino acids that are critical for primordial germ cell development,"qing.li.china.shanghai,yanjing.li.china.shanghai,suming.yang.china.shanghai,shuo.huang.china.shanghai,meng.yan.china.shanghai,yifu.ding.china.shanghai,wei.tang.china.shanghai,xiwen.lou.china.shanghai,qi.yin.china.shanghai,zhanfei.sun.china.shanghai,lei.lu.china.shanghai,huijuan.shi.china.shanghai,hongyan.wang.china.shanghai,yong.chen.china.shanghai,jinsong.li.china.shanghai"
3676,3676,2018,11,Nature chemistry,Chromopynones are pseudo natural product glucose uptake inhibitors targeting glucose transporters GLUT-1 and -3,"george.karageorgis.germany.dortmund,elena_s.reckzeh.germany.dortmund,javier.ceballos.germany.dortmund,melanie.schwalfenberg.germany.dortmund,sonja.sievers.germany.dortmund,claude.ostermann.germany.dortmund,axel.pahl.germany.dortmund,slava.ziegler.germany.dortmund,herbert.waldmann.germany.dortmund"
3677,3677,2018,11,Nature chemistry,"Easy as one, two, three","laura.castoldi.austria.vienna,vittorio.pace.austria.vienna"
3678,3678,2018,11,Nature chemistry,Stereoselective synthesis of a composite knot with nine crossings,"liang.zhang.united_kingdom.manchester,alexander_j.stephens.united_kingdom.manchester,alina_l.nussbaumer.united_kingdom.manchester,jeanfranois.lemonnier.united_kingdom.manchester,pia.jurek.united_kingdom.manchester,iigo_j.vitoricayrezabal.united_kingdom.manchester,david_a.leigh.united_kingdom.manchester"
3679,3679,2018,11,Nature chemistry,Gas-phase sugar formation using hydroxymethylene as the reactive formaldehyde isomer,"andr_k.eckhardt.germany.giessen,michael_m.linden.germany.giessen,raffael_c.wende.germany.giessen,bastian.bernhardt.germany.giessen,peter_r.schreiner.germany.giessen"
3682,3682,2018,11,Nature chemistry,A fluorescent membrane tension probe,"adai.colom.switzerland.geneva,emmanuel.derivery.switzerland.geneva,saeideh.soleimanpour.switzerland.geneva,caterina.tomba.switzerland.geneva,marta_dal.molin.switzerland.geneva,naomi.sakai.switzerland.geneva,marcos.gonzlezgaitn.switzerland.geneva,stefan.matile.switzerland.geneva,aurlien.roux.switzerland.geneva"
3683,3683,2018,11,Nature chemistry,Micrometre-long covalent organic fibres by photoinitiated chain-growth radical polymerization on an alkali-halide surface,"franck.para.france.marseille,franck.bocquet.france.marseille,laurent.nony.france.marseille,christian.loppacher.france.marseille,david_z.gao.united_kingdom.london,filippo.federici_canova.united_kingdom.london,matthew_b.watkins.united_kingdom.lincoln"
3684,3684,2018,11,Nature chemistry,Efficient and stereodivergent synthesis of unsaturated acyclic fragments bearing contiguous stereogenic elements,"jeffrey.bruffaerts.israel.haifa,david.pierrot.israel.haifa,ilan.marek.israel.haifa"
3685,3685,2018,11,Nature chemistry,Non-intuitive rotational reorientation in collisions of NO(A <sup>2</sup>Σ<sup>+</sup>) with Ne from direct measurement of a four-vector correlation,"thomas_r.sharples.united_kingdom.edinburgh,joseph_g.leng.united_kingdom.edinburgh,thomas_f_m.luxford.united_kingdom.edinburgh,kenneth_g.mckendrick.united_kingdom.edinburgh,pablo_g.jambrina.spain.madrid,f_javier.aoiz.spain.madrid,matthew_l.costen.united_kingdom.edinburgh"
3687,3687,2018,11,Nature chemistry,Enzyme-powered motility in buoyant organoclay/DNA protocells,"b_v_v_s_pavan.kumar.united_kingdom.bristol,avinash_j.patil.united_kingdom.bristol,stephen.mann.united_kingdom.bristol"
3688,3688,2018,11,Nature chemistry,Hydrolytic stability in hemilabile metal-organic frameworks,"lauren_n.mchugh.united_kingdom.standrews,matthew_j.mcpherson.united_kingdom.standrews,laura_j.mccormick.united_kingdom.standrews,samuel_a.morris.united_kingdom.standrews,paul_s.wheatley.united_kingdom.standrews,david.mckay.united_kingdom.standrews,daniel_m.dawson.united_kingdom.standrews,charlotte_e_f.sansome.united_kingdom.standrews,sharon_e.ashbrook.united_kingdom.standrews,russell_e.morris.united_kingdom.standrews"
3693,3693,2018,11,Nature chemical biology,Parsing protein sulfinic acid switches,"sophie.rahuelclermont.france.nancy,michel_b.toledano.france.yvette"
3700,3700,2018,11,Nature chemical biology,MCT2 mediates concentration-dependent inhibition of glutamine metabolism by MOG,"louise.fets.united_kingdom.london,paul_c.driscoll.united_kingdom.london,fiona.grimm.united_kingdom.london,aakriti.jain.united_kingdom.london,patrcia_m.nunes.united_kingdom.london,michalis.gounis.united_kingdom.london,ginevra.doglioni.united_kingdom.london,george.papageorgiou.united_kingdom.london,timothy_j.ragan.united_kingdom.london,sebastien.campos.united_kingdom.stevenage,mariana.silva_dos_santos.united_kingdom.london,james_i.macrae.united_kingdom.london,nicola.oreilly.united_kingdom.london,alan_j.wright.united_kingdom.cambridge,david.house.united_kingdom.stevenage,dimitrios.anastasiou.united_kingdom.london"
3703,3703,2018,11,Nature chemical biology,Acetate-dependent tRNA acetylation required for decoding fidelity in protein synthesis,"takaaki.taniguchi.japan.tokyo,kenjyo.miyauchi.japan.tokyo,yuriko.sakaguchi.japan.tokyo,seisuke.yamashita.japan.chiba,akiko.soma.japan.chiba,kozo.tomita.japan.chiba,tsutomu.suzuki.japan.tokyo"
3705,3705,2018,11,Nature communications,Metasurface eyepiece for augmented reality,"gunyeal.lee.south_korea.seoul,jongyoung.hong.south_korea.seoul,soonhyoung.hwang.south_korea.daejeon,seokil.moon.south_korea.seoul,hyeokjung.kang.south_korea.daejeon,sohee.jeon.south_korea.daejeon,junho.jeong.south_korea.daejeon,byoungho.lee.south_korea.seoul"
3709,3709,2018,11,Nature communications,Three-dimensional topological acoustic crystals with pseudospin-valley coupled saddle surface states,"cheng.he.china.nanjing,siyuan.yu.china.nanjing,hao.ge.china.nanjing,huaiqiang.wang.china.nanjing,yuan.tian.china.nanjing,haijun.zhang.china.nanjing,xiaochen.sun.china.nanjing,y_b.chen.china.nanjing,jian.zhou.china.nanjing,minghui.lu.china.nanjing,yanfeng.chen.china.nanjing"
3710,3710,2018,11,Nature communications,Non-resonant light scattering in dispersions of 2D nanosheets,"andrew.harvey.ireland.dublin,claudia.backes.germany.heidelberg,john_b.boland.ireland.dublin,xiaoyun.he.ireland.dublin,aideen.griffin.ireland.dublin,beata.szydlowska.ireland.dublin,cian.gabbett.ireland.dublin,john_f.donegan.ireland.dublin,jonathan_n.coleman.ireland.dublin"
3712,3712,2018,11,Nature communications,Author Correction: Gap junction protein Connexin-43 is a direct transcriptional regulator of N-cadherin in vivo,"maria.kotini.united_kingdom.london,elias_h.barriga.united_kingdom.london,jonathan.leslie.united_kingdom.london,marc.gentzel.germany.dresden,verena.rauschenberger.germany.erlangen,alexandra.schambony.germany.erlangen,roberto.mayor.united_kingdom.london"
3713,3713,2018,11,Nature communications,Transcriptional read-through of the long non-coding RNA SVALKA governs plant cold acclimation,"peter.kindgren.denmark.frederiksberg,ryan.ard.denmark.frederiksberg,maxim.ivanov.denmark.frederiksberg,sebastian.marquardt.denmark.frederiksberg"
3714,3714,2018,11,Nature communications,Direct oxygen isotope effect identifies the rate-determining step of electrocatalytic OER at an oxidic surface,"sandra.haschke.germany.erlangen,michael.mader.germany.erlangen,stefanie.schlicht.germany.erlangen,andr_m.roberts.germany.erlangen,alfredo_m.angelesboza.usa.north,johannes_a_c.barth.germany.erlangen,julien.bachmann.germany.erlangen"
3715,3715,2018,11,Nature communications,Distinct functional elements for outer-surface anti-interference and inner-wall ion gating of nanochannels,"pengcheng.gao.china.wuhan,qun.ma.china.wuhan,defang.ding.china.wuhan,dagui.wang.china.wuhan,xiaoding.lou.china.wuhan,tianyou.zhai.china.wuhan,fan.xia.china.wuhan"
3717,3717,2018,11,Nature communications,The impact of Arctic sea ice loss on mid-Holocene climate,"hyoseok.park.south_korea.daejeon,seongjoong.kim.south_korea.incheon,kyonghwan.seo.south_korea.busan,seoyeon.kim.south_korea.seoul,seokwoo.son.south_korea.seoul"
3719,3719,2018,11,Nature communications,Microfluidic-spinning construction of black-phosphorus-hybrid microfibres for non-woven fabrics toward a high energy density flexible supercapacitor,"xingjiang.wu.china.nanjing,yijun.xu.china.suzhou,ying.hu.china.hefei,guan.wu.china.nanjing,hengyang.cheng.china.nanjing,qiang.yu.china.suzhou,kai.zhang.china.suzhou,wei.chen.china.suzhou,su.chen.china.nanjing"
3722,3722,2018,11,Nature communications,TRPV4 and KRAS and FGFR1 gain-of-function mutations drive giant cell lesions of the jaw,"carolina_cavalieri.gomes.canada.montreal,tenzin.gayden.canada.montreal,andrea.bajic.canada.montreal,jonathan.pratt.canada.montreal,hamid.nikbakht.canada.montreal,eric.bareke.canada.montreal,pascal.stonge.canada.montreal,daniel.sinnett.canada.montreal,hyerim.han.canada.montreal,barbara.rivera.canada.montreal,leonie_g.mikael.canada.montreal,nicolas.de_jay.canada.montreal,claudia_l.kleinman.canada.montreal,elvis_terci.valera.canada.montreal,angelia_v.bassenden.canada.montreal,jacek.majewski.canada.montreal,ricardo_santiago.gomez.canada.montreal,nada.jabado.canada.montreal"
3724,3724,2018,11,Nature communications,Disease-relevant transcriptional signatures identified in individual smooth muscle cells from healthy mouse vessels,"lina.dobnikar.united_kingdom.cambridge,annabel_l.taylor.united_kingdom.cambridge,joel.chappell.united_kingdom.cambridge,phoebe.oldach.united_kingdom.cambridge,jennifer_l.harman.united_kingdom.cambridge,erin.oerton.united_kingdom.cambridge,elaine.dzierzak.united_kingdom.edinburgh,martin_r.bennett.united_kingdom.cambridge,mikhail.spivakov.united_kingdom.cambridge,helle_f.jrgensen.united_kingdom.cambridge"
3725,3725,2018,11,Nature communications,Short-chain ketone production by engineered polyketide synthases in Streptomyces albus,"satoshi.yuzawa.usa.california,mona.mirsiaghi.usa.california,renee.jocic.usa.california,tatsuya.fujii.usa.california,fabrice.masson.usa.california,veronica_t.benites.usa.california,edward_e_k.baidoo.usa.california,eric.sundstrom.usa.california,deepti.tanjore.usa.california,todd_r.pray.usa.california,anthe.george.usa.california,ryan_w.davis.usa.california,john_m.gladden.usa.california,blake_a.simmons.usa.california,leonard.katz.usa.california,jay_d.keasling.usa.california"
3726,3726,2018,11,Nature communications,Vapor detection and discrimination with a panel of odorant receptors,"hitoshi.kida.usa.durham,yosuke.fukutani.usa.durham,joel_d.mainland.usa.durham,claire_a.de_march.usa.durham,aashutosh.vihani.usa.durham,yun_rose.li.usa.durham,qiuyi.chi.usa.durham,akemi.toyama.usa.durham,linda.liu.usa.durham,masaharu.kameda.japan.tokyo,masafumi.yohda.japan.tokyo,hiroaki.matsunami.usa.durham"
3729,3729,2018,11,Nature ecology & evolution,Phylogenetic patterns and phenotypic profiles of the species of plants and mammals farmed for food,"rubn.milla.spain.mostoles,jess_m.bastida.spain.mostoles,glynis.jones.united_kingdom.sheffield,cyrille.violle.france.montpellier,colin_p.osborne.united_kingdom.sheffield,julia.chacnlabella.spain.mostoles,jens.kattge.germany.jena,estelle.forey.france.mont,vanessa.minden.belgium.brussels,johannes_h_c.cornelissen.netherlands.amsterdam,bernard.amiaud.france.vandoeuvrelesnancy,koen.kramer.netherlands.wageningen,gerhard.boenisch.germany.jena,tianhua.he.australia.perth,valrio_d.pillar.brazil.porto,chaeho.byun.south_korea.seoul"
3730,3730,2018,11,Nature ecology & evolution,Clade-specific diversification dynamics of marine diatoms since the Jurassic,"eric.lewitus.france.paris,lucie.bittner.france.paris,shruti.malviya.france.paris,chris.bowler.france.paris,hlne.morlon.france.paris"
3731,3731,2018,11,Nature ecology & evolution,Towards reconstructing the ancestral brain gene-network regulating caste differentiation in ants,"bitao.qiu.denmark.copenhagen,rasmus_stenbak.larsen.denmark.copenhagen,nichen.chang.taiwan.taipei,john.wang.taiwan.taipei,jacobus_j.boomsma.denmark.copenhagen,guojie.zhang.denmark.copenhagen"
3737,3737,2018,11,Nature ecology & evolution,Searching for sponge origins,"joseph_p.botting.china.nanjing,benjamin_j.nettersheim.germany.jena"
3739,3739,2018,11,Nature ecology & evolution,Early neurogenomic response associated with variation in guppy female mate preference,"natasha_i.bloch.united_kingdom.london,alberto.corrallpez.sweden.stockholm,sverine_d.buechel.sweden.stockholm,alexander.kotrschal.sweden.stockholm,niclas.kolm.sweden.stockholm,judith_e.mank.united_kingdom.london"
3740,3740,2018,11,Nature ecology & evolution,Adaptive transcription-splicing resynchronization upon losing an essential splicing factor,"shanglin.chang.taiwan.taipei,hsuankai.wang.taiwan.taipei,luh.tung.taiwan.taipei,tienhsien.chang.taiwan.taipei"
3742,3742,2018,11,Nature ecology & evolution,Shark genomes provide insights into elasmobranch evolution and the origin of vertebrates,"yuichiro.hara.japan.kobe,kazuaki.yamaguchi.japan.kobe,koh.onimaru.japan.kobe,mitsutaka.kadota.japan.kobe,mitsumasa.koyanagi.japan.osaka,sean_d.keeley.japan.kobe,kaori.tatsumi.japan.kobe,kaori.tanaka.japan.kobe,fumio.motone.japan.kobe,yuka.kageyama.japan.kobe,ryo.nozu.japan.okinawa,osamu.nishimura.japan.kobe,reiko.nakagawa.japan.kobe,chiharu.tanegashima.japan.kobe,itsuki.kiyatake.japan.osaka,rui.matsumoto.japan.okinawa,kiyomi.murakumo.japan.okinawa,kiyonori.nishida.japan.osaka,akihisa.terakita.japan.osaka,keiichi.sato.japan.okinawa,susumu.hyodo.japan.kashiwa,shigehiro.kuraku.japan.kobe"
3744,3744,2018,11,Nature ecology & evolution,Personality shapes pair bonding in a wild bird social system,"josh_a.firth.united_kingdom.oxford,ella_f.cole.united_kingdom.oxford,christos_c.ioannou.united_kingdom.bristol,john_l.quinn.ireland.cork,lucy_m.aplin.united_kingdom.oxford,antica.culina.united_kingdom.oxford,keith.mcmahon.united_kingdom.oxford,ben_c.sheldon.united_kingdom.oxford"
3745,3745,2018,11,Nature ecology & evolution,Rapid sex-specific evolution of age at maturity is shaped by genetic architecture in Atlantic salmon,"yann.czorlich.finland.turku,tutku.aykanat.finland.helsinki,jaakko.erkinaro.finland.oulu,panu.orell.finland.oulu,craig_robert.primmer.finland.helsinki"
3747,3747,2018,11,Nature ecology & evolution,Divergence and plasticity shape adaptive potential of the Pacific oyster,"li.li.china.qingdao,ao.li.china.qingdao,kai.song.china.qingdao,jie.meng.china.qingdao,chunyan.li.china.qingdao,huayong.que.china.qingdao,fucun.wu.china.qingdao,wei.wang.china.qingdao,haigang.qi.china.qingdao,fei.xu.china.qingdao,rihao.cong.china.qingdao,baoyu.huang.china.qingdao,yingxiang.li.china.qingdao,ting.wang.china.qingdao,xueying.tang.china.qingdao,sheng.liu.china.qingdao,busu.li.china.qingdao,ruihui.shi.china.qingdao,youli.liu.china.qingdao,shancen.zhao.china.shenzhen,shoudu.zhang.china.qingdao,linlin.zhang.china.qingdao,guofan.zhang.china.qingdao"
3748,3748,2018,11,Nature ecology & evolution,Ecosystem scale trade-off in nitrogen acquisition pathways,"meifeng.deng.china.beijing,lingli.liu.china.beijing,weixing.liu.china.beijing,xin.wang.china.beijing,sen.yang.china.beijing,bin.wang.china.beijing"
3750,3750,2018,11,Nature ecology & evolution,Molecular clocks provide little information to date methanogenic Archaea,"andrew_j.roger.canada.halifax,edward.susko.canada.halifax"
3751,3751,2018,11,Nature ecology & evolution,Author Correction: Drug-mediated metabolic tipping between antibiotic resistant states in a mixed-species community,"robert_e.beardmore.united_kingdom.exeter,emily.cook.united_kingdom.exeter,susanna.nilsson.united_kingdom.exeter,adam_r.smith.usa.kansas,anna.tillmann.united_kingdom.aberdeen,brooke_d.esquivel.usa.kansas,ken.haynes.united_kingdom.exeter,neil_a_r.gow.united_kingdom.aberdeen,alistair_j_p.brown.united_kingdom.aberdeen,theodore_c.white.usa.kansas,ivana.gudelj.united_kingdom.exeter"
3754,3754,2018,11,Nature genetics,An atlas of genetic associations in UK Biobank,"oriol.canelaxandri.united_kingdom.midlothian,konrad.rawlik.united_kingdom.midlothian,albert.tenesa.united_kingdom.midlothian"
3757,3757,2018,11,Nature genetics,Publisher Correction: Ancient hybridization and strong adaptation to viruses across African vervet monkey populations,"hannes.svardal.austria.vienna,anna_j.jasinska.usa.california,cristian.apetrei.usa.pennsylvania,giovanni.coppola.usa.california,yu.huang.china.shanghai,christopher_a.schmitt.usa.massachusetts,beatrice.jacquelin.france.paris,vasily.ramensky.usa.california,michaela.mllertrutwin.france.paris,j_paul.grobler.south_africa.bloemfontein,ken.dewar.canada.montreal,trudy_r.turner.south_africa.bloemfontein,wesley_c.warren.usa.missouri,nelson_b.freimer.usa.california,magnus.nordborg.austria.vienna"
3758,3758,2018,11,Nature genetics,Identifying loci affecting trait variability and detecting interactions in genome-wide association studies,"alexander_i.young.united_kingdom.oxford,fabian_l.wauthier.united_kingdom.oxford,peter.donnelly.united_kingdom.oxford"
3762,3762,2018,11,Nature genetics,Integrative transcriptome analyses of the aging brain implicate altered splicing in Alzheimer's disease susceptibility,"towfique.raj.usa.newyork,garrett.wong.usa.newyork,jack.humphrey.united_kingdom.london,minghui.wang.usa.newyork,satesh.ramdhani.usa.newyork,yingchih.wang.usa.newyork,bernard.ng.canada.vancouver,ishaan.gupta.usa.newyork,vahram.haroutunian.usa.newyork,eric_e.schadt.usa.newyork,sara.mostafavi.canada.vancouver,bin.zhang.usa.newyork,pamela.sklar.usa.newyork,philip_l.de_jager.usa.newyork"
3766,3766,2018,11,Nature genetics,Author Correction: Parent-of-origin-specific signatures of de novo mutations,"jakob_m.goldmann.netherlands.nijmegen,wendy_s_w.wong.usa.virginia,michele.pinelli.italy.naples,terry.farrah.usa.washington,dale.bodian.usa.virginia,anna_b.stittrich.usa.washington,gustavo.glusman.usa.washington,lisenka_e_l_m.vissers.netherlands.nijmegen,alexander.hoischen.netherlands.nijmegen,jared_c.roach.usa.washington,joseph_g.vockley.usa.virginia,joris_a.veltman.netherlands.nijmegen,benjamin_d.solomon.usa.virginia,christian.gilissen.netherlands.nijmegen,john_e.niederhuber.usa.virginia"
3769,3769,2018,11,Nature genetics,Reply to: 'Organization of the genome sequence of the polyploid crop species Brassica juncea',"jinghua.yang.china.hangzhou,changmian.ji.china.beijing,dongyuan.liu.china.beijing,xiaowu.wang.china.beijing,mingfang.zhang.china.hangzhou"
