,Unnamed: 0.1,pub_year,pub_month,journal_name,paper_title,author
14423,14423,2019,5,PLoS biology,"Open science challenges, benefits and tips in early career and beyond","christopher.allen.united_kingdom.wales,david_m_a.mehler.united_kingdom.wales"
14424,14424,2019,5,PLoS biology,Amot and Yap1 regulate neuronal dendritic tree complexity and locomotor coordination in mice,"katarzyna_o.rojek.poland.warsaw,joanna.krzemie.poland.warsaw,hubert.doleyczek.poland.warsaw,pawe_m.boguszewski.poland.warsaw,leszek.kaczmarek.poland.warsaw,witold.konopka.poland.warsaw,jacek.jaworski.poland.warsaw,lars.holmgren.sweden.stockholm,tomasz_j.prszyski.poland.warsaw"
14426,14426,2019,5,PLoS computational biology,Dynamic balance between vesicle transport and microtubule growth enables neurite outgrowth,"arjun_singh.yadaw.usa.newyork,mustafa_m.siddiq.usa.newyork,vera.rabinovich.usa.newyork,rosa.tolentino.usa.newyork,jens.hansen.usa.newyork,ravi.iyengar.usa.newyork"
14428,14428,2019,5,PLoS computational biology,Uncovering functional signature in neural systems via random matrix theory,"assaf.almog.israel.ramataviv,m_renate.buijink.netherlands.leiden,ori.roethler.netherlands.leiden,stephan.michel.netherlands.leiden,johanna_h.meijer.netherlands.leiden,jos_h_t.rohling.netherlands.leiden,diego.garlaschelli.netherlands.leiden"
14431,14431,2019,5,PLoS neglected tropical diseases,Unbiased assessment of disease surveillance utilities: A prospect theory application,"arthur_e.attema.netherlands.rotterdam,alasdair_j_c.cook.united_kingdom.guildford,victor_j_del_rio.vilas.united_kingdom.guildford"
14434,14434,2019,5,PLoS pathogens,FOXO1 transcription factor plays a key role in T cell-HIV-1 interaction,"arthur.roux.france.paris,hloise.leroy.france.paris,bndicte.de_muylder.france.paris,lucie.bracq.france.paris,samia.oussous.france.paris,isabelle.dusanterfourt.france.paris,ghina.chougui.france.paris,rachida.tacine.france.paris,clotilde.randriamampita.france.paris,frederic.bouillaud.france.paris,serge.benichou.france.paris,florence.margottingoguet.france.paris,remi.cheynier.france.paris,georges.bismuth.france.paris,marianne.mangeney.france.paris"
14435,14435,2019,5,PLoS pathogens,A core set of venom proteins is released by entomopathogenic nematodes in the genus Steinernema,"dennis_z.chang.usa.california,lorrayne.serra.usa.california,dihong.lu.usa.california,ali.mortazavi.usa.california,adler_r.dillman.usa.california"
14438,14438,2019,5,Science advances,cIAP1/2 inhibition synergizes with TNF inhibition in autoimmunity by down-regulating IL-17A and inducing T<sub>regs</sub>,"joanna_z.kawalkowska.united_kingdom.roosevelt,joy.ogbechi.united_kingdom.roosevelt,patrick_j.venables.united_kingdom.roosevelt,richard_o.williams.united_kingdom.roosevelt"
14440,14440,2019,5,Science advances,Structural mechanism for regulation of the AAA-ATPases RUVBL1-RUVBL2 in the R2TP co-chaperone revealed by cryo-EM,"hugo.muozhernndez.spain.madrid,mohinder.pal.united_kingdom.brighton,carlos_f.rodrguez.spain.madrid,rafael.fernandezleiro.spain.madrid,chrisostomos.prodromou.united_kingdom.brighton,laurence_h.pearl.united_kingdom.brighton,oscar.llorca.spain.madrid"
14445,14445,2019,5,Science advances,Coupled partitioning of Au and As into pyrite controls formation of giant Au deposits,"c.kusebauch.germany.potsdam,s_a.gleeson.germany.potsdam,m.oelze.germany.potsdam"
14452,14452,2019,5,Science translational medicine,Teriflunomide treatment for multiple sclerosis modulates T cell mitochondrial respiration with affinity-dependent effects,"luisa.klotz.germany.munster,melanie.eschborn.germany.munster,maren.lindner.germany.munster,marie.liebmann.germany.munster,martin.herold.germany.munster,claudia.janoschka.germany.munster,beln.torres_garrido.germany.munster,andreas.schultemecklenbeck.germany.munster,catharina_c.gross.germany.munster,johanna.breuer.germany.munster,petra.hundehege.germany.munster,vilmos.posevitz.germany.munster,batrice.pignolet.france.toulouse,giulia.nebel.germany.munster,shirin.glander.germany.munster,nicole.freise.germany.munster,judith.austermann.germany.munster,timo.wirth.germany.munster,tilman.schneiderhohendorf.germany.munster,maria.eveslage.germany.munster,david.brassat.france.toulouse,nicholas.schwab.germany.munster,karin.loser.germany.munster,johannes.roth.germany.munster,karin_b.busch.germany.munster,monika.stoll.germany.munster,sven_g.meuth.germany.munster,heinz.wiendl.germany.munster"
14459,14459,2019,4,Cell reports,Promiscuous Targeting of Cellular Proteins by Vpr Drives Systems-Level Proteomic Remodeling in HIV-1 Infection,"edward_j_d.greenwood.united_kingdom.cambridge,james_c.williamson.united_kingdom.cambridge,agata.sienkiewicz.united_kingdom.cambridge,adi.naamati.united_kingdom.cambridge,nicholas_j.matheson.united_kingdom.cambridge,paul_j.lehner.united_kingdom.cambridge"
14460,14460,2019,4,Cell reports,A 3D Atlas of Hematopoietic Stem and Progenitor Cell Expansion by Multi-dimensional RNA-Seq Analysis,"yuanyuan.xue.china.beijing,denghui.liu.china.beijing,guizhong.cui.china.beijing,yanyan.ding.china.beijing,daosheng.ai.china.shanghai,suwei.gao.china.beijing,yifan.zhang.china.beijing,shengbao.suo.china.beijing,xiaohan.wang.china.beijing,peng.lv.china.beijing,chunyu.zhou.china.beijing,yizhou.li.china.shanghai,xingwei.chen.china.beijing,guangdun.peng.china.shanghai,naihe.jing.china.shanghai,jingdong_j.han.china.beijing,feng.liu.china.beijing"
14461,14461,2019,4,Cell reports,Anaerobic Glycolysis Maintains the Glomerular Filtration Barrier Independent of Mitochondrial Metabolism and Dynamics,"paul_t.brinkkoetter.germany.cologne,tillmann.bork.germany.freiburg,sarah.salou.germany.freiburg,wei.liang.germany.freiburg,athanasia.mizi.germany.cologne,cem.zel.germany.cologne,sybille.koehler.germany.cologne,h_henning.hagmann.germany.cologne,christina.ising.germany.cologne,alexander.kuczkowski.germany.cologne,svenia.schnyder.switzerland.basel,ahmed.abed.germany.freiburg,bernhard.schermer.germany.cologne,thomas.benzing.germany.cologne,oliver.kretz.germany.hamburg,victor_g.puelles.australia.melbourne,simon.lagies.germany.freiburg,manuel.schlimpert.germany.freiburg,bernd.kammerer.germany.freiburg,christoph.handschin.switzerland.basel,christoph.schell.germany.freiburg,tobias_b.huber.germany.hamburg"
14462,14462,2019,4,Cell reports,Comprehensive Genetic Characterization of Mitochondrial Ca<sup>2+</sup> Uniporter Components Reveals Their Different Physiological Requirements In Vivo,"roberta.tufi.united_kingdom.cambridge,thomas_p.gleeson.united_kingdom.cambridge,victoria_l.hewitt.united_kingdom.cambridge,juliette_j.lee.united_kingdom.cambridge,ana.terrientefelix.united_kingdom.cambridge,alvaro.sanchezmartinez.united_kingdom.cambridge,alexander_j.whitworth.united_kingdom.cambridge"
14463,14463,2019,4,Cell reports,Identification of Metabolically Distinct Adipocyte Progenitor Cells in Human Adipose Tissues,"arthe.raajendiran.australia.vic,geraldine.ooi.australia.melbourne,jackie.bayliss.australia.melbourne,paul_e.obrien.australia.melbourne,ralf_b.schittenhelm.australia.vic,ashlee_k.clark.australia.vic,renea_a.taylor.australia.vic,paul_r.burton.australia.melbourne,matthew_j.watt.australia.vic"
14464,14464,2019,4,Cell reports,The Integration of Goal-Directed Signals onto Spatial Maps of Hippocampal Place Cells,"yuki.aoki.japan.tokyo,hideyoshi.igata.japan.tokyo,yuji.ikegaya.japan.osaka,takuya.sasaki.japan.saitama"
14465,14465,2019,4,Cell reports,Precise Temporal Regulation of Molecular Diffusion within Dendritic Spines by Actin Polymers during Structural Plasticity,"kazuki.obashi.japan.tokyo,atsushi.matsuda.japan.kyoto,yasuhiro.inoue.japan.kyoto,shigeo.okabe.japan.tokyo"
14466,14466,2019,4,Cell reports,Transient Deregulation of Canonical Wnt Signaling in Developing Pyramidal Neurons Leads to Dendritic Defects and Impaired Behavior,"beatrice.viale.switzerland.geneva,lin.song.china.dalian,volodymyr.petrenko.switzerland.geneva,annelaure.wenger_combremont.switzerland.geneva,alessandro.contestabile.switzerland.geneva,riccardo.bocchi.switzerland.geneva,patrick.salmon.switzerland.geneva,alan.carleton.switzerland.geneva,lijia.an.china.dalian,laszlo.vutskits.switzerland.geneva,jozsef_zoltan.kiss.switzerland.geneva"
14467,14467,2019,4,Cell reports,Distinct Requirements of CHD4 during B Cell Development and Antibody Response,"weifeng.yen.usa.newyork,rahul.sharma.usa.newyork,montserrat.cols.usa.newyork,colleen_m.lau.usa.newyork,ashutosh.chaudhry.usa.newyork,priyanka.chowdhury.usa.newyork,william_t.yewdell.usa.newyork,bharat.vaidyanathan.usa.newyork,amy.sun.usa.newyork,maryaline.coffre.usa.newyork,chunchin.chen.usa.newyork,maria.jasin.usa.newyork,joseph_c.sun.usa.newyork,alexander_y.rudensky.usa.newyork,sergei_b.koralov.usa.newyork,jayanta.chaudhuri.usa.newyork"
14468,14468,2019,4,Cell reports,Aryl Hydrocarbon Receptor Interacting Protein Maintains Germinal Center B Cells through Suppression of BCL6 Degradation,"dijue.sun.united_kingdom.london,urszula.stopkafarooqui.united_kingdom.london,sayka.barry.united_kingdom.london,ezra.aksoy.united_kingdom.london,gregory.parsonage.united_kingdom.london,anna.vossenkmper.united_kingdom.london,melania.capasso.united_kingdom.london,xinyu.wan.united_kingdom.london,sherine.norris.united_kingdom.london,jennifer_l.marshall.united_kingdom.birmingham,andrew.clear.united_kingdom.london,john.gribben.united_kingdom.london,thomas_t.macdonald.united_kingdom.london,christopher_d.buckley.united_kingdom.birmingham,mrta.korbonits.united_kingdom.london,oliver.haworth.united_kingdom.london"
14473,14473,2019,4,Cell reports,Nuclear eIF4E Stimulates 3'-End Cleavage of Target RNAs,"margaret_rose.davis.canada.montreal,mildred.delaleau.canada.montreal,katherine_l_b.borden.canada.montreal"
14479,14479,2019,4,Cell reports,Skeletal Muscle Glycogen Chain Length Correlates with Insolubility in Mouse Models of Polyglucosan-Associated Neurodegenerative Diseases,"mitchell_a.sullivan.australia.brisbane,silvia.nitschke.canada.toronto,evan_p.skwara.canada.toronto,peixiang.wang.canada.toronto,xiaochu.zhao.canada.toronto,xiao_s.pan.canada.toronto,erin_e.chown.canada.toronto,travis.wang.canada.toronto,ami_m.perri.canada.toronto,jennifer_p_y.lee.canada.toronto,francisco.vilaplana.sweden.stockholm,felix.nitschke.canada.toronto"
14481,14481,2019,4,Cell reports,In Vivo Functional Mapping of a Cortical Column at Single-Neuron Resolution,"carsten_h.tischbirek.germany.munich,takahiro.noda.germany.munich,manabu.tohmi.germany.munich,antje.birkner.germany.munich,israel.nelken.israel.jerusalem,arthur.konnerth.germany.munich"
14483,14483,2019,4,Nature communications,Lipopolysaccharide inhalation recruits monocytes and dendritic cell subsets to the alveolar airspace,"laura.jardine.united_kingdom.newcastle,sarah.wiscombe.united_kingdom.newcastle,gary.reynolds.united_kingdom.newcastle,david.mcdonald.united_kingdom.newcastle,andrew.fuller.united_kingdom.newcastle,kile.green.united_kingdom.newcastle,andrew.filby.united_kingdom.newcastle,ian.forrest.united_kingdom.newcastle,mariehelene.ruchaudsparagano.united_kingdom.newcastle,jonathan.scott.united_kingdom.newcastle,matthew.collin.united_kingdom.newcastle,muzlifah.haniffa.united_kingdom.newcastle,a_john.simpson.united_kingdom.newcastle"
14487,14487,2019,4,Nature communications,Red-shifting mutation of light-driven sodium-pump rhodopsin,"keiichi.inoue.japan.nagoya,mara.del_carmen_marn.italy.siena,sahoko.tomida.japan.nagoya,ryoko.nakamura.japan.nagoya,yuta.nakajima.japan.nagoya,massimo.olivucci.italy.siena,hideki.kandori.japan.nagoya"
14490,14490,2019,4,Nature communications,Crowd oil not crude oil,"roland.dittmeyer.germany.eggensteinleopoldshafen,michael.klumpp.germany.eggensteinleopoldshafen,paul.kant.germany.eggensteinleopoldshafen,geoffrey.ozin.canada.toronto"
14491,14491,2019,4,Nature communications,A binding cooperativity switch driven by synergistic structural swelling of an osmo-regulatory protein pair,"abhishek.narayan.india.chennai,soundhararajan.gopi.india.chennai,athi_n.naganathan.india.chennai"
14492,14492,2019,4,Nature communications,Genomic analysis on pygmy hog reveals extensive interbreeding during wild boar expansion,"langqing.liu.netherlands.wageningen,mirte.bosse.netherlands.wageningen,hendrikjan.megens.netherlands.wageningen,laurent_a_f.frantz.united_kingdom.london,younglim.lee.netherlands.wageningen,evan_k.irvingpease.united_kingdom.oxford,martien_a_m.groenen.netherlands.wageningen,ole.madsen.netherlands.wageningen"
14494,14494,2019,4,Nature communications,Heteroepitaxial passivation of Cs<sub>2</sub>AgBiBr<sub>6</sub> wafers with suppressed ionic migration for X-ray imaging,"bo.yang.china.wuhan,weicheng.pan.china.wuhan,haodi.wu.china.wuhan,guangda.niu.china.wuhan,junhui.yuan.china.wuhan,kanhao.xue.china.wuhan,lixiao.yin.china.wuhan,xinyuan.du.china.wuhan,xiangshui.miao.china.wuhan,xiaoquan.yang.china.wuhan,qingguo.xie.china.wuhan,jiang.tang.china.wuhan"
14495,14495,2019,4,Nature communications,ZnO composite nanolayer with mobility edge quantization for multi-value logic transistors,"lynn.lee.south_korea.seoul,jin_won.jung.south_korea.seoul,jongchan.kim.south_korea.seoul,hoin.lee.south_korea.gwangju,sunwoo.heo.south_korea.gwangju,minho.yoon.south_korea.seoul,sungju.choi.south_korea.seoul,nguyen.van_long.south_korea.seoul,jinseon.park.south_korea.seoul,jae_won.jeong.south_korea.ulsan,kyung_rok.kim.south_korea.ulsan,dae_hwan.kim.south_korea.seoul,seongil.im.south_korea.seoul,byoung_hun.lee.south_korea.gwangju,myung_mo.sung.south_korea.seoul"
14498,14498,2019,4,Nature communications,Molecular dissection of box jellyfish venom cytotoxicity highlights an effective venom antidote,"mantat.lau.australia.sydney,john.manion.australia.sydney,jamie_b.littleboy.australia.sydney,lisa.oyston.australia.sydney,thang_m.khuong.australia.sydney,qiaoping.wang.australia.sydney,david_t.nguyen.australia.darlinghurst,daniel.hesselson.australia.darlinghurst,jamie_e.seymour.australia.cairns,g_gregory.neely.australia.sydney"
14499,14499,2019,4,Nature communications,Liver-target nanotechnology facilitates berberine to ameliorate cardio-metabolic diseases,"huihui.guo.china.beijing,chenlin.feng.china.beijing,wenxuan.zhang.china.beijing,zhigang.luo.china.beijing,hongjuan.zhang.china.beijing,tingting.zhang.china.beijing,chen.ma.china.beijing,yun.zhan.china.beijing,rui.li.china.beijing,song.wu.china.beijing,zeper.abliz.china.beijing,cong.li.china.beijing,xiaolin.li.china.beijing,xiaolei.ma.china.beijing,lulu.wang.china.beijing,wensheng.zheng.china.beijing,yanxing.han.china.beijing,jiandong.jiang.china.beijing"
14501,14501,2019,4,Nature communications,The glycosylation design space for recombinant lysosomal replacement enzymes produced in CHO cells,"weihua.tian.denmark.copenhagen,zilu.ye.denmark.copenhagen,shengjun.wang.denmark.copenhagen,morten_alder.schulz.denmark.copenhagen,julie.van_coillie.denmark.copenhagen,lingbo.sun.denmark.copenhagen,yenhsi.chen.denmark.copenhagen,yoshiki.narimatsu.denmark.copenhagen,lars.hansen.denmark.copenhagen,ulla.mandel.denmark.copenhagen,eric_paul.bennett.denmark.copenhagen,sergey_y.vakhrushev.denmark.copenhagen,henrik.clausen.denmark.copenhagen,zhang.yang.denmark.copenhagen"
14504,14504,2019,4,PLoS biology,G1/S cell cycle regulators mediate effects of circadian dysregulation on tumor growth and provide targets for timed anticancer treatment,"yool.lee.usa.pennsylvania,nicholas_f.lahens.usa.pennsylvania,shirley.zhang.usa.pennsylvania,joseph.bedont.usa.pennsylvania,jeffrey_m.field.usa.pennsylvania,amita.sehgal.usa.pennsylvania"
14505,14505,2019,4,PLoS biology,Structural basis for neutralization of hepatitis A virus informs a rational design of highly potent inhibitors,"lei.cao.china.beijing,pi.liu.china.tianjin,pan.yang.china.beijing,qiang.gao.china.beijing,hong.li.china.tianjin,yao.sun.china.beijing,ling.zhu.china.beijing,jianping.lin.china.tianjin,dan.su.china.chengdu,zihe.rao.china.beijing,xiangxi.wang.china.beijing"
14506,14506,2019,4,PLoS biology,Expectation and attention increase the integration of top-down and bottom-up signals in perception through different pathways,"noam.gordon.australia.victoria,naotsugu.tsuchiya.australia.victoria,roger.koenigrobert.australia.sydney,jakob.hohwy.australia.victoria"
14507,14507,2019,4,PLoS biology,Gene-edited babies: What went wrong and what could go wrong,"haoyi.wang.china.beijing,hui.yang.china.shanghai"
14511,14511,2019,4,PLoS medicine,"Alternate aerosol and systemic immunisation with a recombinant viral vector for tuberculosis, MVA85A: A phase I randomised controlled trial","zitarose.manjaly_thomas.united_kingdom.oxford,iman.satti.united_kingdom.oxford,julia_l.marshall.united_kingdom.oxford,stephanie_a.harris.united_kingdom.oxford,raquel.lopez_ramon.united_kingdom.oxford,ali.hamidi.united_kingdom.oxford,alice.minhinnick.united_kingdom.oxford,michael.riste.united_kingdom.oxford,lisa.stockdale.united_kingdom.oxford,alison_m.lawrie.united_kingdom.oxford,samantha.vermaak.united_kingdom.oxford,morven.wilkie.united_kingdom.oxford,henry.bettinson.united_kingdom.oxford,helen.mcshane.united_kingdom.oxford"
14512,14512,2019,4,PLoS medicine,"Whole-genome and targeted sequencing of drug-resistant Mycobacterium tuberculosis on the iSeq100 and MiSeq: A performance, ease-of-use, and cost evaluation","rebecca_e.colman.switzerland.geneva,aurlien.mace.switzerland.geneva,marva.seifert.usa.california,jonathan.hetzel.usa.california,haifa.mshaiel.usa.california,anita.suresh.switzerland.geneva,darrin.lemmer.usa.arizona,david_m.engelthaler.usa.arizona,donald_g.catanzaro.usa.arkansas,amanda_g.young.usa.california,claudia_m.denkinger.switzerland.geneva,timothy_c.rodwell.switzerland.geneva"
14513,14513,2019,4,PLoS medicine,Contact tracing versus facility-based screening for active TB case finding in rural South Africa: A pragmatic cluster-randomized trial (Kharitode TB),"colleen_f.hanrahan.usa.maryland,bareng_a_s.nonyane.usa.maryland,lesego.mmolawa.south_africa.soweto,nora_s.west.usa.maryland,tsundzukani.siwelana.south_africa.soweto,limakatso.lebina.south_africa.soweto,neil.martinson.south_africa.soweto,david_w.dowdy.usa.maryland"
14515,14515,2019,4,PLoS medicine,Evaluation of a social protection policy on tuberculosis treatment outcomes: A prospective cohort study,"karen.klein.argentina.buenosaires,maria_paula.bernachea.argentina.buenosaires,sarah.irribarren.usa.washington,luz.gibbons.argentina.buenosaires,cristina.chirico.argentina.buenosaires,fernando.rubinstein.argentina.buenosaires"
14517,14517,2019,4,PLoS medicine,Addressing critical needs in the fight to end tuberculosis with innovative tools and strategies,"mark.hatherill.south_africa.capetown,richard_e.chaisson.usa.maryland,claudia_m.denkinger.germany.heidelberg"
14521,14521,2019,4,Nature communications,Quantifying the factors limiting rate performance in battery electrodes,"ruiyuan.tian.ireland.dublin,sanghoon.park.ireland.dublin,graeme.cunningham.ireland.dublin,joo.coelho.ireland.dublin,valeria.nicolosi.ireland.dublin,jonathan_n.coleman.ireland.dublin"
14522,14522,2019,4,Nature communications,800-kyr land temperature variations modulated by vegetation changes on Chinese Loess Plateau,"hongxuan.lu.china.xian,weiguo.liu.china.xian,huanye.wang.china.xian,zhonghui.liu.china.hongkong,youbin.sun.china.xian,weijian.zhou.china.xian,zhisheng.an.china.xian"
14523,14523,2019,4,Nature communications,Crystal structure of the Lin28-interacting module of human terminal uridylyltransferase that regulates let-7 expression,"seisuke.yamashita.japan.chiba,takashi.nagaike.japan.chiba,kozo.tomita.japan.chiba"
14525,14525,2019,4,Nature communications,Ultrafast nematic-orbital excitation in FeSe,"t.shimojima.japan.wako,y.suzuki.japan.tokyo,a.nakamura.japan.wako,n.mitsuishi.japan.tokyo,s.kasahara.japan.kyoto,t.shibauchi.japan.kashiwa,y.matsuda.japan.kyoto,y.ishida.japan.kashiwa,s.shin.japan.kashiwa,k.ishizaka.japan.wako"
14526,14526,2019,4,Nature communications,"Regioselective radical α-borylation of α,β-unsaturated carbonyl compounds for direct synthesis of α-borylcarbonyl molecules","shichao.ren.china.hefei,fenglian.zhang.china.hefei,aiqing.xu.china.hefei,yinuo.yang.china.hefei,min.zheng.china.hefei,xiaoguo.zhou.china.hefei,yao.fu.china.hefei,yifeng.wang.china.hefei"
14527,14527,2019,4,Nature communications,Concomitant opening of a bulk-gap with an emerging possible Majorana zero mode,"anna.grivnin.israel.rehovot,ella.bor.israel.rehovot,moty.heiblum.israel.rehovot,yuval.oreg.israel.rehovot,hadas.shtrikman.israel.rehovot"
14531,14531,2019,4,Nature communications,Liquid-like behaviours of metallic glassy nanoparticles at room temperature,"c_r.cao.china.beijing,k_q.huang.china.beijing,j_a.shi.china.beijing,d_n.zheng.china.beijing,w_h.wang.china.beijing,l.gu.china.beijing,h_y.bai.china.beijing"
14533,14533,2019,4,Nature communications,A Mycobacterium tuberculosis surface protein recruits ubiquitin to trigger host xenophagy,"qiyao.chai.china.beijing,xudong.wang.china.beijing,lihua.qiang.china.beijing,yong.zhang.china.beijing,pupu.ge.china.beijing,zhe.lu.china.beijing,yanzhao.zhong.china.beijing,bingxi.li.china.beijing,jing.wang.china.beijing,lingqiang.zhang.china.beijing,dawang.zhou.china.xiamen,wei.li.china.beijing,wenzhu.dong.china.beijing,yu.pang.china.beijing,george_fu.gao.china.beijing,cui_hua.liu.china.beijing"
14536,14536,2019,4,Nature communications,Temperature-induced amorphization in CaCO<sub>3</sub> at high pressure and implications for recycled CaCO<sub>3</sub> in subduction zones,"mingqiang.hou.china.shanghai,qian.zhang.china.shanghai,renbiao.tao.usa.washington,hong.liu.china.beijing,hokwang.mao.china.shanghai,wenge.yang.china.shanghai,bin.chen.china.shanghai,yingwei.fei.usa.washington"
14537,14537,2019,4,Nature communications,A tightly-bonded and flexible mesoporous zeolite-cotton hybrid hemostat,"lisha.yu.china.hangzhou,xiaoqiang.shang.china.hangzhou,hao.chen.china.hangzhou,liping.xiao.china.hangzhou,yihan.zhu.china.hangzhou,jie.fan.china.hangzhou"
14538,14538,2019,4,Nature communications,Observation of an oxonium ion intermediate in ethanol dehydration to ethene on zeolite,"xue.zhou.china.wuhan,chao.wang.china.wuhan,yueying.chu.china.wuhan,jun.xu.china.wuhan,qiang.wang.china.wuhan,guodong.qi.china.wuhan,xingling.zhao.china.wuhan,ningdong.feng.china.wuhan,feng.deng.china.wuhan"
14540,14540,2019,4,Nature communications,Enantiomer-selective magnetization of conglomerates for quantitative chiral separation,"xichong.ye.china.beijing,jiaxi.cui.germany.campus,bowen.li.china.beijing,na.li.china.beijing,rong.wang.china.beijing,zijia.yan.china.beijing,junyan.tan.china.beijing,jie.zhang.china.beijing,xinhua.wan.china.beijing"
14546,14546,2019,4,Nature communications,Canonical PRC1 controls sequence-independent propagation of Polycomb-mediated gene silencing,"hagar_f.moussa.austria.vienna,daniel.bsteh.austria.vienna,ramesh.yelagandula.austria.vienna,carina.pribitzer.austria.vienna,karin.stecher.austria.vienna,katarina.bartalska.austria.vienna,luca.michetti.austria.vienna,jingkui.wang.austria.vienna,jorge_a.zepedamartinez.austria.vienna,ulrich.elling.austria.vienna,oliver.bell.austria.vienna"
14549,14549,2019,4,Nature communications,Dystrophy-associated caveolin-3 mutations reveal that caveolae couple IL6/STAT3 signaling with mechanosensing in human muscle cells,"melissa.dewulf.france.paris,darius_vasco.kster.united_kingdom.coventry,christine.viaris_de_lesegno.france.paris,valrie.chambon.france.paris,anne.bigot.france.paris,mona.bensalah.france.paris,elisa.negroni.france.paris,nicolas.tardif.france.paris,joanna.podkalicka.france.paris,ludger.johannes.france.paris,pierre.nassoy.france.talence,gillian.butlerbrowne.france.paris,christophe.lamaze.france.paris,cedric_m.blouin.france.paris"
14550,14550,2019,4,Nature communications,FcγRIIb differentially regulates pre-immune and germinal center B cell tolerance in mouse and human,"marion.espli.united_kingdom.cambridge,rachael.bashfordrogers.united_kingdom.cambridge,john_m.sowerby.united_kingdom.cambridge,nagham.alouche.france.clamart,limy.wong.united_kingdom.cambridge,alice_e.denton.united_kingdom.cambridge,michelle_a.linterman.united_kingdom.cambridge,kenneth_g_c.smith.united_kingdom.cambridge"
14551,14551,2019,4,PLoS computational biology,Gap junctions set the speed and nucleation rate of stage I retinal waves,"malte.khne.germany.berlin,sten.rdiger.germany.berlin,benjamin.lindner.germany.berlin"
14552,14552,2019,4,PLoS computational biology,The nonlinear dynamics and fluctuations of mRNA levels in cell cycle coupled transcription,"qiwen.sun.china.guangzhou,feng.jiao.china.guangzhou,genghong.lin.china.guangzhou,jianshe.yu.china.guangzhou,moxun.tang.usa.michigan"
14554,14554,2019,4,PLoS genetics,Histone acetylation promotes long-lasting defense responses and longevity following early life heat stress,"lei.zhou.china.chongqing,bin.he.china.chongqing,jianhui.deng.china.chongqing,shanshan.pang.china.chongqing,haiqing.tang.china.chongqing"
14555,14555,2019,4,PLoS genetics,Chaperonin TRiC/CCT supports mitotic exit and entry into endocycle in Drosophila,"yuya.ohhara.japan.shizuoka,aki.nakamura.japan.shizuoka,yuki.kato.japan.shizuoka,kimiko.yamakawakobayashi.japan.shizuoka"
14556,14556,2019,4,PLoS genetics,Canonical cytosolic iron-sulfur cluster assembly and non-canonical functions of DRE2 in Arabidopsis,"xiaokang.wang.china.beijing,xudong.chen.china.beijing,linhua.sun.china.beijing,weiqiang.qian.china.beijing"
14557,14557,2019,4,PLoS genetics,Selective advantages favour high genomic AT-contents in intracellular elements,"annekathrin.dietel.germany.jena,holger.merker.germany.jena,martin.kaltenpoth.germany.jena,christian.kost.germany.jena"
14558,14558,2019,4,PLoS genetics,FunSPU: A versatile and adaptive multiple functional annotation-based association test of whole-genome sequencing data,"yiding.ma.usa.texas,peng.wei.usa.texas"
