,Unnamed: 0.1,pub_year,pub_month,journal_name,paper_title,author
13863,13863,2019,5,Nature communications,Clonal evolution patterns in acute myeloid leukemia with NPM1 mutation,"sibylle.cocciardi.germany.ulm,anna.dolnik.germany.ulm,silke.kappschwoerer.germany.ulm,frank_g.rcker.germany.ulm,susanne.lux.germany.ulm,tamara_j.bltte.germany.ulm,sabrina.skambraks.germany.ulm,jan.krnke.germany.ulm,florian_h.heidel.germany.jena,tina_m.schnder.germany.jena,andrea.corbacioglu.germany.ulm,verena_i.gaidzik.germany.ulm,peter.paschka.germany.ulm,veronica.teleanu.germany.ulm,gudrun.ghring.germany.hannover,felicitas.thol.germany.hannover,michael.heuser.germany.hannover,arnold.ganser.germany.hannover,daniela.weber.germany.ulm,eric.strng.germany.ulm,hans_a.kestler.germany.ulm,hartmut.dhner.germany.ulm,lars.bullinger.germany.ulm,konstanze.dhner.germany.ulm"
13864,13864,2019,5,Nature communications,Author Correction: Dissymmetry enhancement in enantioselective synthesis of helical polydiacetylene by application of superchiral light,"chenlu.he.china.hefei,guang.yang.china.harbin,yan.kuai.china.hefei,sizhen.shan.china.hefei,lin.yang.china.hefei,jingang.hu.china.hefei,douguo.zhang.china.hefei,qijin.zhang.china.hefei,gang.zou.china.hefei"
13865,13865,2019,5,Nature communications,Checkpoint blockade and nanosonosensitizer-augmented noninvasive sonodynamic therapy combination reduces tumour growth and metastases in mice,"wenwen.yue.china.shanghai,liang.chen.china.shanghai,luodan.yu.china.shanghai,bangguo.zhou.china.shanghai,haohao.yin.china.shanghai,weiwei.ren.china.shanghai,chang.liu.china.shanghai,lehang.guo.china.shanghai,yifeng.zhang.china.shanghai,liping.sun.china.shanghai,kun.zhang.china.shanghai,huixiong.xu.china.shanghai,yu.chen.china.shanghai"
13866,13866,2019,5,Nature communications,Rapid evaluation of bioactive Ti-based surfaces using an in vitro titration method,"weitian.zhao.switzerland.lausanne,david.michalik.switzerland.zurich,stephen.ferguson.switzerland.zurich,willy.hofstetter.switzerland.bern,jacques.lematre.switzerland.lausanne,brigitte.von_rechenberg.switzerland.zurich,paul.bowen.switzerland.lausanne"
13867,13867,2019,5,Nature reviews. Disease primers,Myasthenia gravis,"nils_erik.gilhus.norway.bergen,socrates.tzartos.greece.athens,amelia.evoli.italy.rome,jacqueline.palace.united_kingdom.oxford,jan_j_g_m.verschuuren.netherlands.leiden"
13868,13868,2019,5,PLoS biology,High-resolution mapping reveals that microniches in the gastric glands control Helicobacter pylori colonization of the stomach,"connie.fung.usa.california,shumin.tan.usa.massachusetts,mifuyu.nakajima.usa.california,emma_c.skoog.usa.california,jessica_a.klein.usa.california,jay_v.solnick.usa.california,tadashi.fukami.usa.california,manuel_r.amieva.usa.california"
13869,13869,2019,5,PLoS biology,Entorhinal transformations in abstract frames of reference,"raphael.kaplan.united_kingdom.london,karl_j.friston.united_kingdom.london"
13870,13870,2019,5,PLoS computational biology,Identification of avian flapping motion from non-volant winged dinosaurs based on modal effective mass analysis,"yaser_saffar.talori.china.beijing,jingshan.zhao.china.beijing,yunfei.liu.china.beijing,wenxiu.lu.china.beijing,zhiheng.li.china.beijing,jingmai_kathleen.oconnor.china.beijing"
13871,13871,2019,5,PLoS computational biology,Balance of mechanical forces drives endothelial gap formation and may facilitate cancer and immune-cell extravasation,"jorge.escribano.spain.zaragoza,michelle_b.chen.usa.massachusetts,emad.moeendarbary.usa.massachusetts,xuan.cao.usa.pennsylvania,vivek.shenoy.usa.pennsylvania,jose_manuel.garciaaznar.spain.zaragoza,roger_d.kamm.usa.massachusetts,fabian.spill.usa.massachusetts"
13873,13873,2019,5,PLoS computational biology,Ten quick tips for using a Raspberry Pi,"anthony_c.fletcher.united_kingdom.london,cameron.mura.usa.virginia"
13877,13877,2019,5,PLoS neglected tropical diseases,"Knowledge, attitudes and practices related to schistosomiasis transmission and control in Leyte, Philippines","isabel.francisco.usa.massachusetts,mario.jiz.philippines.muntinlupa,marieke.rosenbaum.usa.massachusetts,palmera.baltazar.philippines.muntinlupa,jennifer_a.steele.usa.massachusetts"
13879,13879,2019,5,PLoS neglected tropical diseases,Brucellosis awareness and knowledge in communities worldwide: A systematic review and meta-analysis of 79 observational studies,"ning.zhang.china.shenyang,hao.zhou.china.shenyang,desheng.huang.china.shenyang,peng.guan.china.shenyang"
13880,13880,2019,5,PLoS pathogens,"Decoration of the enterococcal polysaccharide antigen EPA is essential for virulence, cell surface charge and interaction with effectors of the innate immune system","robert_e.smith.united_kingdom.sheffield,bartomiej.salamaga.united_kingdom.sheffield,piotr.szkuta.united_kingdom.sheffield,natalia.hajdamowicz.united_kingdom.sheffield,tomasz_k.prajsnar.united_kingdom.sheffield,gregory_s.bulmer.united_kingdom.sheffield,thierry.fontaine.france.paris,justyna.koodziejczyk.united_kingdom.sheffield,andrea_m.hounslow.united_kingdom.sheffield,mike_p.williamson.united_kingdom.sheffield,stphane.mesnage.united_kingdom.sheffield"
13881,13881,2019,5,PLoS pathogens,Ultimate opportunists-The emergent Enterocytozoon group Microsporidia,"grant_d.stentiford.united_kingdom.weymouth,david.bass.united_kingdom.weymouth,bryony_a_p.williams.united_kingdom.exeter"
13883,13883,2019,5,Nature biomedical engineering,Imaging the early fate of mRNA vaccines,"sebastian.ols.sweden.stockholm,karin.lor.sweden.stockholm"
13886,13886,2019,5,Nature biomedical engineering,A roadmap for the clinical implementation of optical-imaging biomarkers,"dale_j.waterhouse.united_kingdom.cambridge,catherine_r_m.fitzpatrick.united_kingdom.cambridge,james_p_b.oconnor.united_kingdom.manchester,sarah_e.bohndiek.united_kingdom.cambridge"
13887,13887,2019,5,Nature biomedical engineering,Universally non-immunogenic iPSCs,"tom.shani.israel.rehovot,jacob_h.hanna.israel.rehovot"
13888,13888,2019,5,Nature biomedical engineering,Spectral tracing of deuterium for imaging glucose metabolism,"luyuan.zhang.usa.newyork,lingyan.shi.usa.newyork,yihui.shen.usa.newyork,yupeng.miao.usa.newyork,mian.wei.usa.newyork,naixin.qian.usa.newyork,yinong.liu.usa.newyork,wei.min.usa.newyork"
13890,13890,2019,5,Nature biomedical engineering,Optoacoustic mesoscopy for biomedicine,"murad.omar.germany.munich,juan.aguirre.germany.munich,vasilis.ntziachristos.germany.munich"
13891,13891,2019,5,Nature biomedical engineering,Author Correction: Inhibiting PD-L1 palmitoylation enhances T-cell immune responses against tumours,"han.yao.china.shanghai,jiang.lan.china.chengdu,chushu.li.china.shanghai,hubing.shi.china.chengdu,huanbin.wang.china.shanghai,haojie.lu.china.shanghai,caiyun.fang.china.shanghai,yao.zhang.china.shanghai,lunxi.liang.china.shanghai,xiaolin.zhou.china.shanghai,yu.xue.china.wuhan,yun.cui.china.shanghai,jie.xu.china.shanghai"
13894,13894,2019,5,Nature biotechnology,"Mayo's impact on patent applications related to biotechnology, diagnostics and personalized medicine","mateo.aboy.united_kingdom.cambridge,cristina.crespo.united_kingdom.cambridge,kathleen.liddell.united_kingdom.cambridge,timo.minssen.denmark.copenhagen,johnathon.liddicoat.united_kingdom.cambridge"
13897,13897,2019,5,Nature biotechnology,"To BE or not to BE, that is the question","jia.chen.china.shanghai,bei.yang.china.shanghai,li.yang.china.shanghai"
13902,13902,2019,5,Nature biotechnology,A comparison of single-cell trajectory inference methods,"wouter.saelens.belgium.ghent,robrecht.cannoodt.belgium.ghent,helena.todorov.belgium.ghent,yvan.saeys.belgium.ghent"
13906,13906,2019,5,Nature cell biology,RNA modifications regulating cell fate in cancer,"sylvain.delaunay.united_kingdom.cambridge,michaela.frye.united_kingdom.cambridge"
13907,13907,2019,5,Nature cell biology,Niche cells rewired to maintain HSCs ex vivo,"aparna.venkatraman.usa.kansas,linheng.li.usa.kansas"
13908,13908,2019,5,Nature cell biology,Cellular functions of long noncoding RNAs,"runwen.yao.china.shanghai,yang.wang.china.shanghai,lingling.chen.china.shanghai"
13910,13910,2019,5,Nature cell biology,Epigenetic modulation of a hardwired 3D chromatin landscape in two naive states of pluripotency,"yaser.atlasi.netherlands.nijmegen,wout.megchelenbrink.netherlands.nijmegen,tianran.peng.netherlands.nijmegen,ehsan.habibi.netherlands.nijmegen,onkar.joshi.netherlands.nijmegen,shuangyin.wang.netherlands.nijmegen,cheng.wang.netherlands.nijmegen,colin.logie.netherlands.nijmegen,ina.poser.germany.dresden,hendrik.marks.netherlands.nijmegen,hendrik_g.stunnenberg.netherlands.nijmegen"
13911,13911,2019,5,Nature cell biology,The RNA N<sup>6</sup>-methyladenosine modification landscape of human fetal tissues,"shan.xiao.china.guangzhou,shuo.cao.china.guangzhou,qitao.huang.china.guangzhou,linjian.xia.china.wuhan,mingqiang.deng.china.guangzhou,mengtian.yang.china.guangzhou,guiru.jia.china.guangzhou,xiaona.liu.china.guangzhou,junfang.shi.china.guangzhou,weishi.wang.china.guangzhou,yuan.li.china.guangzhou,sun.liu.china.guangzhou,haoran.zhu.china.guangzhou,kaifen.tan.china.guangzhou,qizhi.luo.china.guangzhou,mei.zhong.china.guangzhou,chunjiang.he.china.wuhan,laixin.xia.china.guangzhou"
13913,13913,2019,5,Nature cell biology,Splicing the innate immune signalling in leukaemia,"maria.guillamot.usa.newyork,iannis.aifantis.usa.newyork"
13918,13918,2019,5,Nature cell biology,A complex containing lysine-acetylated actin inhibits the formin INF2,"mu.a.usa.hanover,tak_shun.fung.usa.hanover,arminja_n.kettenbach.usa.hanover,rajarshi.chakrabarti.usa.hanover,henry_n.higgs.usa.hanover"
13919,13919,2019,5,Nature cell biology,ALOX12 is required for p53-mediated tumour suppression through a distinct ferroptosis pathway,"bo.chu.usa.newyork,ning.kon.usa.newyork,delin.chen.usa.newyork,tongyuan.li.usa.newyork,tong.liu.usa.newyork,le.jiang.usa.newyork,shujuan.song.usa.newyork,omid.tavana.usa.newyork,wei.gu.usa.newyork"
13920,13920,2019,5,Nature cell biology,Author Correction: MicroRNA-146a directs the symmetric division of Snail-dominant colorectal cancer stem cells,"weilun.hwang.taiwan.taipei,jengkae.jiang.taiwan.taipei,shunghaur.yang.taiwan.taipei,tseshun.huang.taiwan.taipei,hsinyi.lan.taiwan.taipei,haowei.teng.taiwan.taipei,chihyung.yang.taiwan.taipei,yaping.tsai.taiwan.taipei,chihung.lin.taiwan.taipei,hseiwei.wang.taiwan.taipei,muhhwa.yang.taiwan.taipei"
13921,13921,2019,5,Nature cell biology,Author Correction: Sin1 phosphorylation impairs mTORC2 complex integrity and inhibits downstream Akt signalling to suppress tumorigenesis,"pengda.liu.usa.massachusetts,wenjian.gan.usa.massachusetts,hiroyuki.inuzuka.usa.massachusetts,adam_s.lazorchak.usa.connecticut,daming.gao.usa.massachusetts,omotooke.arojo.usa.connecticut,dou.liu.usa.connecticut,lixin.wan.usa.massachusetts,bo.zhai.usa.massachusetts,yonghao.yu.usa.massachusetts,min.yuan.usa.massachusetts,byeong_mo.kim.usa.massachusetts,shavali.shaik.usa.massachusetts,suchithra.menon.usa.massachusetts,steven_p.gygi.usa.massachusetts,tae_ho.lee.usa.massachusetts,john_m.asara.usa.massachusetts,brendan_d.manning.usa.massachusetts,john.blenis.usa.massachusetts,bing.su.usa.connecticut,wenyi.wei.usa.massachusetts"
13922,13922,2019,5,Nature chemistry,Identification of autoinducing thiodepsipeptides from staphylococci enabled by native chemical ligation,"bengt_h.gless.denmark.copenhagen,martin_s.bojer.denmark.copenhagen,pai.peng.denmark.copenhagen,mara.baldry.denmark.copenhagen,hanne.ingmer.denmark.copenhagen,christian_a.olsen.denmark.copenhagen"
13924,13924,2019,5,Nature chemistry,Practical and regioselective amination of arenes using alkyl amines,"alessandro.ruffoni.united_kingdom.manchester,fabio.juli.united_kingdom.manchester,thomas_d.svejstrup.united_kingdom.manchester,alastair_j.mcmillan.united_kingdom.manchester,daniele.leonori.united_kingdom.manchester"
13927,13927,2019,5,Nature chemistry,N-heterocyclic carbene-functionalized magic-number gold nanoclusters,"mina_r.narouz.canada.kingston,kimberly_m.osten.japan.nagoya,phillip_j.unsworth.canada.kingston,renee_w_y.man.japan.nagoya,kirsi.salorinne.japan.nagoya,shinjiro.takano.japan.tokyo,ryohei.tomihara.japan.tokyo,caothang.dinh.canada.toronto,j_daniel.padmos.canada.kingston,kennedy.ayoo.canada.kingston,patrick_j.garrett.canada.kingston,masakazu.nambo.japan.nagoya,j_hugh.horton.canada.kingston,edward_h.sargent.canada.toronto,tatsuya.tsukuda.japan.tokyo,cathleen_m.crudden.canada.kingston"
13928,13928,2019,5,Nature chemistry,Catalytic living ring-opening metathesis polymerization with Grubbs' second- and third-generation catalysts,"mohammad.yasir.switzerland.fribourg,peng.liu.switzerland.fribourg,iris_k.tennie.switzerland.fribourg,andreas_f_m.kilbinger.switzerland.fribourg"
13929,13929,2019,5,Nature chemistry,Turning the periodic table upside down,"martyn.poliakoff.united_kingdom.nottingham,alexis_d_j.makin.united_kingdom.liverpool,samantha_l_y.tang.united_kingdom.nottingham,ellen.poliakoff.united_kingdom.manchester"
13933,13933,2019,5,Nature chemistry,Shear-induced assembly of a transient yet highly stretchable hydrogel based on pseudopolyrotaxanes,"hua.ke.china.shenzhen,liupan.yang.china.shenzhen,mo.xie.china.shenzhen,zhao.chen.china.shenzhen,huan.yao.china.shenzhen,wei.jiang.china.shenzhen"
13936,13936,2019,5,Nature chemical biology,Chemogenetics defines receptor-mediated functions of short chain free fatty acids,"daniele.bolognini.united_kingdom.glasgow,natasja.barki.united_kingdom.glasgow,adrian_j.butcher.united_kingdom.cambridge,brian_d.hudson.united_kingdom.glasgow,eugenia.sergeev.united_kingdom.glasgow,colin.molloy.united_kingdom.glasgow,catherine_e.moss.united_kingdom.glasgow,sophie_j.bradley.united_kingdom.glasgow,christian.le_gouill.canada.montreal,michel.bouvier.canada.montreal,andrew_b.tobin.united_kingdom.glasgow,graeme.milligan.united_kingdom.glasgow"
13938,13938,2019,5,Nature chemical biology,Dynamic assembly of protein disulfide isomerase in catalysis of oxidative folding,"masaki.okumura.japan.sendai,kentaro.noi.japan.kumamoto,shingo.kanemura.japan.sendai,misaki.kinoshita.japan.sendai,tomohide.saio.japan.sapporo,yuichi.inoue.japan.sendai,teru.ogura.japan.kumamoto,kenji.inaba.japan.sendai"
13940,13940,2019,5,Nature chemical biology,Bromodomain inhibition of the coactivators CBP/EP300 facilitate cellular reprogramming,"ayyub.ebrahimi.turkey.istanbul,kenan.sevin.turkey.istanbul,glben.grhan_sevin.turkey.istanbul,adam_p.cribbs.united_kingdom.oxford,martin.philpott.united_kingdom.oxford,frat.uyulur.turkey.istanbul,tun.morova.turkey.istanbul,james_e.dunford.united_kingdom.oxford,sencer.gklemez.turkey.istanbul,ule.ar.turkey.istanbul,udo.oppermann.united_kingdom.oxford,tamer_t.nder.turkey.istanbul"
13941,13941,2019,5,Nature chemical biology,"Structure of McsB, a protein kinase for regulated arginine phosphorylation","marcin_j.suskiewicz.austria.vienna,bence.hajdusits.austria.vienna,rebecca.beveridge.austria.vienna,alexander.heuck.austria.vienna,lam_dai.vu.austria.vienna,robert.kurzbauer.austria.vienna,karl.mechtler.austria.vienna,anton.meinhart.austria.vienna,tim.clausen.austria.vienna"
13944,13944,2019,5,Nature chemical biology,Analysis of modular bioengineered antimicrobial lanthipeptides at nanoliter scale,"steven.schmitt.switzerland.basel,manuel.montalbnlpez.netherlands.groningen,david.peterhoff.germany.regensburg,jingjing.deng.netherlands.groningen,ralf.wagner.germany.regensburg,martin.held.switzerland.basel,oscar_p.kuipers.netherlands.groningen,sven.panke.switzerland.basel"
13945,13945,2019,5,Nature chemical biology,Cascaded amplifying circuits enable ultrasensitive cellular sensors for toxic metals,"xinyi.wan.united_kingdom.edinburgh,francesca.volpetti.switzerland.lausanne,ekaterina.petrova.switzerland.lausanne,chris.french.united_kingdom.edinburgh,sebastian_j.maerkl.switzerland.lausanne,baojun.wang.united_kingdom.edinburgh"
13948,13948,2019,5,Nature chemical biology,Harvesting Moco,"ralf_r.mendel.germany.braunschweig,thomas_w.hercher.germany.braunschweig"
13950,13950,2019,5,Nature chemical biology,Publisher Correction: PH-domain-binding inhibitors of nucleotide exchange factor BRAG2 disrupt Arf GTPase signaling,"agata.nawrotek.france.cachan,sarah.benabdi.france.cachan,supaporn.niyomchon.france.paris,mariehlne.kryszke.france.cachan,christophe.ginestier.france.marseille,tatiana.caeque.france.marseille,livia.tepshi.france.cachan,angelica.mariani.france.marseille,guri.giaever.canada.vancouver,corey.nislow.canada.vancouver,raphal.rodriguez.france.paris,mahel.zeghouf.france.cachan,jacqueline.cherfils.france.cachan"
13951,13951,2019,5,Nature chemical biology,Designing a chemical inhibitor for the AAA protein spastin using active site mutations,"tommaso.cupido.usa.newyork,rudolf.pisa.usa.newyork,megan_e.kelley.usa.newyork,tarun_m.kapoor.usa.newyork"
13953,13953,2019,5,Nature chemical biology,Author Correction: Complete reconstitution of the diverse pathways of gentamicin B biosynthesis,"yeon_hee.ban.south_korea.seoul,myoung_chong.song.south_korea.seoul,jaeyeon.hwang.south_korea.seoul,healyung.shin.south_korea.seoul,seung_kon.hong.south_korea.seoul,na_joon.lee.south_korea.seoul,je_won.park.south_korea.seoul,sunshin.cha.south_korea.seoul,yeo_joon.yoon.south_korea.seoul"
13955,13955,2019,5,Nature communications,Fluidal pyroclasts reveal the intensity of peralkaline rhyolite pumice cone eruptions,"ben.clarke.united_kingdom.edinburgh,eliza_s.calder.united_kingdom.edinburgh,karen.fontijn.belgium.brussels,joaqun_a.corts.united_kingdom.edinburgh,mark.naylor.united_kingdom.edinburgh,ian.butler.united_kingdom.edinburgh,william.hutchison.united_kingdom.standrews"
13956,13956,2019,5,Nature communications,Meta-analytic evidence that sexual selection improves population fitness,"justin_g.cally.australia.vic,devi.stuartfox.australia.vic,luke.holman.australia.vic"
13959,13959,2019,5,Nature communications,Structural mechanism underlying G protein family-specific regulation of G protein-gated inwardly rectifying potassium channel,"hanaho.kano.japan.tokyo,yuki.toyama.japan.tokyo,shunsuke.imai.japan.tokyo,yuta.iwahashi.japan.tokyo,yoko.mase.japan.tokyo,mariko.yokogawa.japan.tokyo,masanori.osawa.japan.tokyo,ichio.shimada.japan.tokyo"
13961,13961,2019,5,Nature communications,"Mechanism-based tuning of insect 3,4-dihydroxyphenylacetaldehyde synthase for synthetic bioproduction of benzylisoquinoline alkaloids","christopher_j.vavricka.japan.kobe,takanobu.yoshida.japan.kobe,yuki.kuriya.japan.kobe,shunsuke.takahashi.japan.kobe,teppei.ogawa.japan.osaka,fumie.ono.japan.kyoto,kazuko.agari.japan.kobe,hiromasa.kiyota.japan.okayama,jun.ishii.japan.kobe,kenji.tsuge.japan.kobe,hiromichi.minami.japan.ishikawa,michihiro.araki.japan.kobe,tomohisa.hasunuma.japan.kobe,akihiko.kondo.japan.kobe"
13963,13963,2019,5,Nature communications,Capicua regulates neural stem cell proliferation and lineage specification through control of Ets factors,"shiekh_tanveer.ahmad.canada.calgary,alexandra_d.rogers.canada.calgary,myra_j.chen.canada.calgary,rajiv.dixit.canada.calgary,lata.adnani.canada.calgary,luke_s.frankiw.canada.calgary,samuel_o.lawn.canada.calgary,michael_d.blough.canada.calgary,mana.alshehri.canada.calgary,wei.wu.canada.calgary,stephen_m.robbins.canada.calgary,j_gregory.cairncross.canada.calgary,carol.schuurmans.canada.calgary,jennifer_a.chan.canada.calgary"
13967,13967,2019,5,Nature communications,Plasmonic photosynthesis of C<sub>1</sub>-C<sub>3</sub> hydrocarbons from carbon dioxide assisted by an ionic liquid,"sungju.yu.usa.illinois,prashant_k.jain.usa.illinois"
13969,13969,2019,5,Nature communications,Author Correction: Rad52 prevents excessive replication fork reversal and protects from nascent strand degradation,"eva.malacaria.italy.rome,giusj_monia.pugliese.italy.rome,masayoshi.honda.usa.iowa,veronica.marabitti.italy.rome,francesca_antonella.aiello.italy.rome,maria.spies.usa.iowa,annapaola.franchitto.italy.rome,pietro.pichierri.italy.rome"
13970,13970,2019,5,Nature communications,Hydrogen embrittlement in metallic nanowires,"sheng.yin.usa.rhodeisland,guangming.cheng.usa.northcarolina,tzuhsuan.chang.usa.northcarolina,gunther.richter.germany.stuttgart,yong.zhu.usa.northcarolina,huajian.gao.usa.rhodeisland"
13971,13971,2019,5,Nature communications,Publisher Correction: Parent of origin genetic effects on methylation in humans are common and influence complex trait variation,"yanni.zeng.united_kingdom.edinburgh,carmen.amador.united_kingdom.edinburgh,charley.xia.united_kingdom.edinburgh,riccardo.marioni.united_kingdom.edinburgh,duncan.sproul.united_kingdom.edinburgh,rosie_m.walker.united_kingdom.edinburgh,stewart_w.morris.united_kingdom.edinburgh,andrew.bretherick.united_kingdom.edinburgh,oriol.canelaxandri.united_kingdom.edinburgh,thibaud_s.boutin.united_kingdom.edinburgh,david_w.clark.united_kingdom.edinburgh,archie.campbell.united_kingdom.edinburgh,konrad.rawlik.united_kingdom.edinburgh,caroline.hayward.united_kingdom.edinburgh,reka.nagy.united_kingdom.edinburgh,albert.tenesa.united_kingdom.edinburgh,david_j.porteous.united_kingdom.edinburgh,james_f.wilson.united_kingdom.edinburgh,ian_j.deary.united_kingdom.edinburgh,kathryn_l.evans.united_kingdom.edinburgh,andrew_m.mcintosh.united_kingdom.edinburgh,pau.navarro.united_kingdom.edinburgh,chris_s.haley.united_kingdom.edinburgh"
13973,13973,2019,5,Nature communications,Black phosphorene as a hole extraction layer boosting solar water splitting of oxygen evolution catalysts,"kan.zhang.china.nanjing,bingjun.jin.south_korea.seoul,cheolwoo.park.south_korea.seoul,yoonjun.cho.south_korea.seoul,xiufeng.song.china.nanjing,shengli.zhang.china.nanjing,wooyul.kim.south_korea.seoul,haibo.zeng.china.nanjing,jong_hyeok.park.south_korea.seoul"
13975,13975,2019,5,Nature communications,CXCL4 assembles DNA into liquid crystalline complexes to amplify TLR9-mediated interferon-α production in systemic sclerosis,"roberto.lande.italy.rome,raffaella.palazzo.italy.rome,barbara.marinari.italy.rome,immacolata.pietraforte.italy.rome,yves.mattenberger.switzerland.geneva,francesca.spadaro.italy.rome,katia.stefanantoni.italy.rome,nicoletta.iannace.italy.rome,aleksandra_maria.dufour.switzerland.geneva,mario.falchi.italy.rome,manuela.bianco.italy.rome,elisabetta.botti.italy.rome,luca.bianchi.italy.rome,montserrat.alvarez.switzerland.geneva,valeria.riccieri.italy.rome,marieelise.truchetet.france.bordeaux,carlo.chizzolini.switzerland.geneva,loredana.frasca.italy.rome"
13976,13976,2019,5,Nature communications,Type-I hyperbolic metasurfaces for highly-squeezed designer polaritons with negative group velocity,"yihao.yang.china.hangzhou,pengfei.qin.china.hangzhou,xiao.lin.singapore.singapore,erping.li.china.hangzhou,zuojia.wang.china.qingdao,baile.zhang.singapore.singapore,hongsheng.chen.china.hangzhou"
13978,13978,2019,5,Nature communications,Structural basis for reversible amyloids of hnRNPA1 elucidates their role in stress granule assembly,"xinrui.gui.china.shanghai,feng.luo.china.shanghai,yichen.li.china.shanghai,heng.zhou.china.beijing,zhenheng.qin.china.shanghai,zhenying.liu.china.shanghai,jinge.gu.china.shanghai,muyun.xie.china.shanghai,kun.zhao.china.shanghai,bin.dai.china.shanghai,jianhua.he.china.shanghai,lin.he.china.shanghai,bo.sun.china.shanghai,xueming.li.china.beijing,cong.liu.china.shanghai,dan.li.china.shanghai"
13980,13980,2019,5,Nature communications,Vectorizing the spatial structure of high-harmonic radiation from gas,"f.kong.canada.ottawa,c.zhang.canada.ottawa,h.larocque.canada.ottawa,z.li.canada.ottawa,f.bouchard.canada.ottawa,d_h.ko.canada.ottawa,g_g.brown.canada.ottawa,a.korobenko.canada.ottawa,t_j.hammond.canada.ottawa,robert_w.boyd.canada.ottawa,e.karimi.canada.ottawa,p_b.corkum.canada.ottawa"
13983,13983,2019,5,Nature ecology & evolution,No reliable evidence for a very early Aurignacian in Southern Iberia,"lars.anderson.france.toulouse,natasha.reynolds.france.pessac,nicolas.teyssandier.france.toulouse"
13985,13985,2019,5,Nature ecology & evolution,Synchronized failure of global crop production,"zia.mehrabi.canada.vancouver,navin.ramankutty.canada.vancouver"
13988,13988,2019,5,Nature ecology & evolution,Medusozoan genomes inform the evolution of the jellyfish body plan,"konstantin.khalturin.japan.okinawa,chuya.shinzato.japan.okinawa,maria.khalturina.japan.okinawa,mayuko.hamada.japan.okinawa,manabu.fujie.japan.okinawa,ryo.koyanagi.japan.okinawa,miyuki.kanda.japan.okinawa,hiroki.goto.japan.okinawa,friederike.antonerxleben.germany.kiel,masaya.toyokawa.japan.nagasaki,sho.toshino.japan.okinawa,noriyuki.satoh.japan.okinawa"
13989,13989,2019,5,Nature ecology & evolution,Morphology and genome of a snailfish from the Mariana Trench provide insights into deep-sea adaptation,"kun.wang.china.xian,yanjun.shen.china.wuhan,yongzhi.yang.china.lanzhou,xiaoni.gan.china.wuhan,guichun.liu.china.xian,kuang.hu.china.xian,yongxin.li.china.xian,zhaoming.gao.china.sanya,li.zhu.china.lanzhou,guoyong.yan.china.sanya,lisheng.he.china.sanya,liandong.yang.china.wuhan,suxiang.lu.china.wuhan,honghui.zeng.china.wuhan,chang.liu.china.xian,yuan.yuan.china.xian,chenguang.feng.china.xian,wenjie.xu.china.xian,chenglong.zhu.china.xian,wuhan.xiao.china.wuhan,yang.dong.china.kunming,wen.wang.china.xian,qiang.qiu.china.xian,shunping.he.china.sanya"
13990,13990,2019,5,Nature ecology & evolution,Author Correction: Integrated records of environmental change and evolution challenge the Cambrian Explosion,"rachel.wood.united_kingdom.edinburgh,alexander_g.liu.united_kingdom.cambridge,frederick.bowyer.united_kingdom.edinburgh,charlotte_g.kenchington.united_kingdom.cambridge,jennifer_f_hoyal.cuthill.united_kingdom.cambridge,emily_g.mitchell.united_kingdom.cambridge,amelia.penny.finland.helsinki"
