,Unnamed: 0.1,pub_year,pub_month,journal_name,paper_title,author
9024,9024,2020,8,PLoS computational biology,Firing rate homeostasis counteracts changes in stability of recurrent neural networks caused by synapse loss in Alzheimer's disease,"claudia.bachmann.germany.julich,tom.tetzlaff.germany.julich,renato.duarte.germany.julich,abigail.morrison.germany.julich"
9028,9028,2020,8,PLoS genetics,Horizontal transmission and recombination maintain forever young bacterial symbiont genomes,"shelbi_l.russell.usa.california,evan.peppertunick.usa.california,jesper.svedberg.usa.california,ashley.byrne.usa.california,jennie.ruelas_castillo.usa.california,christopher.vollmers.usa.california,roxanne_a.beinart.usa.rhodeisland,russell.corbettdetig.usa.california"
9031,9031,2020,8,PLoS medicine,"Dissecting maternal and fetal genetic effects underlying the associations between maternal phenotypes, birth outcomes, and adult phenotypes: A mendelian-randomization and haplotype-based genetic score analysis in 10,734 mother-infant pairs","jing.chen.usa.ohio,jonas.bacelis.sweden.gothenburg,pol.solenavais.sweden.gothenburg,amit.srivastava.usa.ohio,julius.juodakis.sweden.gothenburg,amy.rouse.usa.ohio,mikko.hallman.finland.oulu,kari.teramo.finland.helsinki,mads.melbye.denmark.copenhagen,bjarke.feenstra.denmark.copenhagen,rachel_m.freathy.united_kingdom.exeter,george_davey.smith.united_kingdom.bristol,deborah_a.lawlor.united_kingdom.bristol,jeffrey_c.murray.usa.iowa,scott_m.williams.usa.ohio,bo.jacobsson.sweden.gothenburg,louis_j.muglia.usa.ohio,ge.zhang.usa.ohio"
9032,9032,2020,8,PLoS neglected tropical diseases,A prospective cohort study of Cutaneous Leishmaniasis due to Leishmania major: Dynamics of the Leishmanin skin test and its predictive value for protection against infection and disease,"jihne.bettaieb.tunisia.tunis,amine.toumi.tunisia.tunis,wissem.ghawar.tunisia.tunis,sadok.chlif.tunisia.tunis,mariem.nouira.tunisia.tunis,nabil.belhajhamida.tunisia.tunis,adel.gharbi.tunisia.tunis,dhafer.laouini.tunisia.tunis,hechmi.louzir.tunisia.tunis,koussay.dellagi.tunisia.tunis,afif.ben_salah.tunisia.tunis"
9038,9038,2020,8,PLoS neglected tropical diseases,"Prevalence and risk factors of Schistosoma mansoni infection among children under two years of age in Mbita, Western Kenya","miho.sassa.japan.nagasaki,evans_a.chadeka.japan.nagasaki,ngetich_b.cheruiyot.japan.nagasaki,mio.tanaka.japan.nagasaki,taeko.moriyasu.japan.nagasaki,satoshi.kaneko.japan.nagasaki,sharon_e.cox.japan.nagasaki,shinjiro.hamano.japan.nagasaki"
9039,9039,2020,8,PLoS neglected tropical diseases,One-year descriptive analysis of patients treated at an anti-rabies clinic-A retrospective study from Kashmir,"khalid.bashir.india.jammu,inaamul.haq.india.jammu,s_muhammad_salim.khan.india.jammu,mariya_amin.qurieshi.india.jammu"
9040,9040,2020,8,PLoS pathogens,The later stages of viral infection: An undiscovered country of host dependency factors,"cason_r.king.usa.wisconsin,andrew.mehle.usa.wisconsin"
9041,9041,2020,8,PLoS pathogens,Cells producing residual viremia during antiretroviral treatment appear to contribute to rebound viremia following interruption of treatment,"hadega_a.aamer.usa.washington,jan.mcclure.usa.washington,daisy.ko.usa.washington,janine.maenza.usa.washington,ann_c.collier.usa.washington,robert_w.coombs.usa.washington,james_i.mullins.usa.washington,lisa_m.frenkel.usa.washington"
9042,9042,2020,8,PLoS pathogens,A tyrosine phosphoregulatory system controls exopolysaccharide biosynthesis and biofilm formation in Vibrio cholerae,"carmen.schwechheimer.usa.california,kassidy.hebert.usa.california,sarvind.tripathi.usa.california,praveen_k.singh.germany.marburg,kyle_a.floyd.usa.california,elise_r.brown.usa.california,monique_e.porcella.usa.california,jacqueline.osorio.usa.california,joseph_t_m.kiblen.usa.california,fernando_a.pagliai.usa.california,knut.drescher.germany.marburg,seth_m.rubin.usa.california,fitnat_h.yildiz.usa.california"
9043,9043,2020,8,PLoS pathogens,Profiling of immune related genes silenced in EBV-positive gastric carcinoma identified novel restriction factors of human gammaherpesviruses,"guillaume_n.fiches.usa.ohio,dawei.zhou.usa.ohio,weili.kong.usa.california,ayan.biswas.usa.ohio,elshafa_h.ahmed.usa.ohio,robert_a.baiocchi.usa.ohio,jian.zhu.usa.ohio,netty.santoso.usa.ohio"
9044,9044,2020,8,Science signaling,Blastocyst-induced ATP release from luminal epithelial cells initiates decidualization through the P2Y2 receptor in mice,"xiaowei.gu.china.guangzhou,zicong.chen.china.guangzhou,zhenshan.yang.china.guangzhou,yan.yang.china.guangzhou,yaping.yan.china.guangzhou,yuefang.liu.china.guangzhou,jimin.pan.china.guangzhou,renwei.su.china.guangzhou,zengming.yang.china.guangzhou"
9046,9046,2020,8,Nature communications,Transparent near-infrared perovskite light-emitting diodes,"chenchao.xie.singapore.singapore,xiaofei.zhao.singapore.singapore,evon_woan_yuann.ong.singapore.singapore,zhikuang.tan.singapore.singapore"
9047,9047,2020,8,Nature communications,Genome-wide functional analysis of phosphatases in the pathogenic fungus Cryptococcus neoformans,"jaehyung.jin.south_korea.seoul,kyungtae.lee.south_korea.seoul,joohyeon.hong.south_korea.seoul,dongpil.lee.south_korea.seoul,eunha.jang.south_korea.seoul,jinyoung.kim.south_korea.seoul,yeonseon.lee.south_korea.seoul,seungheon.lee.south_korea.seoul,yeeseul.so.south_korea.seoul,kwangwoo.jung.south_korea.seoul,donggi.lee.south_korea.seoul,eunji.jeong.south_korea.seoul,minjae.lee.south_korea.seoul,yubyeong.jang.south_korea.seoul,yeseul.choi.south_korea.seoul,myung_ha.lee.south_korea.seoul,jiseok.kim.south_korea.seoul,seongryong.yu.south_korea.seoul,jintae.choi.south_korea.seoul,jaewon.la.south_korea.seoul,haneul.choi.south_korea.seoul,sunwoo.kim.south_korea.seoul,kyung_jin.seo.south_korea.seoul,yelin.lee.south_korea.seoul,eun_jung.thak.south_korea.seoul,jaeyoung.choi.south_korea.gangneung,anna_f.averette.usa.durham,yonghwan.lee.south_korea.seoul,joseph.heitman.usa.durham,hyun_ah.kang.south_korea.seoul,eunji.cheong.south_korea.seoul,yongsun.bahn.south_korea.seoul"
9051,9051,2020,8,Nature communications,High-temperature-resistant silicon-polymer hybrid modulator operating at up to 200 Gbit s<sup>-1</sup> for energy-efficient datacentres and harsh-environment applications,"guowei.lu.japan.fukuoka,jianxun.hong.japan.fukuoka,feng.qiu.japan.fukuoka,andrew_m.spring.japan.fukuoka,tsubasa.kashino.japan.funabashi,juro.oshima.japan.funabashi,masaaki.ozawa.japan.funabashi,hideyuki.nawata.japan.funabashi,shiyoshi.yokoyama.japan.fukuoka"
9052,9052,2020,8,Nature communications,A discrete serotonergic circuit regulates vulnerability to social stress,"wenjun.zou.china.guangzhou,yunlong.song.china.guangzhou,minyi.wu.china.guangzhou,xiangtian.chen.china.guangzhou,qianglong.you.china.guangzhou,qian.yang.china.guangzhou,zhengyi.luo.china.guangzhou,lang.huang.china.guangzhou,yin.kong.china.guangzhou,jing.feng.china.guangzhou,dongxiang.fang.china.guangzhou,xiaowen.li.china.guangzhou,jianming.yang.china.guangzhou,tianming.gao.china.guangzhou"
9053,9053,2020,8,Nature communications,De novo design of an intercellular signaling toolbox for multi-channel cell-cell communication and biological computation,"pei.du.china.beijing,huiwei.zhao.china.beijing,haoqian.zhang.china.beijing,ruisha.wang.china.beijing,jianyi.huang.china.beijing,ye.tian.china.beijing,xudong.luo.china.beijing,xunxun.luo.china.beijing,min.wang.china.beijing,yanhui.xiang.china.shenzhen,long.qian.china.beijing,yihua.chen.china.beijing,yong.tao.china.beijing,chunbo.lou.china.beijing"
9054,9054,2020,8,Nature communications,Feedback-controlled active brownian colloids with space-dependent rotational dynamics,"miguel_angel.fernandezrodriguez.switzerland.zurich,fabio.grillo.switzerland.zurich,laura.alvarez.switzerland.zurich,marco.rathlef.switzerland.zurich,ivo.buttinoni.switzerland.zurich,giovanni.volpe.sweden.gothenburg,lucio.isa.switzerland.zurich"
9055,9055,2020,8,Nature communications,"Rhodium(II)-catalyzed multicomponent assembly of α,α,α-trisubstituted esters via formal insertion of O-C(sp<sup>3</sup>)-C(sp<sup>2</sup>) into C-C bonds","dan.ba.china.xiamen,si.wen.china.xiamen,qingyu.tian.china.xiamen,yanhui.chen.china.xiamen,weiwei.lv.china.xiamen,guolin.cheng.china.xiamen"
9056,9056,2020,8,Nature communications,Grid cells are modulated by local head direction,"klara.gerlei.united_kingdom.edinburgh,jessica.passlack.united_kingdom.edinburgh,ian.hawes.united_kingdom.edinburgh,brianna.vandrey.united_kingdom.edinburgh,holly.stevens.united_kingdom.edinburgh,ioannis.papastathopoulos.united_kingdom.edinburgh,matthew_f.nolan.united_kingdom.edinburgh"
9058,9058,2020,8,Nature communications,Probing nanoscale spatial distribution of plasmonically excited hot carriers,"shengchao.huang.china.xiamen,xiang.wang.china.xiamen,qingqing.zhao.china.xiamen,jinfeng.zhu.china.xiamen,chawei.li.china.xiamen,yuhan.he.china.xiamen,shu.hu.china.xiamen,matthew_m.sartin.china.xiamen,sen.yan.china.xiamen,bin.ren.china.xiamen"
9059,9059,2020,8,Nature communications,Preventing and treating PTSD-like memory by trauma contextualization,"alice_shaam.al_abed.france.bordeaux,evagunnel.ducourneau.france.bordeaux,chlo.bouarab.france.bordeaux,azza.sellami.france.bordeaux,aline.marighetto.france.bordeaux,aline.desmedt.france.bordeaux"
9060,9060,2020,8,Nature communications,Tissue sodium excess is not hypertonic and reflects extracellular volume expansion,"giacomo.rossitto.united_kingdom.glasgow,sheon.mary.united_kingdom.glasgow,jun_yu.chen.united_kingdom.glasgow,philipp.boder.united_kingdom.glasgow,khai_syuen.chew.united_kingdom.glasgow,karla_b.neves.united_kingdom.glasgow,rheure_l.alves.united_kingdom.glasgow,augusto_c.montezano.united_kingdom.glasgow,paul.welsh.united_kingdom.glasgow,mark_c.petrie.united_kingdom.glasgow,delyth.graham.united_kingdom.glasgow,rhian_m.touyz.united_kingdom.glasgow,christian.delles.united_kingdom.glasgow"
9062,9062,2020,8,Nature communications,Band insulator to Mott insulator transition in 1T-TaS<sub>2</sub>,"y_d.wang.china.beijing,w_l.yao.china.beijing,z_m.xin.china.beijing,t_t.han.china.beijing,z_g.wang.china.beijing,l.chen.china.beijing,c.cai.china.beijing,yuan.li.china.beijing,y.zhang.china.beijing"
9063,9063,2020,8,PLoS biology,Choosing fast and simply: Construction of preferences by starlings through parallel option valuation,"tiago.monteiro.united_kingdom.oxford,marco.vasconcelos.portugal.aveiro,alex.kacelnik.united_kingdom.oxford"
9064,9064,2020,8,PLoS biology,Metabolic excretion associated with nutrient-growth dysregulation promotes the rapid evolution of an overt metabolic defect,"robin.green.usa.washington,none.none.usa.washington,lin.wang.usa.newjersey,samuel_f_m.hart.usa.washington,wenyun.lu.usa.newjersey,david.skelding.usa.washington,justin_c.burton.usa.washington,hanbing.mi.usa.washington,aric.capel.usa.washington,hung_alex.chen.usa.washington,aaron.lin.usa.washington,arvind_r.subramaniam.usa.washington,joshua_d.rabinowitz.usa.newjersey,wenying.shou.usa.washington"
9065,9065,2020,8,PLoS computational biology,Cell signaling model for arterial mechanobiology,"linda.irons.usa.connecticut,jay_d.humphrey.usa.connecticut"
9069,9069,2020,8,PLoS neglected tropical diseases,Positive impact of preventative chemotherapy during a national helminth control program: Perception and KAP,"francisca.mutapi.united_kingdom.edinburgh,paradzayi.tagwireyi.zimbabwe.mountpleasant,rivka.lim.united_kingdom.edinburgh,blessing.mangwanda.zimbabwe.mountpleasant,charmaine.fourier.zimbabwe.mountpleasant,takafira.mduluza.zimbabwe.mountpleasant"
9071,9071,2020,8,PLoS pathogens,Genetic variation in the MacAB-TolC efflux pump influences pathogenesis of invasive Salmonella isolates from Africa,"jared_d.honeycutt.usa.california,nicolas.wenner.united_kingdom.liverpool,yan.li.united_kingdom.liverpool,susan_m.brewer.usa.california,liliana_m.massis.usa.california,sky_w.brubaker.usa.california,phoom.chairatana.usa.california,sin_v.owen.usa.massachusetts,roco.canals.united_kingdom.liverpool,jay_c_d.hinton.united_kingdom.liverpool,denise_m.monack.usa.california"
9072,9072,2020,8,PLoS pathogens,Global exploration of the metabolic requirements of gallid alphaherpesvirus 1,"yangyang.qiao.china.harbin,zhitao.wang.china.harbin,zongxi.han.china.harbin,yuhao.shao.china.harbin,yong.ma.china.harbin,yumeng.liang.china.harbin,zhijie.chen.china.harbin,hanguang.wu.china.harbin,lu.cui.china.harbin,yanhui.zhang.china.harbin,shengwang.liu.china.harbin,hai.li.china.harbin"
9073,9073,2020,8,PLoS pathogens,High-resolution analysis of Merkel Cell Polyomavirus in Merkel Cell Carcinoma reveals distinct integration patterns and suggests NHEJ and MMBIR as underlying mechanisms,"manja.czechsioli.germany.hamburg,thomas.gnther.germany.hamburg,marlin.therre.germany.hamburg,michael.spohn.germany.hamburg,daniela.indenbirken.germany.hamburg,juliane.theiss.germany.hamburg,sabine.riethdorf.germany.hamburg,minyue.qi.germany.hamburg,malik.alawi.germany.hamburg,corinna.wlbeck.germany.essen,irene.fernandezcuesta.germany.hamburg,franziska.esmek.germany.hamburg,jrgen_c.becker.germany.essen,adam.grundhoff.germany.hamburg,nicole.fischer.germany.hamburg"
9074,9074,2020,8,Nature communications,An adenovirus-vectored COVID-19 vaccine confers protection from SARS-COV-2 challenge in rhesus macaques,"liqiang.feng.china.guangzhou,qian.wang.china.guangzhou,chao.shan.china.wuhan,chenchen.yang.china.guangzhou,ying.feng.china.guangzhou,jia.wu.china.wuhan,xiaolin.liu.china.guangzhou,yiwu.zhou.china.wuhan,rendi.jiang.china.wuhan,peiyu.hu.china.guangzhou,xinglong.liu.china.guangzhou,fan.zhang.china.guangzhou,pingchao.li.china.guangzhou,xuefeng.niu.china.guangzhou,yichu.liu.china.guangzhou,xuehua.zheng.china.guangzhou,jia.luo.china.guangzhou,jing.sun.china.guangzhou,yingying.gu.china.guangzhou,bo.liu.china.guangzhou,yongcun.xu.china.guangzhou,chufang.li.china.guangzhou,weiqi.pan.china.guangzhou,jincun.zhao.china.guangzhou,changwen.ke.china.guangzhou,xinwen.chen.china.guangzhou,tao.xu.china.guangzhou,nanshan.zhong.china.guangzhou,suhua.guan.china.guangzhou,zhiming.yuan.china.wuhan,ling.chen.china.guangzhou"
9075,9075,2020,8,Nature communications,Green light triggered [2+2] cycloaddition of halochromic styrylquinoxaline-controlling photoreactivity by pH,"kubra.kalayci.australia.brisbane,hendrik.frisch.australia.brisbane,vinh_x.truong.australia.brisbane,christopher.barnerkowollik.australia.brisbane"
9077,9077,2020,8,Nature communications,Associations between aversive learning processes and transdiagnostic psychiatric symptoms in a general population sample,"toby.wise.united_kingdom.london,raymond_j.dolan.united_kingdom.london"
9078,9078,2020,8,Nature communications,Adaptive self-healing electronic epineurium for chronic bidirectional neural interfaces,"kangil.song.south_korea.seoul,hyunseon.seo.south_korea.seoul,seunghoe.kim.south_korea.seoul,ki_jun.yu.south_korea.seoul,yuchan.kim.south_korea.seoul,jinseok.kim.south_korea.seoul,seok_joon.kwon.south_korea.seoul,hyungseop.han.south_korea.seoul,inchan.youn.south_korea.seoul,hyojin.lee.south_korea.seoul"
9081,9081,2020,8,Nature communications,Room-temperature formation of CdS magic-size clusters in aqueous solutions assisted by primary amines,"wushuang.wan.china.chengdu,meng.zhang.china.chengdu,min.zhao.china.chengdu,nelson.rowell.canada.ottawa,chunchun.zhang.china.chengdu,shanling.wang.china.chengdu,theo.kreouzis.united_kingdom.london,hongsong.fan.china.chengdu,wen.huang.china.chengdu,kui.yu.china.chengdu"
9083,9083,2020,8,Nature communications,Real-space recipes for general topological crystalline states,"zhida.song.china.beijing,chen.fang.china.beijing,yang.qi.china.shanghai"
9085,9085,2020,8,Nature communications,Gamma-ray flares from relativistic magnetic reconnection in the jet of the quasar 3C 279,"a.shukla.germany.wurzburg,k.mannheim.germany.wurzburg"
9087,9087,2020,8,Nature communications,Interface chemistry of an amide electrolyte for highly reversible lithium metal batteries,"qidi.wang.china.shenzhen,chenglong.zhao.china.beijing,tomas.verhallen.netherlands.delft,ming.liu.netherlands.delft,frans.ooms.netherlands.delft,feiyu.kang.china.shenzhen,yongsheng.hu.china.beijing,marnix.wagemaker.netherlands.delft,baohua.li.china.shenzhen"
9088,9088,2020,8,Nature communications,Single cell RNA sequencing identifies early diversity of sensory neurons forming via bi-potential intermediates,"louis.faure.austria.vienna,yiqiao.wang.sweden.stockholm,maria_eleni.kastriti.austria.vienna,paula.fontanet.sweden.stockholm,kylie_k_y.cheung.sweden.stockholm,charles.petitpr.sweden.stockholm,haohao.wu.sweden.stockholm,lynn_linyu.sun.sweden.stockholm,karen.runge.france.marseille,laura.croci.italy.milan,gian_giacomo.consalez.italy.milan,antoine.de_chevigny.france.marseille,franois.lallemend.sweden.stockholm,igor.adameyko.austria.vienna,saida.hadjab.sweden.stockholm"
9089,9089,2020,8,Nature communications,Pumping up the charge density of a triboelectric nanogenerator by charge-shuttling,"huamei.wang.china.beijing,liang.xu.china.beijing,yu.bai.china.beijing,zhong_lin.wang.china.beijing"
9090,9090,2020,8,Nature communications,The mechanism of activation of the actin binding protein EHBP1 by Rab8 family members,"amrita.rai.germany.dortmund,nathalie.bleimling.germany.dortmund,ingrid_r.vetter.germany.dortmund,roger_s.goody.germany.dortmund"
9092,9092,2020,8,Nature communications,Author Correction: Enhancing droplet deposition through in-situ precipitation,"maher.damak.usa.massachusetts,md_nasim.hyder.usa.massachusetts,kripa_k.varanasi.usa.massachusetts"
9094,9094,2020,8,Nature communications,Taf14 recognizes a common motif in transcriptional machineries and facilitates their clustering by phase separation,"guochao.chen.china.shanghai,duo.wang.china.shanghai,bin.wu.china.shanghai,fuxiang.yan.china.shanghai,hongjuan.xue.china.shanghai,quanmeng.wang.china.wuhan,shu.quan.china.shanghai,yong.chen.china.shanghai"
9095,9095,2020,8,Nature communications,Frataxin gene editing rescues Friedreich's ataxia pathology in dorsal root ganglia organoid-derived sensory neurons,"pietro_giuseppe.mazzara.italy.milan,sharon.muggeo.italy.milan,mirko.luoni.italy.milan,luca.massimino.italy.milan,mattia.zaghi.italy.milan,parisa_tajallitehrani.valverde.italy.milan,simone.brusco.italy.milan,matteo_jacopo.marzi.italy.milan,gaia.colasante.italy.milan,angelo.iannielli.italy.milan,marianna.paulis.italy.rozzano,chiara.cordiglieri.italy.milan,serena_gea.giannelli.italy.milan,paola.podini.italy.milan,cinzia.gellera.italy.milan,franco.taroni.italy.milan,francesco.nicassio.italy.milan,vania.broccoli.italy.milan"
9097,9097,2020,8,Nature communications,A single-cell atlas of the human substantia nigra reveals cell-specific pathways associated with neurological disorders,"devika.agarwal.united_kingdom.oxford,cynthia.sandor.united_kingdom.cardiff,viola.volpato.united_kingdom.cardiff,tara_m.caffrey.united_kingdom.oxford,jimena.monznsandoval.united_kingdom.cardiff,javier.alegreabarrategui.united_kingdom.oxford,richard.wademartins.united_kingdom.oxford,caleb.webber.united_kingdom.oxford"
9099,9099,2020,8,Nature communications,GLUT1 inhibition blocks growth of RB1-positive triple negative breast cancer,"qin.wu.canada.toronto,wail.baalawi.canada.toronto,genevieve.deblois.canada.toronto,jennifer.cruickshank.canada.toronto,shili.duan.canada.toronto,evelyne.limafernandes.canada.toronto,jillian.haight.canada.toronto,seyed_ali_madani.tonekaboni.canada.toronto,annemarie.fortier.canada.montreal,hellen.kuasne.canada.montreal,trevor_d.mckee.canada.toronto,hassan.mahmoud.canada.toronto,michelle.kushida.canada.toronto,sarina.cameron.canada.toronto,nergiz.doganartun.canada.toronto,wenjun.chen.canada.toronto,yan.nie.canada.toronto,lan_xin.zhang.canada.toronto,ravi_n.vellanki.canada.toronto,stanley.zhou.canada.toronto,panagiotis.prinos.canada.toronto,bradly_g.wouters.canada.toronto,peter_b.dirks.canada.toronto,susan_j.done.canada.toronto,morag.park.canada.montreal,david_w.cescon.canada.toronto,benjamin.haibekains.canada.toronto,mathieu.lupien.canada.toronto,cheryl_h.arrowsmith.canada.toronto"
9101,9101,2020,8,Nature communications,OTUD5 cooperates with TRIM25 in transcriptional regulation and tumor progression via deubiquitination activity,"fangzhou.li.china.beijing,qianqian.sun.china.beijing,kun.liu.china.beijing,ling.zhang.china.suzhou,ning.lin.china.beijing,kaiqiang.you.china.beijing,mingwei.liu.china.beijing,ning.kon.usa.newyork,feng.tian.china.beijing,zebin.mao.china.beijing,tingting.li.china.beijing,tanjun.tong.china.beijing,jun.qin.china.beijing,wei.gu.usa.newyork,dawei.li.china.suzhou,wenhui.zhao.china.beijing"
9103,9103,2020,8,Nature communications,Understanding colossal barocaloric effects in plastic crystals,"f_b.li.china.changsha,m.li.china.changsha,x.xu.china.changsha,z_c.yang.china.changsha,h.xu.china.changsha,c_k.jia.china.changsha,k.li.china.beijing,j.he.china.changsha,b.li.china.shenyang,hui.wang.china.changsha"
9104,9104,2020,8,Nature communications,NIR-II bioluminescence for in vivo high contrast imaging and in situ ATP-mediated metastases tracing,"lingfei.lu.china.shanghai,benhao.li.china.shanghai,suwan.ding.china.shanghai,yong.fan.china.shanghai,shangfeng.wang.china.shanghai,caixia.sun.china.shanghai,mengyao.zhao.china.shanghai,fan.zhang.china.shanghai"
9107,9107,2020,8,Nature communications,Independent phase modulation for quadruplex polarization channels enabled by chirality-assisted geometric-phase metasurfaces,"yueyi.yuan.china.harbin,kuang.zhang.china.harbin,qinghua.song.france.centre,xumin.ding.china.harbin,qun.wu.china.harbin,patrice.genevet.france.centre"
9108,9108,2020,8,Nature communications,Direct insights into the role of epoxy groups on cobalt sites for acidic H<sub>2</sub>O<sub>2</sub> production,"qingran.zhang.australia.sydney,xin.tan.australia.canberra,nicholas_m.bedford.australia.sydney,zhaojun.han.australia.sydney,sean.smith.australia.canberra,rose.amal.australia.sydney,xunyu.lu.australia.sydney"
9109,9109,2020,8,Nature communications,Unique universal scaling in nanoindentation pop-ins,"yuji.sato.japan.osaka,shuhei.shinzato.japan.osaka,takahito.ohmura.japan.ibaraki,takahiro.hatano.japan.osaka,shigenobu.ogata.japan.osaka"
9110,9110,2020,8,PLoS biology,Real-time public health communication of local SARS-CoV-2 genomic epidemiology,"chaney_c.kalinich.usa.connecticut,cole_g.jensen.usa.connecticut,peter.neugebauer.usa.connecticut,mary_e.petrone.usa.connecticut,mario.peahernndez.usa.connecticut,isabel_m.ott.usa.connecticut,anne_l.wyllie.usa.connecticut,tara.alpert.usa.connecticut,chantal_b_f.vogels.usa.connecticut,joseph_r.fauver.usa.connecticut,nathan_d.grubaugh.usa.connecticut,anderson_f.brito.usa.connecticut"
9111,9111,2020,8,PLoS biology,Chemogenetic attenuation of neuronal activity in the entorhinal cortex reduces Aβ and tau pathology in the hippocampus,"gustavo_a.rodriguez.usa.newyork,geoffrey_m.barrett.usa.newyork,karen_e.duff.usa.newyork,s_abid.hussaini.usa.newyork"
9112,9112,2020,8,PLoS computational biology,Managing disease outbreaks: The importance of vector mobility and spatially heterogeneous control,"jeffery.demers.usa.maryland,sharon.bewick.usa.southcarolina,folashade.agusto.usa.kansas,william_f.fagan.usa.maryland,suzanne_l.robertson.usa.virginia"
9113,9113,2020,8,PLoS computational biology,Template-based mapping of dynamic motifs in tissue morphogenesis,"tomer.stern.usa.newjersey,stanislav_y.shvartsman.usa.newjersey,eric_f.wieschaus.usa.newjersey"
9116,9116,2020,8,PLoS medicine,Safety and parasite clearance of artemisinin-resistant Plasmodium falciparum infection: A pilot and a randomised volunteer infection study in Australia,"rebecca_e.watts.australia.brisbane,anand.odedra.australia.brisbane,louise.marquart.australia.brisbane,lachlan.webb.australia.brisbane,azrin_n.abdrahman.australia.brisbane,laura.cascales.australia.brisbane,maria.rebelo.australia.brisbane,zuleima.pava.australia.brisbane,katharine_a.collins.australia.brisbane,cielo.pasay.australia.brisbane,nanhua.chen.australia.brisbane,christopher_l.peatey.australia.brisbane,james_s.mccarthy.australia.brisbane"
9118,9118,2020,8,PLoS neglected tropical diseases,Duplex real-time PCR for sexing Schistosoma japonicum cercariae based on W chromosome-specific genes and its applications,"shuai.liu.china.beijing,xianyu.piao.china.beijing,nan.hou.china.beijing,pengfei.cai.australia.brisbane,yu.ma.china.beijing,qijun.chen.china.beijing"
9120,9120,2020,8,PLoS pathogens,A-to-I RNA editing in bacteria increases pathogenicity and tolerance to oxidative stress,"wenhan.nie.china.shanghai,sai.wang.china.shanghai,rui.he.china.hefei,qin.xu.china.shanghai,peihong.wang.china.shanghai,yan.wu.china.shanghai,fang.tian.china.beijing,junhua.yuan.china.hefei,bo.zhu.china.shanghai,gongyou.chen.china.shanghai"
9121,9121,2020,8,PLoS pathogens,Modulation of hepatitis B virus pregenomic RNA stability and splicing by histone deacetylase 5 enhances viral biosynthesis,"taha_y.taha.usa.illinois,varada.anirudhan.usa.illinois,umaporn.limothai.thailand.bangkok,daniel_d.loeb.usa.wisconsin,pavel_a.petukhov.usa.illinois,alan.mclachlan.usa.illinois"
9131,9131,2020,8,Science advances,Massively parallel single-molecule telomere length measurement with digital real-time PCR,"yongqiang.luo.singapore.singapore,ramya.viswanathan.singapore.singapore,manoor_prakash.hande.singapore.singapore,amos_hong_pheng.loh.singapore.singapore,lih_feng.cheow.singapore.singapore"
9135,9135,2020,8,Science advances,Synthetic lethal combination targeting BET uncovered intrinsic susceptibility of TNBC to ferroptosis,"nandini.verma.israel.rehovot,yaron.vinik.israel.rehovot,ashish.saroha.israel.rehovot,gordon.mills.usa.portland,vinay.dubey.israel.rehovot,lohit.khera.israel.rehovot,harsha.raj.israel.rehovot,flavio.maina.france.marseille,sima.lev.israel.rehovot"
