,Unnamed: 0.1,pub_year,pub_month,journal_name,paper_title,author
11311,11311,2020,7,Science immunology,T<sub>H</sub>17 cells require ongoing classic IL-6 receptor signaling to retain transcriptional and functional identity,"stacey_n.harbour.usa.birmingham,daniel_f.ditoro.usa.birmingham,steven_j.witte.usa.birmingham,carlene_l.zindl.usa.birmingham,min.gao.usa.birmingham,trenton_r.schoeb.usa.birmingham,gareth_w.jones.united_kingdom.bristol,simon_a.jones.united_kingdom.cardiff,robin_d.hatton.usa.birmingham,casey_t.weaver.usa.birmingham"
11312,11312,2020,7,Science immunology,"SARS-CoV-2 T cell immunity: Specificity, function, durability, and role in protection","daniel_m.altmann.united_kingdom.london,rosemary_j.boyton.united_kingdom.london"
11313,11313,2020,7,Science immunology,"Shed it, and help-LAG3 cleavage drives conventional CD4<sup>+</sup> T cells to overcome resistance to PD-1 immunotherapy","lea.seidel.germany.freiburg,bertram.bengsch.germany.freiburg"
11320,11320,2020,7,"Science (New York, N.Y.)",Boron-enabled geometric isomerization of alkenes via selective energy-transfer catalysis,"john_j.molloy.germany.munster,michael.schfer.germany.munster,max.wienhold.germany.munster,tobias.morack.germany.munster,constantin_g.daniliuc.germany.munster,ryan.gilmour.germany.munster"
11321,11321,2020,7,"Science (New York, N.Y.)",Giant piezoelectricity in oxide thin films with nanopillar structure,"huajun.liu.singapore.singapore,haijun.wu.singapore.singapore,khuong_phuong.ong.singapore.singapore,ping.yang.singapore.singapore,pranab_kumar.das.singapore.singapore,xiao.chi.singapore.singapore,yang.zhang.singapore.singapore,caozheng.diao.singapore.singapore,wai_kong_alaric.wong.singapore.singapore,eh_piew.chew.singapore.singapore,yi_fan.chen.singapore.singapore,chee_kiang_ivan.tan.singapore.singapore,andrivo.rusydi.singapore.singapore,mark_b_h.breese.singapore.singapore,stephen_j.pennycook.singapore.singapore,kui.yao.singapore.singapore"
11323,11323,2020,7,"Science (New York, N.Y.)",Cancer cells deploy lipocalin-2 to collect limiting iron in leptomeningeal metastasis,"yudan.chi.usa.newyork,jan.remsik.usa.newyork,vaidotas.kiseliovas.usa.newyork,camille.derderian.usa.newyork,ugur.sener.usa.newyork,majdi.alghader.usa.newyork,fadi.saadeh.usa.newyork,katie.nikishina.usa.newyork,tejus.bale.usa.newyork,christine.iacobuziodonahue.usa.newyork,tiffany.thomas.usa.newyork,dana.peer.usa.newyork,linas.mazutis.usa.newyork,adrienne.boire.usa.newyork"
11326,11326,2020,7,"Science (New York, N.Y.)",Aging immunity may exacerbate COVID-19,"arne_n.akbar.united_kingdom.london,derek_w.gilroy.united_kingdom.london"
11329,11329,2020,7,"Science (New York, N.Y.)",Nailing a Fe-rocious form of cancer,"livia.garzia.canada.montreal,michael_d.taylor.canada.toronto"
11335,11335,2020,7,"Science (New York, N.Y.)",Tumor-initiating cells establish an IL-33-TGF-β niche signaling loop to promote cancer progression,"sachiko.taniguchi.usa.portland,ajit.elhance.usa.portland,avery.van_duzer.usa.portland,sushil.kumar.usa.portland,justin_j.leitenberger.usa.portland,naoki.oshimori.usa.portland"
11336,11336,2020,7,"Science (New York, N.Y.)",A brainwide atlas of synapses across the mouse life span,"mlissa.cizeron.united_kingdom.edinburgh,zhen.qiu.united_kingdom.edinburgh,babis.koniaris.united_kingdom.edinburgh,ragini.gokhale.united_kingdom.edinburgh,noboru_h.komiyama.united_kingdom.edinburgh,erik.fransn.sweden.stockholm,seth_g_n.grant.united_kingdom.edinburgh"
11337,11337,2020,7,"Science (New York, N.Y.)",Introductions and early spread of SARS-CoV-2 in the New York City area,"ana_s.gonzalezreiche.usa.newyork,matthew_m.hernandez.usa.newyork,mitchell_j.sullivan.usa.newyork,brianne.ciferri.usa.newyork,hala.alshammary.usa.newyork,ajay.obla.usa.newyork,shelcie.fabre.usa.newyork,giulio.kleiner.usa.newyork,jose.polanco.usa.newyork,zenab.khan.usa.newyork,bremy.alburquerque.usa.newyork,adriana.van_de_guchte.usa.newyork,jayeeta.dutta.usa.newyork,nancy.francoeur.usa.newyork,betsaida_salom.melo.usa.newyork,irina.oussenko.usa.newyork,gintaras.deikus.usa.newyork,juan.soto.usa.newyork,shwetha_hara.sridhar.usa.newyork,yingchih.wang.usa.newyork,andrew.kasarskis.usa.newyork,deena_r.altman.usa.newyork,melissa.smith.usa.newyork,robert.sebra.usa.newyork,judith.aberg.usa.newyork,florian.krammer.usa.newyork,adolfo.garcasastre.usa.newyork,marta.luksza.usa.newyork,gopi.patel.usa.newyork,alberto.panizmondolfi.usa.newyork,melissa.gitman.usa.newyork,emilia_mia.sordillo.usa.newyork,viviana.simon.usa.newyork,harm.van_bakel.usa.newyork"
11342,11342,2020,7,Cell chemical biology,Ploidy Leads a Molecular Motor to Walk Different Paths to Drug Resistance,"alexander_m.real.usa.newyork,william_m.marsiglia.usa.newyork,arvin_c.dar.usa.newyork"
11348,11348,2020,7,Cell chemical biology,A Clickable APEX Probe for Proximity-Dependent Proteomic Profiling in Yeast,"yi.li.china.beijing,caiping.tian.china.beijing,keke.liu.china.beijing,ying.zhou.china.beijing,jing.yang.china.beijing,peng.zou.china.beijing"
11349,11349,2020,7,Cell chemical biology,Structural Basis for the Binding Selectivity of Human CDY Chromodomains,"cheng.dong.china.tianjin,yanli.liu.china.wuhan,tianjie.lyu.china.beijing,serap.beldar.canada.toronto,wolfram.tempel.canada.toronto,yanjun.li.canada.toronto,zoey.li.china.beijing,su.qin.china.shenzhen,yun.wang.china.beijing,jinrong.min.canada.toronto"
11350,11350,2020,7,Cell chemical biology,Distinct Mechanisms of Resistance to a CENP-E Inhibitor Emerge in Near-Haploid and Diploid Cancer Cells,"rudolf.pisa.usa.newyork,donovan_y_z.phua.usa.newyork,tarun_m.kapoor.usa.newyork"
11351,11351,2020,7,Cell chemical biology,Targeting Two-Component Systems Uncovers a Small-Molecule Inhibitor of Salmonella Virulence,"caressa_n.tsai.canada.hamilton,craig_r.macnair.canada.hamilton,my_p_t.cao.canada.hamilton,jordyn_n.perry.canada.hamilton,jakob.magolan.canada.hamilton,eric_d.brown.canada.hamilton,brian_k.coombes.canada.hamilton"
11355,11355,2020,7,Nature communications,"Automatic precursor recognition and real-time forecasting of sudden explosive volcanic eruptions at Whakaari, New Zealand","d_e.dempsey.new_zealand.auckland,s_j.cronin.new_zealand.auckland,s.mei.new_zealand.auckland,a_w.kempaliehr.new_zealand.auckland"
11359,11359,2020,7,Nature communications,Author Correction: EpCAM-dependent extracellular vesicles from intestinal epithelial cells maintain intestinal tract immune balance,"lingling.jiang.china.hangzhou,yingying.shen.china.hangzhou,danfeng.guo.china.hangzhou,diya.yang.china.hangzhou,jiajun.liu.china.hangzhou,xuefeng.fei.china.hangzhou,yunshan.yang.china.hangzhou,buyi.zhang.china.hangzhou,zhendong.lin.china.wenzhou,fei.yang.china.hangzhou,xiaojian.wang.china.hangzhou,keyi.wang.china.hangzhou,jianli.wang.china.hangzhou,zhijian.cai.china.hangzhou"
11360,11360,2020,7,Nature communications,Direct observation of a Feshbach resonance by coincidence detection of ions and electrons in Penning ionization collisions,"baruch.margulis.israel.rehovot,julia.narevicius.israel.rehovot,edvardas.narevicius.israel.rehovot"
11361,11361,2020,7,Nature communications,The Bartonella autotransporter BafA activates the host VEGF pathway to drive angiogenesis,"kentaro.tsukamoto.japan.toyoake,naoaki.shinzawa.japan.suita,akito.kawai.japan.toyoake,masahiro.suzuki.japan.toyoake,hiroyasu.kidoya.japan.suita,nobuyuki.takakura.japan.suita,hisateru.yamaguchi.japan.toyoake,toshiki.kameyama.japan.toyoake,hidehito.inagaki.japan.toyoake,hiroki.kurahashi.japan.toyoake,yasuhiko.horiguchi.japan.suita,yohei.doi.japan.toyoake"
11362,11362,2020,7,Nature communications,Machine learning of serum metabolic patterns encodes early-stage lung adenocarcinoma,"lin.huang.china.shanghai,lin.wang.china.shanghai,xiaomeng.hu.china.shanghai,sen.chen.china.hangzhou,haiyang.su.china.shanghai,jing.yang.china.shanghai,wei.xu.china.shanghai,vadanasundari.vedarethinam.china.shanghai,shu.wu.china.hangzhou,bin.liu.china.hangzhou,xinze.wan.china.hangzhou,jiatao.lou.china.shanghai,qian.wang.china.shanghai,kun.qian.china.shanghai"
11363,11363,2020,7,Nature communications,Alveolar regeneration through a Krt8+ transitional stem cell state that persists in human lung fibrosis,"maximilian.strunz.germany.munich,lukas_m.simon.germany.munich,meshal.ansari.germany.munich,ilias.angelidis.germany.munich,christoph_h.mayr.germany.munich,george.tsidiridis.germany.munich,marius.lange.germany.munich,laura_f.mattner.germany.munich,paulina.ogar.germany.munich,arunima.sengupta.germany.munich,igor.kukhtevich.germany.munich,robert.schneider.germany.munich,carola.voss.germany.munich,tobias.stoeger.germany.munich,jens_h_l.neumann.germany.munich,anne.hilgendorff.germany.munich,jrgen.behr.germany.munich,mareike.lehmann.germany.munich,gerald.burgstaller.germany.munich,melanie.knigshoff.germany.munich,fabian_j.theis.germany.munich,herbert_b.schiller.germany.munich"
11364,11364,2020,7,Nature communications,A high-resolution transcriptome map identifies small RNA regulation of metabolism in the gut microbe Bacteroides thetaiotaomicron,"daniel.ryan.germany.wurzburg,laura.jenniches.germany.wurzburg,sarah.reichardt.germany.wurzburg,lars.barquist.germany.wurzburg,alexander_j.westermann.germany.wurzburg"
11365,11365,2020,7,Nature communications,Nonequilibrium continuous phase transition in colloidal gelation with short-range attraction,"joep.rouwhorst.netherlands.amsterdam,christopher.ness.united_kingdom.cambridge,alessio.zaccone.united_kingdom.cambridge,peter.schall.netherlands.amsterdam"
11366,11366,2020,7,Nature communications,In situ observation of oscillatory redox dynamics of copper,"jing.cao.germany.berlin,ali.rinaldi.saudi_arabia.dhahran,milivoj.plodinec.germany.berlin,xing.huang.germany.berlin,elena.willinger.germany.berlin,adnan.hammud.germany.berlin,sebastian.beeg.germany.mulheim,claudiu.colbea.switzerland.zurich,robert.schlgl.germany.berlin,markus.antonietti.germany.potsdam,mark.greiner.germany.mulheim,marc.willinger.germany.berlin"
11368,11368,2020,7,Nature communications,Femtosecond exciton dynamics in WSe<sub>2</sub> optical waveguides,"aaron_j.sternbach.usa.newyork,simone.latini.germany.hamburg,sanghoon.chae.usa.newyork,hannes.hbener.germany.hamburg,umberto.de_giovannini.germany.hamburg,yinming.shao.usa.newyork,lin.xiong.usa.newyork,zhiyuan.sun.usa.newyork,norman.shi.usa.newyork,guangxin.ni.usa.newyork,daniel.rhodes.usa.newyork,brian.kim.usa.newyork,nanfang.yu.usa.newyork,andrew_j.millis.usa.newyork,peter_j.schuck.usa.newyork,michal.lipson.usa.newyork,xy.zhu.usa.newyork,james.hone.usa.newyork,angel.rubio.germany.hamburg,d_n.basov.usa.newyork"
11370,11370,2020,7,Nature communications,Low-voltage 2D materials-based printed field-effect transistors for integrated digital and analog electronics on paper,"silvia.conti.italy.pisa,lorenzo.pimpolari.italy.pisa,gabriele.calabrese.italy.pisa,robyn.worsley.united_kingdom.manchester,subimal.majee.united_kingdom.manchester,dmitry_k.polyushkin.austria.vienna,matthias.paur.austria.vienna,simona.pace.italy.pisa,dong_hoon.keum.italy.pisa,filippo.fabbri.italy.pisa,giuseppe.iannaccone.italy.pisa,massimo.macucci.italy.pisa,camilla.coletti.italy.pisa,thomas.mueller.austria.vienna,cinzia.casiraghi.united_kingdom.manchester,gianluca.fiori.italy.pisa"
11373,11373,2020,7,Nature communications,Multivariate genomic scan implicates novel loci and haem metabolism in human ageing,"paul_r_h_j.timmers.united_kingdom.edinburgh,james_f.wilson.united_kingdom.edinburgh,peter_k.joshi.united_kingdom.edinburgh,joris.deelen.germany.cologne"
11375,11375,2020,7,Nature reviews. Physics,Electromagnetic counterparts of gravitational wave sources at the Very Large Telescope,"andrew_j.levan.netherlands.nijmegen,peter_g.jonker.netherlands.nijmegen"
11377,11377,2020,7,PLoS computational biology,Estimation of neuron parameters from imperfect observations,"joseph_d.taylor.united_kingdom.bath,samuel.winnall.united_kingdom.bath,alain.nogaret.united_kingdom.bath"
11378,11378,2020,7,PLoS computational biology,Data-driven contact structures: From homogeneous mixing to multilayer networks,"alberto.aleta.italy.turin,guilherme.ferraz_de_arruda.italy.turin,yamir.moreno.italy.turin"
11379,11379,2020,7,PLoS genetics,Maize adaptation across temperate climates was obtained via expression of two florigen genes,"sara.castelletti.italy.milan,aude.coupelledru.france.montpellier,italo.granato.france.montpellier,carine.palaffre.france.martin,lloren.cabrerabosquet.france.montpellier,chiara.tonelli.italy.milan,stphane_d.nicolas.france.yvette,franois.tardieu.france.montpellier,claude.welcker.france.montpellier,lucio.conti.italy.milan"
11380,11380,2020,7,PLoS genetics,Resection and repair of a Cas9 double-strand break at CTG trinucleotide repeats induces local and extensive chromosomal deletions,"valentine.mosbach.france.paris,david.viterbo.france.paris,stphane.descorpsdeclre.france.paris,lucie.poggi.france.paris,wilhelm.vayssezinkhfer.france.paris,guyfranck.richard.france.paris"
11381,11381,2020,7,PLoS genetics,Spontaneous mutations that confer resistance to 2-deoxyglucose act through Hxk2 and Snf1 pathways to regulate gene expression and HXT endocytosis,"samantha_r.soncini.usa.pennsylvania,dakshayini_g.chandrashekarappa.usa.pennsylvania,david_a.augustine.usa.pennsylvania,kenny_p.callahan.usa.pennsylvania,allyson_f.odonnell.usa.pennsylvania,martin_c.schmidt.usa.pennsylvania"
11382,11382,2020,7,PLoS genetics,Double-edged sword: The evolutionary consequences of the epigenetic silencing of transposable elements,"jae_young.choi.usa.newyork,yuh_chwen_g.lee.usa.california"
11386,11386,2020,7,PLoS medicine,Detection rate and treatment gap for atrial fibrillation identified through screening in community health centers in China (AF-CATCH): A prospective multicenter study,"yi.chen.china.shanghai,qifang.huang.china.shanghai,changsheng.sheng.china.shanghai,wei.zhang.china.shanghai,shuai.shao.china.shanghai,dian.wang.china.shanghai,yibang.cheng.china.shanghai,ying.wang.china.shanghai,qianhui.guo.china.shanghai,dongyan.zhang.china.shanghai,yan.li.china.shanghai,nicole.lowres.australia.sydney,ben.freedman.australia.sydney,jiguang.wang.china.shanghai"
11390,11390,2020,7,PLoS pathogens,Ancient co-option of an amino acid ABC transporter locus in Pseudomonas syringae for host signal-dependent virulence gene regulation,"qing.yan.usa.oregon,conner_j.rogan.usa.oregon,yinyuin.pang.usa.oregon,edward_w.davis.usa.oregon,jeffrey_c.anderson.usa.oregon"
11392,11392,2020,7,PLoS pathogens,Updating the fungal infection-mammalian selection hypothesis at the end of the Cretaceous Period,"arturo.casadevall.usa.maryland,chris.damman.usa.washington"
11393,11393,2020,7,PLoS pathogens,Contained Mycobacterium tuberculosis infection induces concomitant and heterologous protection,"johannes.nemeth.usa.washington,gregory_s.olson.usa.washington,alissa_c.rothchild.usa.washington,ana_n.jahn.usa.washington,dat.mai.usa.washington,fergal_j.duffy.usa.washington,jared_l.delahaye.usa.washington,sanjay.srivatsan.usa.washington,courtney_r.plumlee.usa.washington,kevin_b.urdahl.usa.washington,elizabeth_s.gold.usa.washington,alan.aderem.usa.washington,alan_h.diercks.usa.washington"
11394,11394,2020,7,Nature communications,Ion sieving by a two-dimensional Ti<sub>3</sub>C<sub>2</sub>T<sub>x</sub> alginate lamellar membrane with stable interlayer spacing,"jin.wang.china.xian,zhijie.zhang.china.xian,jiani.zhu.china.xian,mengtao.tian.china.xian,shuchang.zheng.china.xian,fudi.wang.china.xian,xudong.wang.china.xian,lei.wang.china.xian"
11395,11395,2020,7,Nature communications,Spontaneous creation and annihilation dynamics and strain-limited stability of magnetic skyrmions,"frederic.rendellbhatti.united_kingdom.glasgow,raymond_j.lamb.united_kingdom.glasgow,johannes_w.van_der_jagt.netherlands.eindhoven,gary_w.paterson.united_kingdom.glasgow,henk_j_m.swagten.netherlands.eindhoven,damien.mcgrouther.united_kingdom.glasgow"
11396,11396,2020,7,Nature communications,Author Correction: Single cell transcriptomics identifies stem cell-derived graft composition in a model of Parkinson's disease,"katarna.tiklov.sweden.box,sara.nolbrant.sweden.lund,alessandro.fiorenzano.sweden.lund,sa_k.bjrklund.sweden.uppsala,yogita.sharma.sweden.lund,andreas.heuer.sweden.lund,linda.gillberg.sweden.box,deirdre_b.hoban.sweden.lund,tiago.cardoso.sweden.lund,andrew_f.adler.sweden.lund,marcella.birtele.sweden.lund,hilda.lundnmiguel.sweden.box,nikolaos.volakakis.sweden.box,agnete.kirkeby.sweden.lund,thomas.perlmann.sweden.box,malin.parmar.sweden.lund"
11397,11397,2020,7,Nature communications,Sequential role of RAD51 paralog complexes in replication fork remodeling and restart,"matteo.berti.switzerland.zurich,federico.teloni.switzerland.zurich,sofija.mijic.switzerland.zurich,sebastian.ursich.switzerland.zurich,jevgenij.fuchs.switzerland.zurich,maria_dilia.palumbieri.switzerland.zurich,jana.krietsch.switzerland.zurich,jonas_a.schmid.switzerland.zurich,edwige_b.garcin.france.marseille,stphanie.gon.france.marseille,mauro.modesti.france.marseille,matthias.altmeyer.switzerland.zurich,massimo.lopes.switzerland.zurich"
11398,11398,2020,7,Nature communications,Asymmetric total synthesis of yuzurimine-type Daphniphyllum alkaloid (+)-caldaphnidine J,"liandong.guo.china.shenzhen,yan.zhang.china.shenzhen,jingping.hu.china.shenzhen,chengqing.ning.china.shenzhen,heyifei.fu.china.shenzhen,yuye.chen.china.shenzhen,jing.xu.china.shenzhen"
11399,11399,2020,7,Nature communications,A high performance wearable strain sensor with advanced thermal management for motion monitoring,"cenxiao.tan.china.qingdao,zhigang.dong.china.qingdao,yehua.li.china.shanghai,haiguang.zhao.china.qingdao,xingyi.huang.china.shanghai,zhaocai.zhou.china.shanghai,jinwu.jiang.china.shanghai,yunze.long.china.qingdao,pingkai.jiang.china.shanghai,tongyi.zhang.china.shanghai,bin.sun.china.qingdao"
11402,11402,2020,7,Nature communications,Force generation by a propagating wave of supramolecular nanofibers,"ryou.kubota.japan.kyoto,masahiro.makuta.japan.kyoto,ryo.suzuki.japan.kyoto,masatoshi.ichikawa.japan.kyoto,motomu.tanaka.japan.kyoto,itaru.hamachi.japan.kyoto"
11404,11404,2020,7,Nature communications,The stability of P2-layered sodium transition metal oxides in ambient atmospheres,"wenhua.zuo.china.republic,jimin.qiu.china.republic,xiangsi.liu.china.republic,fucheng.ren.china.republic,huajin.he.china.republic,chong.luo.china.republic,jialin.li.china.republic,gregorio_f.ortiz.china.republic,huanan.duan.china.shanghai,jinping.liu.china.republic,mingsheng.wang.china.republic,yong.yang.china.republic"
11405,11405,2020,7,Nature communications,Quantum effect-based flexible and transparent pressure sensors with ultrahigh sensitivity and sensing density,"lan.shi.china.shanghai,zhuo.li.china.shanghai,min.chen.china.shanghai,yajie.qin.china.shanghai,yizhou.jiang.china.shanghai,limin.wu.china.shanghai"
11406,11406,2020,7,Nature communications,High-efficiency super-elastic liquid metal based triboelectric fibers and textiles,"chaoqun.dong.switzerland.lausanne,andreas.leber.switzerland.lausanne,tapajyoti.das_gupta.switzerland.lausanne,rajasundar.chandran.switzerland.lausanne,marco.volpi.switzerland.lausanne,yunpeng.qu.switzerland.lausanne,tung.nguyendang.switzerland.lausanne,nicola.bartolomei.switzerland.lausanne,wei.yan.switzerland.lausanne,fabien.sorin.switzerland.lausanne"
11408,11408,2020,7,Nature communications,Author Correction: Adaptive prospective optical gating enables day-long 3D time-lapse imaging of the beating embryonic zebrafish heart,"jonathan_m.taylor.united_kingdom.glasgow,carl_j.nelson.united_kingdom.glasgow,finnius_a.bruton.united_kingdom.edinburgh,aryan.kaveh.united_kingdom.edinburgh,charlotte.buckley.united_kingdom.edinburgh,carl_s.tucker.united_kingdom.edinburgh,adriano_g.rossi.united_kingdom.edinburgh,john_j.mullins.united_kingdom.edinburgh,martin_a.denvir.united_kingdom.edinburgh"
11412,11412,2020,7,Nature communications,Structural snapshots of human pre-60S ribosomal particles before and after nuclear export,"xiaomeng.liang.china.beijing,meiqing.zuo.china.beijing,yunyang.zhang.china.beijing,ningning.li.china.beijing,chengying.ma.china.beijing,mengqiu.dong.china.beijing,ning.gao.china.beijing"
11413,11413,2020,7,Nature communications,Lactate released by inflammatory bone marrow neutrophils induces their mobilization via endothelial GPR81 signaling,"eman.khatibmassalha.israel.rehovot,suditi.bhattacharya.israel.rehovot,hassan.massalha.israel.rehovot,adi.biram.israel.rehovot,karin.golan.israel.rehovot,orit.kollet.israel.rehovot,anju.kumari.israel.rehovot,francesca.avemaria.israel.rehovot,ekaterina.petrovichkopitman.israel.rehovot,shiri.gurcohen.israel.rehovot,tomer.itkin.israel.rehovot,isabell.brandenburger.germany.nauheim,asaf.spiegel.israel.rehovot,ziv.shulman.israel.rehovot,zachary.gerharthines.denmark.copenhagen,shalev.itzkovitz.israel.rehovot,matthias.gunzer.germany.essen,stefan.offermanns.germany.nauheim,ronen.alon.israel.rehovot,amiram.ariel.israel.haifa,tsvee.lapidot.israel.rehovot"
11414,11414,2020,7,Nature communications,Attentional priorities drive effects of time pressure on altruistic choice,"yi_yang.teoh.canada.toronto,ziqing.yao.china.hongkong,william_a.cunningham.canada.toronto,cendri_a.hutcherson.canada.toronto"
11416,11416,2020,7,Nature communications,Structurally divergent dynamic combinatorial chemistry on racemic mixtures,"tiberium.gianga.united_kingdom.bath,g_dan.panto.united_kingdom.bath"
11417,11417,2020,7,Nature communications,Large-scale DNA-based phenotypic recording and deep learning enable highly accurate sequence-function mapping,"simon.hllerer.switzerland.basel,laetitia.papaxanthos.switzerland.basel,anja_cathrin.gumpinger.switzerland.basel,katrin.fischer.switzerland.basel,christian.beisel.switzerland.basel,karsten.borgwardt.switzerland.basel,yaakov.benenson.switzerland.basel,markus.jeschek.switzerland.basel"
11425,11425,2020,7,PLoS biology,The pregnant myometrium is epigenetically activated at contractility-driving gene loci prior to the onset of labor in mice,"virlana_m.shchuka.canada.toronto,luis_e.abatti.canada.toronto,huayun.hou.canada.toronto,nawrah.khader.canada.toronto,anna.dorogin.canada.toronto,michael_d.wilson.canada.toronto,oksana.shynlova.canada.toronto,jennifer_a.mitchell.canada.toronto"
11426,11426,2020,7,PLoS biology,Age-related accumulation of de novo mitochondrial mutations in mammalian oocytes and somatic tissues,"barbara.arbeithuber.usa.pennsylvania,james.hester.usa.pennsylvania,marzia_a.cremona.usa.pennsylvania,nicholas.stoler.usa.pennsylvania,arslan.zaidi.usa.pennsylvania,bonnie.higgins.usa.pennsylvania,kate.anthony.usa.pennsylvania,francesca.chiaromonte.usa.pennsylvania,francisco_j.diaz.usa.pennsylvania,kateryna_d.makova.usa.pennsylvania"
11427,11427,2020,7,PLoS computational biology,iDrug: Integration of drug repositioning and drug-target prediction via cross-network embedding,"huiyuan.chen.usa.ohio,feixiong.cheng.usa.ohio,jing.li.usa.ohio"
11429,11429,2020,7,PLoS computational biology,Towards optogenetic vision restoration with high resolution,"ulisse.ferrari.france.paris,stphane.deny.france.paris,abhishek.sengupta.france.paris,romain.caplette.france.paris,francesco.trapani.france.paris,josalain.sahel.france.paris,deniz.dalkara.france.paris,serge.picaud.france.paris,jens.duebel.france.paris,olivier.marre.france.paris"
11430,11430,2020,7,PLoS computational biology,A mathematical model for persistent post-CSD vasoconstriction,"shixin.xu.china.suzhou,joshua_c.chang.usa.maryland,carson_c.chow.usa.maryland,k_c.brennan.usa.utah,huaxiong.huang.canada.toronto"
11431,11431,2020,7,PLoS genetics,A novel allele of ASY3 is associated with greater meiotic stability in autotetraploid Arabidopsis lyrata,"paul_j.seear.united_kingdom.leicester,martin_g.france.united_kingdom.leicester,catherine_l.gregory.united_kingdom.leicester,darren.heavens.united_kingdom.norwich,roswitha.schmickl.czech_republic.prague,levi.yant.united_kingdom.nottingham,james_d.higgins.united_kingdom.leicester"
11432,11432,2020,7,PLoS genetics,"The beta-1, 4-N-acetylglucosaminidase 1 gene, selected by domestication and breeding, is involved in cocoon construction of Bombyx mori","chunlin.li.china.chongqing,xiaoling.tong.china.chongqing,weidong.zuo.china.chongqing,hai.hu.china.chongqing,gao.xiong.china.chongqing,minjin.han.china.chongqing,rui.gao.china.chongqing,yue.luan.china.chongqing,kunpeng.lu.china.chongqing,tingting.gai.china.chongqing,zhonghuai.xiang.china.chongqing,cheng.lu.china.chongqing,fangyin.dai.china.chongqing"
11433,11433,2020,7,PLoS genetics,Mixed methods,"david_j.balding.australia.parkville,gregory_s.barsh.usa.california,gregory_p.copenhaver.usa.northcarolina,chengqi.yi.china.beijing"
11434,11434,2020,7,PLoS neglected tropical diseases,Viability PCR shows that non-ocular surfaces could contribute to transmission of Chlamydia trachomatis infection in trachoma,"bart.versteeg.united_kingdom.london,hristina.vasileva.united_kingdom.london,joanna.houghton.united_kingdom.london,anna.last.united_kingdom.london,oumer.shafi_abdurahman.united_kingdom.london,virginia.sarah.united_kingdom.london,david.macleod.united_kingdom.london,anthony_w.solomon.united_kingdom.london,martin_j.holland.united_kingdom.london,nicholas.thomson.united_kingdom.london,matthew_j.burton.united_kingdom.london"
11436,11436,2020,7,PLoS neglected tropical diseases,Inhibition of ABL1 tyrosine kinase reduces HTLV-1 proviral loads in peripheral blood mononuclear cells from patients with HTLV-1-associated myelopathy/tropical spastic paraparesis,"daisuke.kodama.japan.kagoshima,masakazu.tanaka.japan.kagoshima,toshio.matsuzaki.japan.kagoshima,kimiko.izumo.japan.kagoshima,nobuaki.nakano.japan.kagoshima,eiji.matsuura.japan.kagoshima,mineki.saito.japan.kurashiki,masahisa.horiuchi.japan.kagoshima,atae.utsunomiya.japan.kagoshima,hiroshi.takashima.japan.kagoshima,ryuji.kubota.japan.kagoshima,shuji.izumo.japan.kagoshima"
