,Unnamed: 0.1,pub_year,pub_month,journal_name,paper_title,author
10840,10840,2020,7,PLoS medicine,"Neonatal outcome in 29 pregnant women with COVID-19: A retrospective study in Wuhan, China","yanting.wu.china.shanghai,jun.liu.china.wuhan,jingjing.xu.china.shanghai,yanfen.chen.china.wuhan,wen.yang.china.wuhan,yang.chen.china.wuhan,cheng.li.china.shanghai,yu.wang.china.shanghai,han.liu.china.shanghai,chen.zhang.china.shanghai,ling.jiang.china.shanghai,zhaoxia.qian.china.shanghai,andrew.kawai.australia.victoria,ben_willem.mol.australia.victoria,cindylee.dennis.canada.ontario,guoping.xiong.china.wuhan,biheng.cheng.china.wuhan,jing.yang.china.wuhan,hefeng.huang.china.shanghai"
10841,10841,2020,7,PLoS medicine,"Obesity, clinical, and genetic predictors for glycemic progression in Chinese patients with type 2 diabetes: A cohort study using the Hong Kong Diabetes Register and Hong Kong Diabetes Biobank","guozhi.jiang.china.hongkong,andrea_o.luk.china.hongkong,claudia_h_t.tam.china.hongkong,eric_s.lau.china.hongkong,risa.ozaki.china.hongkong,elaine_y_k.chow.china.hongkong,alice_p_s.kong.china.hongkong,cadmon_k_p.lim.china.hongkong,ka_fai.lee.china.hongkong,shing_chung.siu.china.hongkong,grace.hui.china.hongkong,chiu_chi.tsang.china.hongkong,kam_piu.lau.china.hongkong,jenny_y_y.leung.china.hongkong,manwo.tsang.china.hongkong,grace.kam.china.hongkong,ip_tim.lau.china.hongkong,june_k.li.china.hongkong,vincent_t.yeung.china.hongkong,emmy.lau.china.hongkong,stanley.lo.china.hongkong,samuel_k_s.fung.china.hongkong,yuk_lun.cheng.china.hongkong,chun_chung.chow.china.hongkong,ewan_r.pearson.united_kingdom.dundee,wing_yee.so.china.hongkong,juliana_c_n.chan.china.hongkong,ronald_c_w.ma.china.hongkong"
10842,10842,2020,7,PLoS medicine,"Estimation of SARS-CoV-2 mortality during the early stages of an epidemic: A modeling study in Hubei, China, and six regions in Europe","anthony.hauser.switzerland.bern,michel_j.counotte.switzerland.bern,charles_c.margossian.usa.newyork,garyfallos.konstantinoudis.united_kingdom.london,nicola.low.switzerland.bern,christian_l.althaus.switzerland.bern,julien.riou.switzerland.bern"
10846,10846,2020,7,PLoS medicine,Association of bariatric surgery with all-cause mortality and incidence of obesity-related disease at a population level: A systematic review and meta-analysis,"tom.wiggins.united_kingdom.london,nadia.guidozzi.united_kingdom.london,richard.welbourn.united_kingdom.taunton,ahmed_r.ahmed.united_kingdom.london,sheraz_r.markar.united_kingdom.london"
10848,10848,2020,7,PLoS neglected tropical diseases,"Measuring health related quality of life for dengue patients in Iquitos, Peru","william_h.elson.usa.california,amy_r.rileypowell.usa.louisiana,amy_c.morrison.usa.california,esther_e.gotlieb.usa.louisiana,erik_j.groessl.usa.california,jhonny_j.cordova.usa.california,alfonso_s.vizcarra.usa.california,robert_c.reiner.usa.washington,christopher_m.barker.usa.california,gonzalo_m.vazquezprokopec.usa.georgia,thomas_w.scott.usa.california,alan_l.rothman.usa.rhodeisland,john_p.elder.usa.california,valerie_a.pazsoldan.usa.louisiana"
10851,10851,2020,7,Science signaling,A dynamic mouse peptidome landscape reveals probiotic modulation of the gut-brain axis,"pei.zhang.china.beijing,xiaoli.wu.china.beijing,shan.liang.china.beijing,xianfeng.shao.china.beijing,qianqian.wang.china.beijing,ruibing.chen.china.tianjin,weimin.zhu.china.beijing,chen.shao.china.beijing,feng.jin.china.beijing,chenxi.jia.china.beijing"
10852,10852,2020,7,Nature communications,Author Correction: Directed self-assembly of herbal small molecules into sustained release hydrogels for treating neural inflammation,"jun.zheng.china.changsha,rong.fan.china.changsha,huiqiong.wu.china.changsha,honghui.yao.china.changsha,yujie.yan.china.changsha,jiamiao.liu.china.changsha,lu.ran.china.kunming,zhifang.sun.china.changsha,lunzhao.yi.china.kunming,li.dang.china.shantou,pingping.gan.china.changsha,piao.zheng.china.changsha,tilong.yang.china.shenzhen,yi.zhang.china.changsha,tao.tang.china.changsha,yang.wang.china.changsha"
10853,10853,2020,7,Nature communications,Observation of topological transport quantization by dissipation in fast Thouless pumps,"zlata.fedorova.germany.bonn,haixin.qiu.germany.bonn,stefan.linden.germany.bonn,johann.kroha.germany.bonn"
10859,10859,2020,7,Nature communications,Multiscale real time and high sensitivity ion detection with complementary organic electrochemical transistors amplifier,"paolo.romele.italy.brescia,paschalis.gkoupidenis.germany.mainz,dimitrios_a.koutsouras.germany.mainz,katharina.lieberth.germany.mainz,zsolt_m.kovcsvajna.italy.brescia,paul_w_m.blom.germany.mainz,fabrizio.torricelli.italy.brescia"
10860,10860,2020,7,Nature communications,Neuroligin 2 regulates absence seizures and behavioral arrests through GABAergic transmission within the thalamocortical circuitry,"feng.cao.canada.toronto,jackie_j.liu.canada.toronto,susan.zhou.canada.toronto,miguel_a.cortez.canada.toronto,o_carter.snead.canada.toronto,jing.han.china.xian,zhengping.jia.canada.toronto"
10862,10862,2020,7,Nature communications,Comprehensive molecular comparison of BRCA1 hypermethylated and BRCA1 mutated triple negative breast cancers,"dominik.glodzik.sweden.lund,ana.bosch.sweden.lund,johan.hartman.sweden.stockholm,mattias.aine.sweden.lund,johan.vallonchristersson.sweden.lund,christel.reuterswrd.sweden.lund,anna.karlsson.sweden.lund,shamik.mitra.sweden.lund,emma.nimus.sweden.lund,karolina.holm.sweden.lund,jari.hkkinen.sweden.lund,cecilia.hegardt.sweden.lund,lao_h.saal.sweden.lund,christer.larsson.sweden.lund,martin.malmberg.sweden.lund,lisa.rydn.sweden.lund,anna.ehinger.sweden.lund,niklas.loman.sweden.lund,anders.kvist.sweden.lund,serena.nikzainal.united_kingdom.cambridge,ke.borg.sweden.lund,johan.staaf.sweden.lund"
10865,10865,2020,7,Nature communications,A transdisciplinary and community-driven database to unravel subduction zone initiation,"fabio.crameri.norway.oslo,valentina.magni.norway.oslo,mathew.domeier.norway.oslo,grace_e.shephard.norway.oslo,kiran.chotalia.united_kingdom.london,george.cooper.united_kingdom.cardiff,caroline_m.eakin.australia.canberra,antoniette_greta.grima.united_kingdom.london,derya.grer.australia.brisbane,gnes.kirly.norway.oslo,kalijn.peters.netherlands.utrecht,boris.robert.norway.oslo,marcel.thielmann.germany.bayreuth"
10867,10867,2020,7,Nature communications,TEX15 is an essential executor of MIWI2-directed transposon DNA methylation and silencing,"theresa.schpp.united_kingdom.edinburgh,ansgar.zoch.united_kingdom.edinburgh,rebecca_v.berrens.united_kingdom.cambridge,tania.auchynnikava.united_kingdom.edinburgh,yuka.kabayama.united_kingdom.edinburgh,lina.vasiliauskait.united_kingdom.edinburgh,juri.rappsilber.united_kingdom.edinburgh,robin_c.allshire.united_kingdom.edinburgh,dnal.ocarroll.united_kingdom.edinburgh"
10869,10869,2020,7,Nature communications,The architecture and stabilisation of flagellotropic tailed bacteriophages,"joshua_m.hardy.australia.vic,rhys_a.dunstan.australia.vic,rhys.grinter.australia.vic,matthew_j.belousoff.australia.vic,jiawei.wang.australia.vic,derek.pickard.united_kingdom.cambridge,hariprasad.venugopal.australia.vic,gordon.dougan.united_kingdom.cambridge,trevor.lithgow.australia.vic,fassli.coulibaly.australia.vic"
10871,10871,2020,7,PLoS computational biology,Spatial and temporal patterns of nitric oxide diffusion and degradation drive emergent cerebrovascular dynamics,"william_davis.haselden.usa.pennsylvania,ravi_teja.kedarasetti.usa.pennsylvania,patrick_j.drew.usa.pennsylvania"
10872,10872,2020,7,PLoS computational biology,Temperature-robust activity patterns arise from coordinated axonal Sodium channel properties,"margaret_l.demaegd.usa.illinois,wolfgang.stein.usa.illinois"
10873,10873,2020,7,PLoS computational biology,An extended and generalized framework for the calculation of metabolic intervention strategies based on minimal cut sets,"philipp.schneider.germany.magdeburg,axel.von_kamp.germany.magdeburg,steffen.klamt.germany.magdeburg"
10874,10874,2020,7,PLoS computational biology,scPADGRN: A preconditioned ADMM approach for reconstructing dynamic gene regulatory network using single-cell RNA sequencing data,"xiao.zheng.china.wuhan,yuan.huang.usa.connecticut,xiufen.zou.china.wuhan"
10875,10875,2020,7,PLoS computational biology,A circuit model of auditory cortex,"youngmin.park.usa.pennsylvania,maria_n.geffen.usa.pennsylvania"
10876,10876,2020,7,PLoS genetics,The evolution and functional divergence of the histone H2B family in plants,"danhua.jiang.austria.vienna,michael.borg.austria.vienna,zdravko_j.lorkovi.austria.vienna,sean_a.montgomery.austria.vienna,akihisa.osakabe.austria.vienna,ramesh.yelagandula.austria.vienna,elin.axelsson.austria.vienna,frdric.berger.austria.vienna"
10877,10877,2020,7,PLoS genetics,IgaA negatively regulates the Rcs Phosphorelay via contact with the RcsD Phosphotransfer Protein,"erin_a.wall.usa.maryland,nadim.majdalani.usa.maryland,susan.gottesman.usa.maryland"
10880,10880,2020,7,PLoS neglected tropical diseases,Occurrence of multiple genotype infection caused by Leishmania infantum in naturally infected dogs,"elisa.cupolillo.brazil.riodejaneiro,amanda_s.cavalcanti.brazil.riodejaneiro,gabriel_eduardo_melim.ferreira.brazil.riodejaneiro,mariana_crtes.boit.brazil.riodejaneiro,fernanda_nazar.morgado.brazil.riodejaneiro,renato.porrozzi.brazil.riodejaneiro"
10881,10881,2020,7,PLoS neglected tropical diseases,Health services uptake among nomadic pastoralist populations in Africa: A systematic review of the literature,"victoria_m.gammino.usa.georgia,michael_r.diaz.usa.georgia,sarah_w.pallas.usa.georgia,abigail_r.greenleaf.usa.maryland,molly_r.kurnit.usa.georgia"
10884,10884,2020,7,PLoS pathogens,"An HSV-2 nucleoside-modified mRNA genital herpes vaccine containing glycoproteins gC, gD, and gE protects mice against HSV-1 genital lesions and latent infection","kevin_p.egan.usa.pennsylvania,lauren_m.hook.usa.pennsylvania,alexis.naughton.usa.pennsylvania,norbert.pardi.usa.pennsylvania,sita.awasthi.usa.pennsylvania,gary_h.cohen.usa.pennsylvania,drew.weissman.usa.pennsylvania,harvey_m.friedman.usa.pennsylvania"
10885,10885,2020,7,PLoS pathogens,S-glutathionylation proteome profiling reveals a crucial role of a thioredoxin-like protein in interspecies competition and cariogenecity of Streptococcus mutans,"zhengyi.li.china.chengdu,chenzi.zhang.china.chengdu,cheng.li.china.chengdu,jiajia.zhou.china.chengdu,xin.xu.china.chengdu,xian.peng.china.chengdu,xuedong.zhou.china.chengdu"
10889,10889,2020,7,Nature communications,Giant magneto-birefringence effect and tuneable colouration of 2D crystal suspensions,"baofu.ding.china.shenzhen,wenjun.kuang.united_kingdom.manchester,yikun.pan.china.shenzhen,i_v.grigorieva.united_kingdom.manchester,a_k.geim.china.shenzhen,bilu.liu.china.shenzhen,huiming.cheng.china.shenzhen"
10890,10890,2020,7,Nature communications,Genome assembly of wild tea tree DASZ reveals pedigree and selection history of tea varieties,"weiyi.zhang.china.wuhan,haiji.qiu.china.wuhan,yafei.guo.china.wuhan,haoliang.wan.china.wuhan,xiaoliang.zhang.china.wuhan,qinghua.zhang.china.wuhan,pu.wang.china.wuhan,li.xu.china.wuhan,maximilian_hw.schmidt.germany.aachen,xinxin.jia.china.wuhan,daili.li.china.wuhan,anting.zhu.china.wuhan,fei.guo.china.wuhan,wei.chen.china.wuhan,dejiang.ni.china.wuhan,bjrn.usadel.germany.aachen,weiwei.wen.china.wuhan"
10891,10891,2020,7,Nature communications,High-throughput production of cheap mineral-based two-dimensional electrocatalysts for high-current-density hydrogen evolution,"chi.zhang.china.shenzhen,yuting.luo.china.shenzhen,junyang.tan.china.shenzhen,qiangmin.yu.china.shenzhen,fengning.yang.china.shenzhen,zhiyuan.zhang.china.shenzhen,liusi.yang.china.shenzhen,huiming.cheng.china.shenzhen,bilu.liu.china.shenzhen"
10892,10892,2020,7,Nature communications,Author Correction: Fossilized solidification fronts in the Bushveld Complex argue for liquid-dominated magmatic systems,"willem.kruger.south_africa.johannesburg,rais.latypov.south_africa.johannesburg"
10894,10894,2020,7,Nature communications,Li<sub>2</sub>CO<sub>3</sub>-affiliative mechanism for air-accessible interface engineering of garnet electrolyte via facile liquid metal painting,"junwei.meng.china.shanghai,yang.zhang.china.shanghai,xuejun.zhou.china.shanghai,meng.lei.china.shanghai,chilin.li.china.shanghai"
10895,10895,2020,7,Nature communications,Patients with immune-mediated inflammatory diseases receiving cytokine inhibitors have low prevalence of SARS-CoV-2 seroconversion,"david.simon.germany.erlangen,koray.tascilar.germany.erlangen,gerhard.krnke.germany.erlangen,arnd.kleyer.germany.erlangen,mario_m.zaiss.germany.erlangen,franz.heppt.germany.erlangen,christine.meder.germany.erlangen,raja.atreya.germany.erlangen,entcho.klenske.germany.erlangen,peter.dietrich.germany.erlangen,abdullah.abdullah.germany.erlangen,thorsten.kliem.germany.erlangen,giulia.corte.germany.erlangen,harriet.morf.germany.erlangen,moritz.leppkes.germany.erlangen,andreas_e.kremer.germany.erlangen,andreas.ramming.germany.erlangen,milena.pachowsky.germany.erlangen,florian.schuch.germany.erlangen,monika.ronneberger.germany.erlangen,stefan.kleinert.germany.erlangen,clara.maier.germany.erlangen,axel_j.hueber.germany.erlangen,bernhard.manger.germany.erlangen,carola.berking.germany.erlangen,matthias.tenbusch.germany.erlangen,klaus.berla.germany.erlangen,michael.sticherling.germany.erlangen,markus_f.neurath.germany.erlangen,georg.schett.germany.erlangen"
10897,10897,2020,7,Nature communications,Phase-controllable growth of ultrathin 2D magnetic FeTe crystals,"lixing.kang.singapore.singapore,chen.ye.singapore.singapore,xiaoxu.zhao.singapore.singapore,xieyu.zhou.china.beijing,junxiong.hu.singapore.singapore,qiao.li.china.nanjing,chandreyee_manas.das.singapore.singapore,jiefu.yang.singapore.singapore,dianyi.hu.singapore.singapore,jieqiong.chen.singapore.singapore,xun.cao.singapore.singapore,yong.zhang.singapore.singapore,manzhang.xu.singapore.singapore,jun.di.singapore.singapore,dan.tian.singapore.singapore,pin.song.singapore.singapore,govindan.kutty.singapore.singapore,qingsheng.zeng.singapore.singapore,qundong.fu.singapore.singapore,ya.deng.singapore.singapore,jiadong.zhou.singapore.singapore,ariando.ariando.singapore.singapore,feng.miao.china.nanjing,yizhong.huang.singapore.singapore,stephen_j.pennycook.singapore.singapore,kentye.yong.singapore.singapore,wei.ji.china.beijing,xiao.renshaw_wang.singapore.singapore,zheng.liu.singapore.singapore"
10900,10900,2020,7,Nature communications,A non-invasive far-red light-induced split-Cre recombinase system for controllable genome engineering in mice,"jiali.wu.china.shanghai,meiyan.wang.china.shanghai,xueping.yang.china.shanghai,chengwei.yi.china.shanghai,jian.jiang.china.shanghai,yuanhuan.yu.china.shanghai,haifeng.ye.china.shanghai"
10901,10901,2020,7,Nature communications,Author Correction: G9a regulates breast cancer growth by modulating iron homeostasis through the repression of ferroxidase hephaestin,"yafang.wang.china.shanghai,jie.zhang.china.shanghai,yi.su.china.shanghai,yanyan.shen.china.shanghai,dongxian.jiang.china.shanghai,yingyong.hou.china.shanghai,meiyu.geng.china.shanghai,jian.ding.china.shanghai,yi.chen.china.shanghai"
10902,10902,2020,7,Nature communications,Differential expression of tissue-restricted antigens among mTEC is associated with distinct autoreactive T cell fates,"marieve.lebel.canada.boulevard,marie.coutelier.canada.montreal,maria.galipeau.canada.boulevard,claudia_l.kleinman.canada.montreal,heather_j.melichar.canada.boulevard"
10903,10903,2020,7,Nature communications,In vivo cell biological screening identifies an endocytic capture mechanism for T-tubule formation,"thomas_e.hall.australia.brisbane,nick.martel.australia.brisbane,nicholas.ariotti.australia.brisbane,zherui.xiong.australia.brisbane,harriet_p.lo.australia.brisbane,charles.ferguson.australia.brisbane,james.rae.australia.brisbane,yewheen.lim.australia.brisbane,robert_g.parton.australia.brisbane"
10904,10904,2020,7,Nature communications,Structural analysis of the SARS-CoV-2 methyltransferase complex involved in RNA cap creation bound to sinefungin,"petra.krafcikova.czech_republic.prague,jan.silhan.czech_republic.prague,radim.nencka.czech_republic.prague,evzen.boura.czech_republic.prague"
10906,10906,2020,7,Nature communications,Copper bioavailability is a KRAS-specific vulnerability in colorectal cancer,"lo.aubert.canada.montreal,neethi.nandagopal.canada.montreal,zachary.steinhart.canada.toronto,genevive.lavoie.canada.montreal,sami.nourreddine.canada.montreal,jacob.berman.canada.toronto,marc_k.sabaelleil.canada.montreal,david.papadopoli.canada.montreal,sichun.lin.canada.toronto,graham.macleod.canada.toronto,ivan.topisirovic.canada.montreal,louis.gaboury.canada.montreal,daniel.schramek.canada.toronto,sylvain.meloche.canada.montreal,stephane.angers.canada.toronto,philippe_p.roux.canada.montreal"
10908,10908,2020,7,Nature communications,Mitochondrial dynamics quantitatively revealed by STED nanoscopy with an enhanced squaraine variant probe,"xusan.yang.china.beijing,zhigang.yang.china.shenzhen,zhaoyang.wu.china.beijing,ying.he.china.shenzhen,chunyan.shan.china.beijing,peiyuan.chai.china.beijing,mi.tian.china.shenzhen,junlin.teng.china.beijing,dayong.jin.china.shenzhen,wei.yan.china.shenzhen,pintu.das.china.shenzhen,junle.qu.china.shenzhen,peng.xi.china.beijing"
10909,10909,2020,7,Nature communications,Mucosal-associated invariant T cells promote inflammation and intestinal dysbiosis leading to metabolic dysfunction during obesity,"amine.toubal.france.paris,badr.kiaf.france.paris,lucie.beaudoin.france.paris,lucie.cagninacci.france.paris,moez.rhimi.france.paris,blandine.fruchet.france.paris,jennifer.da_silva.france.paris,alexandra_j.corbett.australia.melbourne,yannick.simoni.france.paris,olivier.lantz.france.paris,jamie.rossjohn.australia.vic,james.mccluskey.australia.melbourne,philippe.lesnik.france.paris,emmanuelle.maguin.france.paris,agns.lehuen.france.paris"
10910,10910,2020,7,Nature communications,Divergent effects of climate change on future groundwater availability in key mid-latitude aquifers,"wenying.wu.taiwan.taipei,minhui.lo.taiwan.taipei,yoshihide.wada.austria.laxenburg,james_s.famiglietti.canada.saskatoon,pat_jf.yeh.malaysia.subang,agns.ducharne.france.paris"
10911,10911,2020,7,Nature communications,Therapeutic paradigm of dual targeting VEGF and PDGF for effectively treating FGF-2 off-target tumors,"kayoko.hosaka.sweden.stockholm,yunlong.yang.sweden.stockholm,takahiro.seki.sweden.stockholm,qiqiao.du.sweden.stockholm,xu.jing.sweden.stockholm,xingkang.he.sweden.stockholm,jieyu.wu.sweden.stockholm,yin.zhang.sweden.stockholm,hiromasa.morikawa.sweden.stockholm,masaki.nakamura.sweden.stockholm,martin.scherzer.sweden.stockholm,xiaoting.sun.sweden.stockholm,yuanfu.xu.china.nanjing,tao.cheng.china.nanjing,xuri.li.china.guangzhou,xialin.liu.china.guangzhou,qi.li.china.shanghai,yizhi.liu.china.guangzhou,an.hong.china.guangzhou,yuguo.chen.china.jinan,yihai.cao.sweden.stockholm"
10912,10912,2020,7,Nature communications,Highly compressible and anisotropic lamellar ceramic sponges with superior thermal insulation and acoustic absorption performances,"chao.jia.china.beijing,lei.li.china.beijing,ying.liu.china.beijing,ben.fang.china.beijing,he.ding.china.beijing,jianan.song.china.beijing,yibo.liu.china.shenzhen,kejia.xiang.china.beijing,sen.lin.china.beijing,ziwei.li.china.beijing,wenjie.si.china.beijing,bo.li.china.shenzhen,xing.sheng.china.beijing,dongze.wang.china.beijing,xiaoding.wei.china.beijing,hui.wu.china.beijing"
10913,10913,2020,7,Nature communications,Author Correction: Caenorhabditis elegans is a useful model for anthelmintic discovery,"andrew_r.burns.canada.toronto,genna_m.luciani.canada.toronto,gabriel.musso.usa.massachusetts,rachel.bagg.canada.toronto,may.yeo.canada.toronto,yuqian.zhang.canada.toronto,luckshi.rajendran.canada.toronto,john.glavin.canada.toronto,robert.hunter.canada.toronto,elizabeth.redman.canada.calgary,susan.stasiuk.canada.calgary,michael.schertzberg.canada.toronto,g_angus.mcquibban.canada.toronto,conor_r.caffrey.usa.california,sean_r.cutler.usa.california,mike.tyers.canada.montreal,guri.giaever.canada.vancouver,corey.nislow.canada.vancouver,andy_g.fraser.canada.toronto,calum_a.macrae.usa.massachusetts,john.gilleard.canada.calgary,peter_j.roy.canada.toronto"
10914,10914,2020,7,Nature communications,Understanding coordination reaction for producing stable electrode with various low work functions,"hirohiko.fukagawa.japan.tokyo,kazuma.suzuki.japan.tokyo,hirokazu.ito.japan.tokyo,kaito.inagaki.japan.tokyo,tsubasa.sasaki.japan.tokyo,taku.oono.japan.tokyo,munehiro.hasegawa.japan.suita,katsuyuki.morii.japan.suita,takahisa.shimizu.japan.tokyo"
10917,10917,2020,7,Nature communications,Protein-ligand binding with the coarse-grained Martini model,"paulo_c_t.souza.netherlands.groningen,sebastian.thallmair.netherlands.groningen,paolo.conflitti.switzerland.lugano,carlos.ramrezpalacios.netherlands.groningen,riccardo.alessandri.netherlands.groningen,stefano.raniolo.switzerland.lugano,vittorio.limongelli.switzerland.lugano,siewert_j.marrink.netherlands.groningen"
10919,10919,2020,7,Nature communications,Single-cell transcriptomic analysis in a mouse model deciphers cell transition states in the multistep development of esophageal cancer,"jiacheng.yao.china.beijing,qionghua.cui.china.beijing,wenyi.fan.china.beijing,yuling.ma.china.beijing,yamei.chen.china.beijing,tianyuan.liu.china.beijing,xiannian.zhang.china.beijing,yiyi.xi.china.beijing,chengcheng.wang.china.beijing,linna.peng.china.beijing,yingying.luo.china.beijing,ai.lin.china.beijing,wenjia.guo.china.beijing,lin.lin.china.beijing,yuan.lin.china.beijing,wen.tan.china.beijing,dongxin.lin.china.beijing,chen.wu.china.beijing,jianbin.wang.china.beijing"
10921,10921,2020,7,Nature communications,Preparation of TiH<sub>1.924</sub> nanodots by liquid-phase exfoliation for enhanced sonodynamic cancer therapy,"fei.gong.china.suzhou,liang.cheng.china.suzhou,nailin.yang.china.suzhou,yuehan.gong.china.suzhou,yanwen.ni.china.suzhou,shang.bai.china.suzhou,xianwen.wang.china.suzhou,muchao.chen.china.suzhou,qian.chen.china.suzhou,zhuang.liu.china.suzhou"
10922,10922,2020,7,Nature communications,Duplex DNA engagement and RPA oppositely regulate the DNA-unwinding rate of CMG helicase,"hazal_b.kose.united_kingdom.london,sherry.xie.united_kingdom.london,george.cameron.united_kingdom.london,melania_s.strycharska.united_kingdom.london,hasan.yardimci.united_kingdom.london"
10924,10924,2020,7,PLoS computational biology,A practical application of generative adversarial networks for RNA-seq analysis to predict the molecular progress of Alzheimer's disease,"jinhee.park.south_korea.daegu,hyerin.kim.south_korea.daegu,jaekwang.kim.south_korea.daegu,mookyung.cheon.south_korea.daegu"
10930,10930,2020,7,PLoS neglected tropical diseases,"Genetic tools discriminate strains of Leishmania infantum isolated from  humans and dogs in Sicily, Italy","germano.castelli.italy.palermo,federica.bruno.italy.palermo,valentina.caputo.italy.palermo,santi.fiorella.italy.palermo,ignazio.sammarco.italy.palermo,tiziana.lupo.italy.palermo,antonella.migliazzo.italy.palermo,fabrizio.vitale.italy.palermo,stefano.reale.italy.palermo"
10933,10933,2020,7,PLoS pathogens,Evolving MRSA: High-level β-lactam resistance in Staphylococcus aureus is associated with RNA Polymerase alterations and fine tuning of gene expression,"viralkumar_v.panchal.united_kingdom.sheffield,caitlin.griffiths.united_kingdom.newcastle,hamed.mosaei.united_kingdom.newcastle,bohdan.bilyk.united_kingdom.sheffield,joshua_a_f.sutton.united_kingdom.sheffield,oliver_t.carnell.united_kingdom.sheffield,david_p.hornby.united_kingdom.sheffield,jeffrey.green.united_kingdom.sheffield,jamie_k.hobbs.united_kingdom.sheffield,william_l.kelley.switzerland.geneva,nikolay.zenkin.united_kingdom.newcastle,simon_j.foster.united_kingdom.sheffield"
10934,10934,2020,7,PLoS pathogens,Timelines of infection and transmission dynamics of H1N1pdm09 in swine,"laetitia.canini.united_kingdom.edinburgh,barbara.holzer.united_kingdom.woking,sophie.morgan.united_kingdom.woking,johanneke.dinie_hemmink.united_kingdom.woking,becky.clark.united_kingdom.woking,mark_e_j.woolhouse.united_kingdom.edinburgh,elma.tchilian.united_kingdom.woking,bryan.charleston.united_kingdom.woking"
10935,10935,2020,7,Science advances,Extraordinary curtailment of massive typhus epidemic in the Warsaw Ghetto,"lewi.stone.israel.telaviv,daihai.he.china.hongkong,stephan.lehnstaedt.germany.berlin,yael.artzyrandrup.netherlands.amsterdam"
10946,10946,2020,7,Science advances,SirT7 auto-ADP-ribosylation regulates glucose starvation response through mH2A1,"nicols_g.simonet.spain.barcelona,berta_n.vazquez.spain.barcelona,alessandro.ianni.germany.nauheim,maria.espinosaalcantud.spain.barcelona,julia.moralessanfrutos.spain.barcelona,sarah.hurtadobags.spain.barcelona,eduard.sabid.spain.barcelona,marcus.buschbeck.spain.barcelona,carolina.de_la_torre.spain.barcelona,manel.esteller.spain.barcelona,thomas.braun.germany.nauheim,alejandro.vaquero.spain.barcelona"
10947,10947,2020,7,Science advances,"Structure-specific DNA recombination sites: Design, validation, and machine learning-based refinement","aleksandra.nivina.france.paris,maj_svea.grieb.france.paris,cline.loot.france.paris,david.bikard.france.paris,jean.cury.france.paris,laila.shehata.france.paris,didier.mazel.france.paris"
10950,10950,2020,7,Science advances,When ontogeny recapitulates phylogeny: Fixed neurodevelopmental sequence of manipulative skills among primates,"sandra_a.heldstab.switzerland.zurich,karin.isler.switzerland.zurich,caroline.schuppli.switzerland.zurich,carel_p.van_schaik.switzerland.zurich"
