,Unnamed: 0.1,pub_year,pub_month,journal_name,paper_title,author
7709,7709,2020,9,Cell host & microbe,A Fight between Plants and Pathogens for the Control of Chloroplasts,"dong_wook.lee.south_korea.gwangju,inhwan.hwang.south_korea.pohang"
7717,7717,2020,9,Cell host & microbe,Metagenome Data on Intestinal Phage-Bacteria Associations Aids the Development of Phage Therapy against Pathobionts,"kosuke.fujimoto.japan.tokyo,yasumasa.kimura.japan.tokyo,masaki.shimohigoshi.japan.osaka,takeshi.satoh.japan.tokyo,shintaro.sato.japan.osaka,georg.tremmel.japan.tokyo,miho.uematsu.japan.osaka,yunosuke.kawaguchi.japan.osaka,yuki.usui.japan.tokyo,yoshiko.nakano.japan.osaka,tetsuya.hayashi.japan.osaka,koji.kashima.japan.tokyo,yoshikazu.yuki.japan.tokyo,kiyoshi.yamaguchi.japan.tokyo,yoichi.furukawa.japan.tokyo,masanori.kakuta.japan.tokyo,yutaka.akiyama.japan.tokyo,rui.yamaguchi.japan.tokyo,peter_b.ernst.usa.california,satoru.miyano.japan.tokyo,hiroshi.kiyono.japan.tokyo,seiya.imoto.japan.tokyo,satoshi.uematsu.japan.tokyo"
7719,7719,2020,9,Cell host & microbe,The Spatial Heterogeneity of the Gut Limits Predation and Fosters Coexistence of Bacteria and Bacteriophages,"marta.loureno.france.paris,lorenzo.chaffringeon.france.paris,quentin.lamybesnier.france.paris,thierry.pdron.france.paris,pascal.campagne.france.paris,claudia.eberl.germany.munich,marion.brard.france.paris,brbel.stecher.germany.munich,laurent.debarbieux.france.paris,luisa.de_sordi.france.paris"
7720,7720,2020,9,Cell host & microbe,Neutralization of SARS-CoV-2 by Destruction of the Prefusion Spike,"jiandong.huo.united_kingdom.didcot,yuguang.zhao.united_kingdom.oxford,jingshan.ren.united_kingdom.oxford,daming.zhou.united_kingdom.oxford,helen_m_e.duyvesteyn.united_kingdom.oxford,helen_m.ginn.united_kingdom.didcot,loic.carrique.united_kingdom.oxford,tomas.malinauskas.united_kingdom.oxford,reinis_r.ruza.united_kingdom.oxford,pranav_n_m.shah.united_kingdom.oxford,tiong_kit.tan.united_kingdom.oxford,pramila.rijal.united_kingdom.oxford,julika.radecke.united_kingdom.didcot,neil_g.paterson.united_kingdom.didcot,piyada.supasa.united_kingdom.oxford,juthathip.mongkolsapaya.thailand.bangkok,gavin_r.screaton.united_kingdom.oxford,miles.carroll.united_kingdom.oxford,alain.townsend.united_kingdom.oxford,elizabeth_e.fry.united_kingdom.oxford,raymond_j.owens.united_kingdom.didcot,david_i.stuart.united_kingdom.didcot"
7725,7725,2020,9,Nature communications,Author Correction: Boosting output performance of sliding mode triboelectric nanogenerator by charge space-accumulation effect,"wencong.he.china.chongqing,wenlin.liu.china.chongqing,jie.chen.china.chongqing,zhao.wang.china.chongqing,yike.liu.china.chongqing,xianjie.pu.china.chongqing,hongmei.yang.china.chongqing,qian.tang.china.chongqing,huake.yang.china.chongqing,hengyu.guo.china.chongqing,chenguo.hu.china.chongqing"
7726,7726,2020,9,Nature communications,Canadian permafrost stores large pools of ammonium and optically distinct dissolved organic matter,"j.fouch.france.montpellier,c_t.christiansen.denmark.copenhagen,m_j.lafrenire.canada.kingston,p.grogan.canada.kingston,s_f.lamoureux.canada.kingston"
7728,7728,2020,9,Nature communications,Global patterns of the leaf economics spectrum in wetlands,"yingji.pan.netherlands.leiden,ellen.cieraad.netherlands.leiden,jean.armstrong.united_kingdom.hull,william.armstrong.united_kingdom.hull,timothy_d.colmer.australia.perth,ole.pedersen.australia.perth,eric_j_w.visser.netherlands.nijmegen,laurentius_a_c_j.voesenek.netherlands.utrecht,peter_m.van_bodegom.netherlands.leiden"
7730,7730,2020,9,Nature communications,Transgenerational inheritance of impaired larval T cell development in zebrafish,"norimasa.iwanami.germany.freiburg,divinefondzenyuy.lawir.germany.freiburg,katarzyna.sikora.germany.freiburg,connor.o_meara.germany.freiburg,michael.schorpp.germany.freiburg,thomas.boehm.germany.freiburg"
7731,7731,2020,9,Nature communications,A role for annexin A2 in scaffolding the peroxiredoxin 2-STAT3 redox relay complex,"deepti.talwar.germany.heidelberg,joris.messens.belgium.brussels,tobias_p.dick.germany.heidelberg"
7733,7733,2020,9,Nature communications,Implicit pattern learning predicts individual differences in belief in God in the United States and Afghanistan,"adam_b.weinberger.usa.washington,natalie_m.gallagher.usa.washington,zachary_j.warren.usa.washington,gwendolyn_a.english.usa.washington,fathali_m.moghaddam.usa.washington,adam_e.green.usa.washington"
7735,7735,2020,9,Nature communications,The neuromuscular junction is a focal point of mTORC1 signaling in sarcopenia,"daniel_j.ham.switzerland.basel,anastasiya.brsch.switzerland.basel,shuo.lin.switzerland.basel,marco.thrkauf.switzerland.basel,martin.weihrauch.switzerland.basel,judith_r.reinhard.switzerland.basel,julien.delezie.switzerland.basel,fabienne.battilana.switzerland.basel,marco_s.kaiser.switzerland.basel,maitea.guridi.switzerland.basel,michael.sinnreich.switzerland.basel,nitish.mittal.switzerland.basel,lionel_a.tintignac.switzerland.basel,christoph.handschin.switzerland.basel,mihaela.zavolan.switzerland.basel,markus_a.regg.switzerland.basel"
7737,7737,2020,9,Nature communications,Robust metal ion-chelated polymer interfacial layer for ultraflexible non-fullerene organic solar cells,"fei.qin.china.wuhan,wen.wang.china.wuhan,lulu.sun.china.wuhan,xueshi.jiang.china.wuhan,lin.hu.china.wuhan,sixing.xiong.china.wuhan,tiefeng.liu.china.wuhan,xinyun.dong.china.wuhan,jing.li.china.wuhan,youyu.jiang.china.wuhan,jianhui.hou.china.beijing,kenjiro.fukuda.japan.saitama,takao.someya.japan.saitama,yinhua.zhou.china.wuhan"
7740,7740,2020,9,Nature communications,Chiroptical spectroscopy of a freely diffusing single nanoparticle,"johannes.sachs.germany.stuttgart,janphilipp.gnther.germany.stuttgart,andrew_g.mark.germany.stuttgart,peer.fischer.germany.stuttgart"
7741,7741,2020,9,Nature communications,Single-cell transcriptomes of pancreatic preinvasive lesions and cancer reveal acinar metaplastic cells' heterogeneity,"yehuda.schlesinger.israel.jerusalem,oshri.yosefovlevi.israel.jerusalem,dror.kolodkingal.israel.jerusalem,roy_zvi.granit.israel.jerusalem,luriano.peters.israel.jerusalem,rachel.kalifa.israel.jerusalem,lei.xia.israel.jerusalem,abdelmajeed.nasereddin.israel.jerusalem,idit.shiff.israel.jerusalem,osher.amran.israel.jerusalem,yuval.nevo.israel.jerusalem,sharona.elgavish.israel.jerusalem,karine.atlan.israel.jerusalem,gideon.zamir.israel.jerusalem,oren.parnas.israel.jerusalem"
7742,7742,2020,9,Nature communications,Swelling-strengthening hydrogels by embedding with deformable nanobarriers,"feng.wu.china.shanghai,yan.pang.china.shanghai,jinyao.liu.china.shanghai"
7743,7743,2020,9,Nature communications,Uncovering the cytochrome P450-catalyzed methylenedioxy bridge formation in streptovaricins biosynthesis,"guo.sun.china.wuhan,chaoqun.hu.china.wuhan,qing.mei.china.wuhan,minghe.luo.china.wuhan,xu.chen.china.wuhan,zhengyuan.li.china.wuhan,yuanzhen.liu.china.wuhan,zixin.deng.china.wuhan,zhengyu.zhang.china.wuhan,yuhui.sun.china.wuhan"
7744,7744,2020,9,Nature communications,Microenvironment-responsive immunoregulatory electrospun fibers for promoting nerve function recovery,"kun.xi.china.suzhou,yong.gu.china.suzhou,jincheng.tang.china.suzhou,hao.chen.china.shanghai,yun.xu.china.shanghai,liang.wu.china.suzhou,feng.cai.china.suzhou,lianfu.deng.china.shanghai,huilin.yang.china.suzhou,qin.shi.china.suzhou,wenguo.cui.china.suzhou,liang.chen.china.suzhou"
7747,7747,2020,9,Nature communications,Functional regulation of an ancestral RAG transposon ProtoRAG by a trans-acting factor YY1 in lancelet,"song.liu.china.guangzhou,shaochun.yuan.china.guangzhou,xiaoman.gao.china.guangzhou,xin.tao.china.guangzhou,wenjuan.yu.china.guangzhou,xu.li.china.guangzhou,shangwu.chen.china.guangzhou,anlong.xu.china.guangzhou"
7753,7753,2020,9,PLoS computational biology,Similarities and differences in spatial and non-spatial cognitive maps,"charley_m.wu.usa.massachusetts,mona_m.garvert.germany.leipzig,bjrn.meder.germany.berlin,nicolas_w.schuck.germany.berlin"
7754,7754,2020,9,PLoS computational biology,Tempora: Cell trajectory inference using time-series single-cell RNA sequencing data,"thinh_n.tran.canada.ontario,gary_d.bader.canada.ontario"
7757,7757,2020,9,PLoS pathogens,Can data from paediatric cohorts solve the COVID-19 puzzle,"lien_anh_ha.do.australia.melbourne,jeremy.anderson.australia.melbourne,edward_kim.mulholland.australia.melbourne,paul_v.licciardi.australia.melbourne"
7758,7758,2020,9,PLoS pathogens,Toll-like receptor 4-mediated inflammation triggered by extracellular IFI16 is enhanced by lipopolysaccharide binding,"andrea.iannucci.italy.novara,valeria.caneparo.italy.novara,stefano.raviola.italy.novara,isacco.debernardi.italy.novara,donato.colangelo.italy.novara,riccardo.miggiano.italy.novara,gloria.griffante.italy.novara,santo.landolfo.italy.turin,marisa.gariglio.italy.novara,marco.de_andrea.italy.novara"
7759,7759,2020,9,PLoS pathogens,Lyssavirus P-protein selectively targets STAT3-STAT1 heterodimers to modulate cytokine signalling,"angela_r.harrison.australia.victoria,kim_g.lieu.australia.parkville,florence.larrous.france.paris,naoto.ito.japan.gifu,herv.bourhy.france.paris,gregory_w.moseley.australia.victoria"
7761,7761,2020,9,Science advances,Let-7 derived from endometrial extracellular vesicles is an important inducer of embryonic diapause in mice,"w_m.liu.china.shenzhen,r_r.cheng.china.hongkong,z_r.niu.china.hongkong,a_c.chen.china.hongkong,m_y.ma.china.beijing,t.li.china.guangzhou,p_c.chiu.china.shenzhen,r_t.pang.china.shenzhen,y_l.lee.china.shenzhen,j_p.ou.china.guangzhou,y_q.yao.china.beijing,w_s_b.yeung.china.shenzhen"
7763,7763,2020,9,Science advances,Quantum key distribution with correlated sources,"margarida.pereira.spain.vigo,go.kato.japan.kanagawa,akihiro.mizutani.japan.kamakura,marcos.curty.spain.vigo"
7764,7764,2020,9,Science advances,3D bioprinting dual-factor releasing and gradient-structured constructs ready to implant for anisotropic cartilage regeneration,"yongqing.you.china.suzhou,wenbo.jiang.china.shanghai,bo.wang.china.shanghai,qiang.wu.china.shanghai,kerong.dai.china.shanghai"
7766,7766,2020,9,Science advances,Cost-effective priorities for the expansion of global terrestrial protected areas: Setting post-2020 global and national targets,"rui.yang.china.beijing,yue.cao.china.beijing,shuyu.hou.china.beijing,qinyi.peng.china.beijing,xiaoshan.wang.china.beijing,fangyi.wang.china.beijing,tzhsuan.tseng.china.beijing,le.yu.china.beijing,steve.carver.united_kingdom.leeds,zhicong.zhao.china.beijing,xiaoli.shen.china.beijing,sheng.li.china.beijing,yaomin.zheng.china.beijing,han.liu.china.beijing,peng.gong.china.beijing,keping.ma.china.beijing"
7769,7769,2020,9,Science advances,Revealing hidden medium-range order in amorphous materials using topological data analysis,"sren_s.srensen.denmark.aalborg,christophe_a_n.biscio.denmark.aalborg,lisbeth.fajstrup.denmark.aalborg,morten_m.smedskjaer.denmark.aalborg"
7772,7772,2020,9,Science advances,An enormous sulfur isotope excursion indicates marine anoxia during the end-Triassic mass extinction,"tianchen.he.united_kingdom.leeds,jacopo.dal_corso.united_kingdom.leeds,robert_j.newton.united_kingdom.leeds,paul_b.wignall.united_kingdom.leeds,benjamin_j_w.mills.united_kingdom.leeds,simona.todaro.italy.palermo,pietro.di_stefano.italy.palermo,emily_c.turner.united_kingdom.leeds,robert_a.jamieson.united_kingdom.leeds,vincenzo.randazzo.italy.palermo,rosemary_e.jones.united_kingdom.oxford,alexander_m.dunhill.united_kingdom.leeds"
7773,7773,2020,9,Science advances,Real-time shaping of entangled photons by classical control and feedback,"ohad.lib.israel.jerusalem,giora.hasson.israel.jerusalem,yaron.bromberg.israel.jerusalem"
7774,7774,2020,9,Science advances,B cells polarize pathogenic inflammatory T helper subsets through ICOSL-dependent glycolysis,"qiuhui.zeng.china.guangzhou,yuan.wei.china.guangzhou,xiangming.lao.china.guangzhou,dongping.chen.china.guangzhou,chunxiang.huang.china.guangzhou,qianyi.lin.china.guangzhou,min.he.china.guangzhou,yuan.liao.china.guangzhou,limin.zheng.china.guangzhou,bo.li.china.guangzhou,guangbo.zhang.china.suzhou,yun.chen.china.nanjing,dongming.kuang.china.guangzhou"
7775,7775,2020,9,Science advances,Directional liquid dynamics of interfaces with superwettability,"haoyu.dai.china.beijing,zhichao.dong.china.beijing,lei.jiang.china.beijing"
7778,7778,2020,9,Science advances,"Generating multifunctional acoustic tweezers in Petri dishes for contactless, precise manipulation of bioparticles","zhenhua.tian.usa.durham,zeyu.wang.usa.durham,peiran.zhang.usa.durham,ty_downing.naquin.usa.durham,yuqi.wu.usa.durham,shujie.yang.usa.durham,yuyang.gu.usa.durham,hunter.bachman.usa.durham,yaosi.liang.usa.durham,zhiming.yu.usa.durham,tony_jun.huang.usa.durham"
7781,7781,2020,9,Science translational medicine,Characterization of <i>ANGPT2</i> mutations associated with primary lymphedema,"velimatti.leppnen.finland.helsinki,pascal.brouillard.finland.brussels,emilia_a.korhonen.finland.helsinki,tuomas.sipil.finland.helsinki,nicole.revencu.belgium.brussels,elodie.fastr.belgium.brussels,matthieu.schlgel.belgium.brussels,marie.ravoet.belgium.brussels,donatella.angelone.italy.roma,giovanni.crichiutti.italy.udine,angela.delia.italy.udine,jaakko.kuurne.finland.helsinki,harri.elamaa.finland.oulu,gou_young.koh.south_korea.daejeon,pipsa.saharinen.finland.helsinki,miikka.vikkula.finland.brussels,kari.alitalo.finland.helsinki"
7782,7782,2020,9,Science translational medicine,Ultrasensitive molecular imaging of intestinal mucosal inflammation using leukocyte-mimicking particles targeted to MAdCAM-1 in mice,"antoine_p.fournier.france.caen,sara.martinez_de_lizarrondo.france.caen,adrien.rateau.france.caen,axel.gerardbrisou.france.caen,maximilian_j.waldner.germany.erlangen,markus_f.neurath.germany.erlangen,denis.vivien.france.caen,fabian.docagne.france.caen,maxime.gauberti.france.caen"
7784,7784,2020,9,Science translational medicine,Restoring the natural tropism of AAV2 vectors for human liver,"marti.cabanescreus.australia.westmead,claus_v.hallwirth.australia.westmead,adrian.westhaus.australia.westmead,boaz_h.ng.australia.westmead,sophia_h_y.liao.australia.westmead,erhua.zhu.australia.westmead,renina_gale.navarro.australia.westmead,grober.baltazar.australia.westmead,matthieu.drouyer.australia.westmead,suzanne.scott.australia.westmead,grant_j.logan.australia.westmead,giorgia.santilli.united_kingdom.london,samantha_l.ginn.australia.westmead,geoff.mccaughan.australia.sydney,adrian_j.thrasher.united_kingdom.london,ian_e.alexander.australia.westmead,leszek.lisowski.australia.westmead"
7787,7787,2020,9,Cell reports,YTHDF2/3 Are Required for Somatic Reprogramming through Different RNA Deadenylation Pathways,"jiadong.liu.china.beijing,mingwei.gao.china.beijing,shuyang.xu.china.guangzhou,yaping.chen.china.beijing,kaixin.wu.china.guangzhou,he.liu.china.guangzhou,jie.wang.china.guangzhou,xuejie.yang.china.guangzhou,junwei.wang.china.guangzhou,weiwei.liu.china.beijing,xichen.bao.china.guangzhou,jiekai.chen.china.guangzhou"
7789,7789,2020,9,Cell reports,A Brainstem Locomotor Circuit Drives the Activity of Speed Cells in the Medial Entorhinal Cortex,"miguel_m.carvalho.norway.trondheim,nouk.tanke.norway.trondheim,menno_p.witter.norway.trondheim,maybritt.moser.norway.trondheim,edvard_i.moser.norway.trondheim"
7790,7790,2020,9,Cell reports,A WW Tandem-Mediated Dimerization Mode of SAV1 Essential for Hippo Signaling,"zhijie.lin.china.kowloon,ruiling.xie.china.beijing,mingjie.zhang.china.kowloon"
7791,7791,2020,9,Cell reports,Hypoxia Triggers the Intravasation of Clustered Circulating Tumor Cells,"cinzia.donato.switzerland.basel,leo.kunz.switzerland.basel,francesc.castroginer.switzerland.lausanne,aino.paasinensohns.switzerland.basel,karin.strittmatter.switzerland.basel,barbara_maria.szczerba.switzerland.basel,ramona.scherrer.switzerland.basel,nunzia.di_maggio.switzerland.basel,wolf.heusermann.switzerland.basel,oliver.biehlmaier.switzerland.basel,christian.beisel.switzerland.basel,marcus.vetter.switzerland.basel,christoph.rochlitz.switzerland.basel,walter_paul.weber.switzerland.basel,andrea.banfi.switzerland.basel,timm.schroeder.switzerland.basel,nicola.aceto.switzerland.basel"
7793,7793,2020,9,Cell reports,Local Production of Osteoprotegerin by Osteoblasts Suppresses Bone Resorption,"keisha_m.cawley.usa.arkansas,nancy_cecile.bustamantegomez.usa.arkansas,anveshi_g.guha.usa.arkansas,ryan_s.macleod.usa.arkansas,jinhu.xiong.usa.arkansas,igor.gubrij.usa.arkansas,yu.liu.usa.arkansas,michela.palmieri.usa.arkansas,jeff_d.thostenson.usa.arkansas,joseph_j.goellner.usa.arkansas"
7794,7794,2020,9,Cell reports,CATP-8/P5A ATPase Regulates ER Processing of the DMA-1 Receptor for Dendritic Branching,"zhigang.feng.china.beijing,yupeng.zhao.china.shanghai,tingting.li.china.shanghai,wang.nie.china.shanghai,xiaoyan.yang.china.shanghai,xinjian.wang.china.shanghai,jianguo.wu.china.shanghai,jun.liao.china.shanghai,yan.zou.china.shanghai"
7796,7796,2020,9,Cell reports,Legionella Manipulates Non-canonical SNARE Pairing Using a Bacterial Deubiquitinase,"tomoe.kitao.japan.gifu,kyoichiro.taguchi.japan.gifu,shintaro.seto.japan.tokyo,kohei.arasaki.japan.tokyo,hiroki.ando.japan.gifu,hiroki.nagai.japan.gifu,tomoko.kubori.japan.gifu"
7798,7798,2020,9,Cell reports,Metabolic Control of Gametophore Shoot Formation through Arginine in the Moss Physcomitrium patens,"kensuke.kawade.japan.yokohama,gorou.horiguchi.japan.tokyo,yuu.hirose.japan.toyohashi,akira.oikawa.japan.tsuruoka,masami_yokota.hirai.japan.yokohama,kazuki.saito.japan.chiba,tomomichi.fujita.japan.sapporo,hirokazu.tsukaya.japan.tokyo"
7805,7805,2020,9,Cell reports,OPG Production Matters Where It Happened,"masayuki.tsukasaki.japan.tokyo,tatsuo.asano.japan.tokyo,ryunosuke.muro.japan.tokyo,nam_congnhat.huynh.japan.tokyo,noriko.komatsu.japan.tokyo,kazuo.okamoto.japan.tokyo,kenta.nakano.japan.tokyo,tadashi.okamura.japan.tokyo,takeshi.nitta.japan.tokyo,hiroshi.takayanagi.japan.tokyo"
7807,7807,2020,9,Cell reports,High Dimensional Single-Cell Analysis Reveals iNKT Cell Developmental Trajectories and Effector Fate Decision,"thomas.baranek.france.tours,carolina.de_amat_herbozo.canada.toronto,loc.gonzalez.france.tours,gemma.bogard.france.tours,cline.dietrich.france.paris,chlo.boisseau.france.tours,youenn.jouan.france.tours,franois.trottein.france.lille,mustapha.sitahar.france.tours,maria.leitedemoraes.france.paris,thierry.mallevaey.canada.toronto,christophe.paget.france.tours"
7808,7808,2020,9,Cell reports,Brain States and Transitions: Insights from Computational Neuroscience,"morten_l.kringelbach.united_kingdom.oxford,gustavo.deco.australia.melbourne"
7809,7809,2020,9,Nature communications,Modulating electrolyte structure for ultralow temperature aqueous zinc batteries,"qiu.zhang.china.tianjin,yilin.ma.china.tianjin,yong.lu.china.tianjin,lin.li.china.tianjin,fang.wan.china.tianjin,kai.zhang.china.tianjin,jun.chen.china.tianjin"
7811,7811,2020,9,Nature communications,Environmental-social-economic footprints of consumption and trade in the Asia-Pacific region,"lan.yang.china.shanghai,yutao.wang.china.shanghai,ranran.wang.netherlands.enschede,ji_jaromr.kleme.czech_republic.brno,xinzhu.zheng.china.beijing,yuanbo.qiao.china.qingdao"
7812,7812,2020,9,Nature communications,"Synthesis of chiral anti-1,2-diamine derivatives through copper(I)-catalyzed asymmetric α-addition of ketimines to aldimines","xucheng.gan.china.shanghai,chengyuan.zhang.china.shanghai,feng.zhong.china.shanghai,ping.tian.china.shanghai,liang.yin.china.shanghai"
7813,7813,2020,9,Nature communications,Wrapping glia regulates neuronal signaling speed and precision in the peripheral nervous system of Drosophila,"rita.kottmeier.germany.munster,jonas.bittern.germany.munster,andreas.schoofs.germany.bonn,frederieke.scheiwe.germany.munster,till.matzat.germany.munster,michael.pankratz.germany.bonn,christian.klmbt.germany.munster"
7814,7814,2020,9,Nature communications,Enhancing mucosal immunity by transient microbiota depletion,"simone.becattini.usa.newyork,eric_r.littmann.usa.newyork,ruth.seok.usa.newyork,luigi.amoretti.usa.newyork,emily.fontana.usa.newyork,roberta.wright.usa.newyork,mergim.gjonbalaj.usa.newyork,ingrid_m.leiner.usa.newyork,george.plitas.usa.newyork,tobias_m.hohl.usa.newyork,eric_g.pamer.usa.newyork"
7818,7818,2020,9,Nature communications,"The precursor of PI(3,4,5)P<sub>3</sub> alleviates aging by activating daf-18(Pten) and independent of daf-16","dawei.shi.china.shanghai,xian.xia.china.shanghai,aoyuan.cui.china.beijing,zhongxiang.xiong.china.shanghai,yizhen.yan.china.shanghai,jing.luo.china.shanghai,guoyu.chen.china.shanghai,yingying.zeng.china.shanghai,donghong.cai.china.shanghai,lei.hou.china.shanghai,joseph.mcdermott.china.shanghai,hong.zhang.china.beijing,jingdong_j.han.china.shanghai"
7819,7819,2020,9,Nature communications,Engineering multiple species-like genetic incompatibilities in insects,"maciej.maselko.usa.saintpaul,nathan.feltman.usa.saintpaul,ambuj.upadhyay.usa.saintpaul,amanda.hayward.usa.saintpaul,siba.das.usa.saintpaul,nathan.myslicki.usa.saintpaul,aidan_j.peterson.usa.saintpaul,michael_b.oconnor.usa.saintpaul,michael_j.smanski.usa.saintpaul"
7821,7821,2020,9,Nature communications,Collectively stabilizing and orienting posterior migratory forces disperses cell clusters in vivo,"b.lin.usa.newyork,j.luo.usa.newyork,r.lehmann.usa.newyork"
7822,7822,2020,9,Nature communications,Area law of noncritical ground states in 1D long-range interacting systems,"tomotaka.kuwahara.japan.tokyo,keiji.saito.japan.yokohama"
7824,7824,2020,9,Nature communications,Identification of molecular quantum states using phase-sensitive forces,"kaveh.najafian.switzerland.basel,ziv.meir.switzerland.basel,mudit.sinhal.switzerland.basel,stefan.willitsch.switzerland.basel"
7825,7825,2020,9,Nature communications,Dislocation and oxygen-release driven delithiation in Li<sub>2</sub>MnO<sub>3</sub>,"kei.nakayama.japan.tokyo,ryo.ishikawa.japan.tokyo,naoya.shibata.japan.tokyo,yuichi.ikuhara.japan.tokyo"
7826,7826,2020,9,Nature communications,Converting microwave and telecom photons with a silicon photonic nanomechanical interface,"g.arnold.austria.klosterneuburg,m.wulf.austria.klosterneuburg,s.barzanjeh.austria.klosterneuburg,e_s.redchenko.austria.klosterneuburg,a.rueda.austria.klosterneuburg,w_j.hease.austria.klosterneuburg,f.hassani.austria.klosterneuburg,j_m.fink.austria.klosterneuburg"
7828,7828,2020,9,Nature communications,Graphdiyne-modified TiO<sub>2</sub> nanofibers with osteoinductive and enhanced photocatalytic antibacterial activities to prevent implant infection,"rui.wang.china.wuhan,miusi.shi.china.wuhan,yun.qiu.china.wuhan,peng.zhang.china.wuhan,kailun.shen.china.wuhan,qin.zhao.china.wuhan,yufeng.zhang.china.wuhan"
7829,7829,2020,9,Nature communications,"A molecular sensor to quantify the localization of proteins, DNA and nanoparticles in cells","laura_i.fitzgerald.australia.vic,luigi.aurelio.australia.vic,moore.chen.australia.vic,daniel.yuen.australia.vic,joshua_j.rennick.australia.vic,bim.graham.australia.vic,angus_p_r.johnston.australia.vic"
7830,7830,2020,9,Nature communications,ER-mitochondria contacts promote mtDNA nucleoids active transportation via mitochondrial dynamic tubulation,"jinshan.qin.china.beijing,yuting.guo.china.beijing,boxin.xue.china.beijing,peng.shi.china.beijing,yang.chen.china.beijing,qian_peter.su.china.beijing,huiwen.hao.china.beijing,shujuan.zhao.china.beijing,congying.wu.china.beijing,li.yu.china.beijing,dong.li.china.beijing,yujie.sun.china.beijing"
7832,7832,2020,9,Nature communications,Chromatin modifier MTA1 regulates mitotic transition and tumorigenesis by orchestrating mitotic mRNA processing,"jian.liu.china.beijing,chunxiao.li.china.beijing,jinsong.wang.china.beijing,dongkui.xu.china.beijing,haijuan.wang.china.beijing,ting.wang.china.beijing,lina.li.china.beijing,hui.li.china.beijing,peng.nan.china.beijing,jingyao.zhang.china.beijing,yang.wang.china.dalian,changzhi.huang.china.beijing,dong.chen.china.wuhan,yi.zhang.china.wuhan,tao.wen.china.beijing,qimin.zhan.china.beijing,fei.ma.china.beijing,haili.qian.china.beijing"
7833,7833,2020,9,Nature communications,Enhanced carbon dioxide conversion at ambient conditions via a pore enrichment effect,"wei.zhou.china.qingdao,qiwen.deng.china.qingdao,guoqing.ren.china.qingdao,lei.sun.china.qingdao,li.yang.china.qingdao,yimeng.li.china.qingdao,dong.zhai.china.qingdao,yihong.zhou.china.yichang,weiqiao.deng.china.qingdao"
7834,7834,2020,9,Nature communications,Linkage of genetic drivers and strain-specific germline variants confound mouse cancer genome analyses,"sebastian.mueller.germany.munich,sebastian.lange.germany.munich,katharina_a_n.collins.germany.munich,stefan.krebs.germany.munich,helmut.blum.germany.munich,gnter.schneider.germany.munich,lena.rad.germany.munich,dieter.saur.germany.munich,roland.rad.germany.munich"
7836,7836,2020,9,Nature communications,Exhausted CD8<sup>+</sup> T cells exhibit low and strongly inhibited TCR signaling during chronic LCMV infection,"ioana.sandu.switzerland.zurich,dario.cerletti.switzerland.zurich,manfred.claassen.switzerland.zurich,annette.oxenius.switzerland.zurich"
7837,7837,2020,9,Nature communications,Computational screen-out strategy for electrically pumped organic laser materials,"qi.ou.china.beijing,qian.peng.china.beijing,zhigang.shuai.china.beijing"
7838,7838,2020,9,Nature communications,Maintenance of sarcomeric integrity in adult muscle cells crucially depends on Z-disc anchored titin,"sandra.swist.germany.bochum,andreas.unger.germany.munster,yong.li.germany.munster,anja.vge.germany.bochum,marion.von_frielingsalewsky.germany.munster,sa.skrln.sweden.stockholm,nicola.cacciani.sweden.stockholm,thomas.braun.germany.badnauheim,lars.larsson.sweden.stockholm,wolfgang_a.linke.germany.munster"
