,Unnamed: 0.1,pub_year,pub_month,journal_name,paper_title,author
19894,19894,2021,3,Nature communications,Controlling pairing of π-conjugated electrons in 2D covalent organic radical frameworks via in-plane strain,"isaac.alcn.germany.berlin,ral.santiago.spain.barcelona,jordi.ribasarino.spain.barcelona,merc.deumal.spain.barcelona,ibrio_de_p_r.moreira.spain.barcelona,stefan_t.bromley.spain.barcelona"
19898,19898,2021,3,Nature communications,Author Correction: Lkb1 suppresses amino acid-driven gluconeogenesis in the liver,"pierrealexandre.just.france.paris,sara.charawi.france.paris,raphal_g_p.denis.france.paris,mathilde.savall.france.paris,massir.traore.france.paris,marc.foretz.france.paris,sultan.bastu.france.paris,salimata.magassa.france.paris,nadia.senni.france.paris,pierre.sohier.france.paris,maud.wursmer.france.paris,mireille.vasseurcognet.france.bondy,alain.schmitt.france.paris,morgane.le_gall.france.paris,marjorie.leduc.france.paris,franois.guillonneau.france.paris,jeanpascal.de_bandt.france.paris,patrick.mayeux.france.paris,batrice.romagnolo.france.paris,serge.luquet.france.paris,pascale.bossard.france.paris,christine.perret.france.paris"
19899,19899,2021,3,Nature communications,Quasi-continuous melting of model polymer monolayers prompts reinterpretation of polymer melting,"ruibin.zhang.china.xian,william_s.fall.china.xian,gillian_a.gehring.united_kingdom.sheffield,xiangbing.zeng.united_kingdom.sheffield,goran.ungar.china.xian"
19900,19900,2021,3,Nature communications,Publisher Correction: Southern Ocean in-situ temperature trends over 25 years emerge from interannual variability,"matthis.auger.france.paris,rosemary.morrow.france.toulouse,elodie.kestenare.france.toulouse,jeanbaptiste.salle.france.paris"
19901,19901,2021,3,Nature reviews. Materials,COVID-19 highlights the model dilemma in biomedical research,"partho_protim.adhikary.canada.vancouver,qurrat.ul_ain.canada.vancouver,andreas_christian.hocke.germany.berlin,sarah.hedtrich.canada.vancouver"
19903,19903,2021,3,PLoS biology,"Single-cell longitudinal analysis of SARS-CoV-2 infection in human airway epithelium identifies target cells, alterations in gene expression, and cell state changes","neal_g.ravindra.usa.connecticut,mia_madel.alfajaro.usa.connecticut,victor.gasque.usa.connecticut,nicholas_c.huston.usa.connecticut,han.wan.usa.connecticut,klara.szigetibuck.usa.connecticut,yuki.yasumoto.usa.connecticut,allison_m.greaney.usa.connecticut,victoria.habet.usa.connecticut,ryan_d.chow.usa.connecticut,jennifer_s.chen.usa.connecticut,jin.wei.usa.connecticut,renata_b.filler.usa.connecticut,bao.wang.usa.connecticut,guilin.wang.usa.connecticut,laura_e.niklason.usa.connecticut,ruth_r.montgomery.usa.connecticut,stephanie_c.eisenbarth.usa.connecticut,sidi.chen.usa.connecticut,akiko.iwasaki.usa.connecticut,tamas_l.horvath.usa.connecticut,ellen_f.foxman.usa.connecticut,richard_w.pierce.usa.connecticut,anna_marie.pyle.usa.connecticut,david.van_dijk.usa.connecticut,craig_b.wilen.usa.connecticut"
19904,19904,2021,3,PLoS computational biology,Elements and evolutionary determinants of genomic divergence between paired primary and metastatic tumors,"ruping.sun.usa.minnesota,athanasios_n.nikolakopoulos.usa.minnesota"
19905,19905,2021,3,PLoS computational biology,Addition of new neurons and the emergence of a local neural circuit for precise timing,"yevhen.tupikov.usa.pennsylvania,dezhe_z.jin.usa.pennsylvania"
19906,19906,2021,3,PLoS computational biology,SARS-CoV-2 viral dynamics in non-human primates,"antonio.gonalves.france.paris,pauline.maisonnasse.france.lekremlinbicetre,flora.donati.france.paris,mlanie.albert.france.paris,sylvie.behillil.france.paris,vanessa.contreras.france.lekremlinbicetre,thibaut.naninck.france.lekremlinbicetre,romain.marlin.france.lekremlinbicetre,caroline.solas.france.marseille,andres.pizzorno.france.lyon,julien.lemaitre.france.lekremlinbicetre,nidhal.kahlaoui.france.lekremlinbicetre,olivier.terrier.france.lyon,raphael.ho_tsong_fang.france.lekremlinbicetre,vincent.enouf.france.paris,nathalie.dereuddrebosquet.france.lekremlinbicetre,angela.brisebarre.france.paris,franck.touret.france.marseille,catherine.chapon.france.lekremlinbicetre,bruno.hoen.france.paris,bruno.lina.france.lyon,manuel.rosa_calatrava.france.lyon,xavier.de_lamballerie.france.marseille,france.mentr.france.paris,roger.le_grand.france.lekremlinbicetre,sylvie.van_der_werf.france.paris,jrmie.guedj.france.paris"
19907,19907,2021,3,PLoS computational biology,Prediction of amphipathic helix-membrane interactions with Rosetta,"alican.gulsevin.usa.tennessee,jens.meiler.usa.tennessee"
19908,19908,2021,3,PLoS computational biology,Gene variants of coagulation related proteins that interact with SARS-CoV-2,"david.holcomb.usa.maryland,aikaterini.alexaki.usa.maryland,nancy.hernandez.usa.maryland,ryan.hunt.usa.maryland,kyle.laurie.usa.maryland,jacob.kames.usa.maryland,nobuko.hamasakikatagiri.usa.maryland,anton_a.komar.usa.ohio,michael.dicuccio.usa.maryland,chava.kimchisarfaty.usa.maryland"
19909,19909,2021,3,PLoS genetics,Reduction of WDR81 impairs autophagic clearance of aggregated proteins and cell viability in neurodegenerative phenotypes,"xuezhao.liu.china.shanghai,limin.yin.china.shanghai,tianyou.li.china.shanghai,lingxi.lin.china.shanghai,jie.zhang.china.shanghai,yang.li.china.shanghai"
19910,19910,2021,3,PLoS genetics,Synaptonemal Complex dimerization regulates chromosome alignment and crossover patterning in meiosis,"spencer_g.gordon.usa.utah,lisa_e.kursel.usa.utah,kewei.xu.usa.utah,ofer.rog.usa.utah"
19912,19912,2021,3,PLoS neglected tropical diseases,Efficacy of praziquantel has been maintained over four decades (from 1977 to 2018): A systematic review and meta-analysis of factors influence its efficacy,"mizuho.fukushige.united_kingdom.edinburgh,margo.chasetopping.united_kingdom.edinburgh,mark_e_j.woolhouse.united_kingdom.edinburgh,francisca.mutapi.united_kingdom.edinburgh"
19916,19916,2021,3,PLoS pathogens,The pharmacokinetics and drug-drug interactions of ivermectin in Aedes aegypti mosquitoes,"urs.duthaler.switzerland.basel,michael.weber.switzerland.basel,lorenz.hofer.switzerland.basel,carlos.chaccour.spain.barcelona,pie.mller.switzerland.basel,stephan.krhenbhl.switzerland.basel,felix.hammann.switzerland.basel"
19918,19918,2021,3,PLoS pathogens,A heterochromatin inducing protein differentially recognizes self versus foreign genomes,"eric_m.burton.usa.newyork,ibukun_a.akinyemi.usa.florida,tiffany_r.frey.usa.florida,huanzhou.xu.usa.florida,xiaofan.li.usa.florida,lai_jing.su.usa.florida,jizu.zhi.usa.newyork,michael_t.mcintosh.usa.florida,sumita.bhadurimcintosh.usa.florida"
19919,19919,2021,3,PLoS pathogens,Cryo-EM reveals a previously unrecognized structural protein of a dsRNA virus implicated in its extracellular transmission,"qianqian.shao.china.guangzhou,xudong.jia.china.guangzhou,yuanzhu.gao.china.guangzhou,zhe.liu.china.guangzhou,huan.zhang.china.guangzhou,qiqi.tan.china.guangzhou,xin.zhang.china.guangzhou,huiqiong.zhou.china.guangzhou,yinyin.li.china.guangzhou,de.wu.china.guangzhou,qinfen.zhang.china.guangzhou"
19923,19923,2021,3,Science advances,Strongly correlated superconductivity in a copper-based metal-organic framework with a perfect kagome lattice,"t.takenaka.japan.chiba,k.ishihara.japan.chiba,m.roppongi.japan.chiba,y.miao.japan.chiba,y.mizukami.japan.chiba,t.makita.japan.chiba,j.tsurumi.japan.chiba,s.watanabe.japan.chiba,j.takeya.japan.chiba,m.yamashita.japan.chiba,k.torizuka.japan.chiba,y.uwatoko.japan.chiba,t.sasaki.japan.sendai,x.huang.china.beijing,w.xu.china.beijing,d.zhu.china.beijing,n.su.china.beijing,jg.cheng.china.beijing,t.shibauchi.japan.chiba,k.hashimoto.japan.chiba"
19925,19925,2021,3,Science advances,Breast cancer-secreted factors perturb murine bone growth in regions prone to metastasis,"chuang.liu.germany.potsdam,ins.morenojimnez.germany.potsdam,tengteng.tang.germany.potsdam,wolfgang.wagermaier.germany.potsdam,mason_n.dean.germany.potsdam,peter.fratzl.germany.potsdam"
19926,19926,2021,3,Science advances,Serial femtosecond and serial synchrotron crystallography can yield data of equivalent quality: A systematic comparison,"p.mehrabi.germany.hamburg,r.bcker.germany.hamburg,h_m.ginn.united_kingdom.didcot,a.kuo.canada.toronto,t.morizumi.canada.toronto,b_t.eger.canada.toronto,wl.ou.canada.toronto,s.oghbaey.canada.toronto,a.sarracini.canada.toronto,j_e.besaw.canada.toronto,o.parelabrosse.germany.hamburg,s.meier.germany.hamburg,h.schikora.germany.hamburg,f.tellkamp.germany.hamburg,a.marx.germany.hamburg,d_a.sherrell.united_kingdom.didcot,d.axford.united_kingdom.didcot,r_l.owen.united_kingdom.didcot,o_p.ernst.canada.toronto,e_f.pai.canada.toronto,e_c.schulz.germany.hamburg,r_j_d.miller.germany.hamburg"
19927,19927,2021,3,Science advances,A towering genome: Experimentally validated adaptations to high blood pressure and extreme stature in the giraffe,"chang.liu.china.xian,jianbo.gao.china.xian,xinxin.cui.china.xian,zhipeng.li.china.changchun,lei.chen.china.xian,yuan.yuan.china.xian,liangwei.mei.china.xian,lan.zhao.china.xian,mingliang.hu.china.xian,botong.zhou.china.xian,zihe.li.china.xian,tao.qin.china.xian,huazhe.si.china.changchun,guangyu.li.china.changchun,zeshan.lin.china.xian,yicheng.xu.china.jiaxing,chenglong.zhu.china.xian,yuan.yin.china.xian,chenzhou.zhang.china.xian,wenjie.xu.china.xian,qingjie.li.china.changchun,kun.wang.china.xian,m_thomas_p.gilbert.denmark.copenhagen,rasmus.heller.denmark.copenhagen,wen.wang.china.xian,jinghui.huang.china.xian,qiang.qiu.china.xian"
19928,19928,2021,3,Science advances,Mutual anticipation can contribute to self-organization in human crowds,"hisashi.murakami.japan.tokyo,claudio.feliciani.japan.tokyo,yuta.nishiyama.japan.niigata,katsuhiro.nishinari.japan.tokyo"
19930,19930,2021,3,Science advances,Catalytic amplification by transition-state molecular switches for direct and sensitive detection of SARS-CoV-2,"noah_r.sundah.singapore.singapore,auginia.natalia.singapore.singapore,yu.liu.singapore.singapore,nicholas_r_y.ho.singapore.singapore,haitao.zhao.singapore.singapore,yuan.chen.singapore.singapore,qing_hao.miow.singapore.singapore,yu.wang.singapore.singapore,darius_l_l.beh.singapore.singapore,ka_lip.chew.singapore.singapore,douglas.chan.singapore.singapore,paul_a.tambyah.singapore.singapore,catherine_w_m.ong.singapore.singapore,huilin.shao.singapore.singapore"
19931,19931,2021,3,Science advances,GREB1: An evolutionarily conserved protein with a glycosyltransferase domain links ERα glycosylation and stability to cancer,"eun_myoung.shin.singapore.singapore,vinh_thang.huynh.singapore.singapore,sultan_abda.neja.singapore.singapore,chia_yi.liu.singapore.singapore,anandhkumar.raju.singapore.singapore,kelly.tan.singapore.singapore,nguan_soon.tan.singapore.singapore,jayantha.gunaratne.singapore.singapore,xuezhi.bi.singapore.singapore,vinay.tergaonkar.singapore.singapore"
19933,19933,2021,3,Science advances,Bioinspired mechano-photonic artificial synapse based on graphene/MoS<sub>2</sub> heterostructure,"jinran.yu.china.beijing,xixi.yang.china.beijing,guoyun.gao.china.beijing,yao.xiong.china.beijing,yifei.wang.china.beijing,jing.han.china.beijing,youhui.chen.china.beijing,huai.zhang.china.beijing,qijun.sun.china.beijing,zhong_lin.wang.china.beijing"
19935,19935,2021,3,Science advances,On-chip torsion balances with femtonewton force resolution at room temperature enabled by carbon nanotube and graphene,"lin.cong.china.beijing,zi.yuan.china.beijing,zaiqiao.bai.china.beijing,xinhe.wang.china.beijing,wei.zhao.china.wuxi,xinyu.gao.china.beijing,xiaopeng.hu.china.beijing,peng.liu.china.beijing,wanlin.guo.china.nanjing,qunqing.li.china.beijing,shoushan.fan.china.beijing,kaili.jiang.china.beijing"
19937,19937,2021,3,Science advances,IL4-driven microglia modulate stress resilience through BDNF-dependent neurogenesis,"jinqiang.zhang.china.chengdu,peijing.rong.china.beijing,lijuan.zhang.china.chengdu,hui.he.china.chengdu,tao.zhou.china.guiyang,yonghua.fan.china.chengdu,li.mo.china.chengdu,qiuying.zhao.china.chengdu,yue.han.china.chengdu,shaoyuan.li.china.beijing,yifei.wang.china.beijing,wan.yan.china.chengdu,huafu.chen.china.chengdu,zili.you.china.chengdu"
19942,19942,2021,3,Science robotics,Endoscopy-assisted magnetic navigation of biohybrid soft microrobots with rapid endoluminal delivery and imaging,"ben.wang.china.hongkong,kai_fung.chan.china.hongkong,ke.yuan.china.hongkong,qianqian.wang.china.hongkong,xianfeng.xia.china.hongkong,lidong.yang.china.hongkong,ho.ko.china.hongkong,yixiang_j.wang.china.hongkong,joseph_jao_yiu.sung.china.hongkong,philip_wai_yan.chiu.china.hongkong,li.zhang.china.hongkong"
19947,19947,2021,3,Science translational medicine,Citrullinated vimentin mediates development and progression of lung fibrosis,"fu_jun.li.usa.birmingham,ranu.surolia.usa.birmingham,huashi.li.usa.birmingham,zheng.wang.usa.birmingham,gang.liu.usa.birmingham,tejaswini.kulkarni.usa.birmingham,adriana_v_f.massicano.usa.birmingham,james_a.mobley.usa.birmingham,keith.wille.usa.birmingham,suzanne_e.lapi.usa.birmingham,mohammad.athar.usa.birmingham,victor_j.thannickal.usa.birmingham,a_brent.carter.usa.birmingham,veena_b.antony.usa.birmingham"
19951,19951,2021,3,Cell reports,"Synaptotagmin-1 interacts with PI(4,5)P2 to initiate synaptic vesicle docking in hippocampal neurons","yun.chen.china.beijing,yinghan.wang.china.beijing,yi.zheng.china.beijing,meijing.li.germany.martinsried,bing.wang.china.beijing,qiuwen.wang.china.beijing,chonglei.fu.china.beijing,yaonan.liu.china.beijing,xueming.li.china.beijing,jun.yao.china.beijing"
19953,19953,2021,3,Cell reports,Antigen presentation between T cells drives Th17 polarization under conditions of limiting antigen,"viola_l.boccasavia.spain.madrid,elena_r.bovolenta.spain.madrid,ana.villanueva.spain.madrid,aldo.borroto.spain.madrid,clara_l.oeste.spain.madrid,hisse_m.van_santen.spain.madrid,cristina.prieto.spain.madrid,diego.alonsolpez.spain.salamanca,manuel_d.diazmuoz.france.toulouse,balbino.alarcn.spain.madrid"
19954,19954,2021,3,Cell reports,A compact vocabulary of paratope-epitope interactions enables predictability of antibody-antigen binding,"rahmad.akbar.norway.oslo,philippe_a.robert.norway.oslo,milena.pavlovi.norway.oslo,jeliazko_r.jeliazkov.switzerland.zurich,igor.snapkov.norway.oslo,andrei.slabodkin.norway.oslo,cdric_r.weber.switzerland.basel,lonneke.scheffer.norway.oslo,enkelejda.miho.switzerland.muttenz,ingrid_hobk.haff.norway.oslo,fridtjof.lundjohansen.norway.oslo,geir_k.sandve.norway.oslo,victor.greiff.norway.oslo"
19955,19955,2021,3,Cell reports,COX2 regulates senescence secretome composition and senescence surveillance through PGE<sub>2</sub>,"susana.gonalves.united_kingdom.cambridge,kelvin.yin.united_kingdom.cambridge,yoko.ito.united_kingdom.cambridge,adelyne.chan.united_kingdom.cambridge,ioana.olan.united_kingdom.cambridge,sarah.gough.united_kingdom.cambridge,liam.cassidy.united_kingdom.cambridge,eva.serrao.united_kingdom.cambridge,stephen.smith.united_kingdom.cambridge,andrew.young.united_kingdom.cambridge,masashi.narita.japan.yokohama,matthew.hoare.united_kingdom.cambridge"
19957,19957,2021,3,Cell reports,A short isoform of STIM1 confers frequency-dependent synaptic enhancement,"girish.ramesh.germany.homburg,lukas.jarzembowski.germany.homburg,yvonne.schwarz.germany.homburg,vanessa.poth.germany.homburg,maik.konrad.germany.homburg,mona_l.knapp.germany.homburg,gertrud.schwr.germany.homburg,anna_a.lauer.germany.homburg,marcus_o_w.grimm.germany.homburg,dalia.alansary.germany.homburg,dieter.bruns.germany.homburg,barbara_a.niemeyer.germany.homburg"
19968,19968,2021,3,Cell reports,Human pluripotent stem cells identify molecular targets of trisomy 12 in chronic lymphocytic leukemia patients,"jennifer_c.reid.canada.hamilton,diana.golubeva.canada.hamilton,allison_l.boyd.canada.hamilton,cameron_g.hollands.canada.hamilton,charisa.henly.canada.hamilton,luca.orlando.canada.hamilton,andrew.leber.canada.hamilton,jose.hbert.canada.montreal,fortunato.morabito.israel.jerusalem,giovanna.cutrona.italy.genoa,luca.agnelli.italy.milan,massimo.gentile.italy.cosenza,manlio.ferrarini.italy.genoa,antonino.neri.italy.milan,brian.leber.canada.hamilton,mickie.bhatia.canada.hamilton"
19970,19970,2021,3,Cell reports,LXR stimulates a metabolic switch and reveals cholesterol homeostasis as a statin target in Tasmanian devil facial tumor disease,"maria_p.ikonomopoulou.spain.madrid,yaiza.lopezmancheo.spain.madrid,marta_g.novelle.spain.madrid,maite.martinezua.spain.madrid,lahiru.gangoda.australia.melbourne,martin.pal.australia.melbourne,luis_filipe.costamachado.spain.madrid,pablo_jose.fernandezmarcos.spain.madrid,grant_a.ramm.australia.brisbane,manuel_alejandro.fernandezrojo.spain.madrid"
19972,19972,2021,3,Cell reports,Translational adaptation of human viruses to the tissues they infect,"xavier.hernandezalias.spain.barcelona,hannah.benisty.spain.barcelona,martin_h.schaefer.italy.milan,luis.serrano.spain.barcelona"
19976,19976,2021,3,Cell reports,Lateral ventral tegmental area GABAergic and glutamatergic modulation of conditioned learning,"giorgio.rizzi.switzerland.basel,zhuoliang.li.switzerland.basel,norbert.hogrefe.switzerland.basel,kelly_r.tan.switzerland.basel"
19977,19977,2021,3,Cell reports,KDM6B-dependent chromatin remodeling underpins effective virus-specific CD8<sup>+</sup> T cell differentiation,"jasmine.li.australia.vic,kristine.hardy.australia.bruce,moshe.olshansky.australia.vic,adele.barugahare.australia.vic,linden_j.gearing.australia.vic,julia_e.prier.australia.vic,xavier_y_x.sng.australia.vic,michelle_ly_thai.nguyen.australia.vic,dana.piovesan.australia.vic,brendan_e.russ.australia.vic,nicole_l.la_gruta.australia.vic,paul_j.hertzog.australia.vic,sudha.rao.australia.brisbane,stephen_j.turner.australia.vic"
19978,19978,2021,3,Cell reports,Distinct progenitor behavior underlying neocortical gliogenesis related to tumorigenesis,"zhongfu.shen.china.beijing,yang.lin.china.beijing,jiajun.yang.china.beijing,david_j.jrg.united_kingdom.cambridge,yuwei.peng.china.beijing,xiuli.zhang.china.beijing,yifan.xu.china.beijing,luisirene.hernandez.usa.newyork,jian.ma.china.beijing,benjamin_d.simons.united_kingdom.cambridge,songhai.shi.usa.newyork"
19979,19979,2021,3,Cell reports,"Parkin is an E3 ligase for the ubiquitin-like modifier FAT10, which inhibits Parkin activation and mitophagy","nicola_d.roverato.germany.konstanz,carolin.sailer.germany.konstanz,nicola.catone.switzerland.kreuzlingen,annette.aichem.switzerland.kreuzlingen,florian.stengel.germany.konstanz,marcus.groettrup.switzerland.kreuzlingen"
19981,19981,2021,3,Cell reports. Medicine,Populating preterm infants with probiotics,"matthew_j.dalby.united_kingdom.norwich,lindsay_j.hall.united_kingdom.norwich"
19984,19984,2021,3,Cell reports. Medicine,Complete mesogastric excision for locally advanced gastric cancer: short-term outcomes of a randomized clinical trial,"daxing.xie.china.wuhan,jie.shen.china.wuhan,liang.liu.china.wuhan,beibei.cao.china.wuhan,yatao.wang.china.wuhan,jichao.qin.china.wuhan,jianhong.wu.china.wuhan,qun.yan.china.wuhan,yuanlong.hu.china.wuhan,chuanyong.yang.china.wuhan,zhixin.cao.china.wuhan,junbo.hu.china.wuhan,ping.yin.china.wuhan,jianping.gong.china.wuhan"
19986,19986,2021,3,Cell reports. Medicine,A dual antibody test for accurate surveillance of SARS-CoV-2 exposure rates,"emmanuelle_v.leblanc.canada.kingston,che_c.colpitts.canada.kingston"
19990,19990,2021,3,Cell reports. Medicine,Integrated immune dynamics define correlates of COVID-19 severity and antibody responses,"marios.koutsakos.australia.melbourne,louise_c.rowntree.australia.melbourne,luca.hensen.australia.melbourne,brendon_y.chua.australia.melbourne,carolien_e.van_de_sandt.australia.melbourne,jennifer_r.habel.australia.melbourne,wuji.zhang.australia.melbourne,xiaoxiao.jia.australia.melbourne,lukasz.kedzierski.australia.melbourne,thomas_m.ashhurst.australia.sydney,givanna_h.putri.australia.sydney,felix.marshwakefield.australia.sydney,mark_n.read.australia.sydney,davis_n.edwards.australia.sydney,e_bridie.clemens.australia.melbourne,chinn_yi.wong.australia.melbourne,francesca_l.mordant.australia.melbourne,jennifer_a.juno.australia.melbourne,fatima.amanat.usa.newyork,jennifer.audsley.australia.melbourne,natasha_e.holmes.australia.vic,claire_l.gordon.australia.melbourne,olivia_c.smibert.australia.vic,carly_m.hughes.australia.melbourne,mike.catton.australia.melbourne,justin_t.denholm.australia.melbourne,steven_y_c.tong.australia.melbourne,denise_l.doolan.australia.cairns,tom_c.kotsimbos.australia.melbourne,david_c.jackson.australia.melbourne,florian.krammer.usa.newyork,dale_i.godfrey.australia.melbourne,amy_w.chung.australia.melbourne,nicholas_j_c.king.australia.sydney,sharon_r.lewin.australia.melbourne,adam_k.wheatley.australia.melbourne,stephen_j.kent.australia.melbourne,kanta.subbarao.australia.melbourne,james.mcmahon.australia.melbourne,irani.thevarajan.australia.melbourne,thi_h_o.nguyen.australia.melbourne,allen_c.cheng.australia.melbourne,katherine.kedzierska.australia.melbourne"
19992,19992,2021,3,Nature communications,Prospective contributions of biomass pyrolysis to China's 2050 carbon reduction and renewable energy goals,"qing.yang.china.wuhan,hewen.zhou.china.wuhan,pietro.bartocci.italy.perugia,francesco.fantozzi.italy.perugia,ondej.maek.united_kingdom.edinburgh,zhiyu.wei.china.wuhan,haiping.yang.china.wuhan,hanping.chen.china.wuhan,xi.lu.china.beijing,guoqian.chen.china.beijing,chuguang.zheng.china.wuhan"
19994,19994,2021,3,Nature communications,Programmable site-selective labeling of oligonucleotides based on carbene catalysis,"yangha.lee.south_korea.ulsan,eunsoo.yu.south_korea.ulsan,cheolmin.park.south_korea.ulsan"
19996,19996,2021,3,Nature communications,Predicting wavelength-dependent photochemical reactivity and selectivity,"jan_p.menzel.australia.brisbane,benjamin_b.noble.australia.melbourne,james_p.blinco.australia.brisbane,christopher.barnerkowollik.australia.brisbane"
19999,19999,2021,3,Nature communications,In situ structure and organization of the influenza C virus surface glycoprotein,"steinar.halldorsson.united_kingdom.london,kasim.sader.united_kingdom.london,jack.turner.united_kingdom.london,lesley_j.calder.united_kingdom.london,peter_b.rosenthal.united_kingdom.london"
20001,20001,2021,3,Nature communications,Quantitative interpretation explains machine learning models for chemical reaction prediction and uncovers bias,"dvid_pter.kovcs.united_kingdom.cambridge,william.mccorkindale.united_kingdom.cambridge,alpha_a.lee.united_kingdom.cambridge"
20003,20003,2021,3,Nature communications,Author Correction: Temporal changes in global soil respiration since 1987,"jiesi.lei.china.beijing,xue.guo.china.beijing,yufei.zeng.china.beijing,qun.gao.china.beijing,yunfeng.yang.china.beijing"
20005,20005,2021,3,Nature communications,A mussel-inspired film for adhesion to wet buccal tissue and efficient buccal drug delivery,"shanshan.hu.china.chengdu,xibo.pei.china.chengdu,lunliang.duan.china.chongqing,zhou.zhu.china.chengdu,yanhua.liu.china.chengdu,junyu.chen.china.chengdu,tao.chen.china.chongqing,ping.ji.china.chongqing,qianbing.wan.china.chengdu,jian.wang.china.chengdu"
20008,20008,2021,3,Nature communications,Publisher Correction: A computational reward learning account of social media engagement,"bjrn.lindstrm.netherlands.amsterdam,martin.bellander.sweden.stockholm,david_t.schultner.netherlands.amsterdam,philippe_n.tobler.switzerland.zurich,david_m.amodio.netherlands.amsterdam"
20009,20009,2021,3,Nature communications,In vivo and in vitro reconstitution of unique key steps in cystobactamid antibiotic biosynthesis,"sebastian.gro.germany.campus,bastien.schnell.germany.campus,patrick_a.haack.germany.campus,david.auerbach.germany.campus,rolf.mller.germany.campus"
20010,20010,2021,3,Nature communications,Ultrafast melting and recovery of collective order in the excitonic insulator Ta<sub>2</sub>NiSe<sub>5</sub>,"hope_m.bretscher.united_kingdom.cambridge,paolo.andrich.united_kingdom.cambridge,prachi.telang.india.pune,anupam.singh.india.pune,luminita.harnagea.india.pune,a_k.sood.india.bangalore,akshay.rao.united_kingdom.cambridge"
20012,20012,2021,3,Nature communications,Author Correction: Quantum non-demolition measurement of a many-body Hamiltonian,"dayou.yang.austria.innsbruck,andrey.grankin.austria.innsbruck,lukas_m.sieberer.austria.innsbruck,denis_v.vasilyev.austria.innsbruck,peter.zoller.austria.innsbruck"
20014,20014,2021,3,Nature communications,Rational strain engineering of single-atom ruthenium on nanoporous MoS<sub>2</sub> for highly efficient hydrogen evolution,"kang.jiang.china.changsha,min.luo.china.shanghai,zhixiao.liu.china.changsha,ming.peng.china.changsha,dechao.chen.china.changsha,yingrui.lu.taiwan.hsinchu,tingshan.chan.taiwan.hsinchu,yongwen.tan.china.changsha"
20018,20018,2021,3,Nature communications,"Mapping specificity, cleavage entropy, allosteric changes and substrates of blood proteases in a high-throughput screen","federico.uliana.switzerland.zurich,matej.vizoviek.switzerland.zurich,laura.acquasaliente.italy.padua,rodolfo.ciuffa.switzerland.zurich,andrea.fossati.switzerland.zurich,fabian.frommelt.switzerland.zurich,sandra.goetze.switzerland.zurich,bernd.wollscheid.switzerland.zurich,matthias.gstaiger.switzerland.zurich,vincenzo.de_filippis.italy.padua,ruedi.aebersold.switzerland.zurich"
20020,20020,2021,3,PLoS computational biology,A unified framework for inferring the multi-scale organization of chromatin domains from Hi-C,"ji_hyun.bak.south_korea.seoul,min_hyeok.kim.south_korea.seoul,lei.liu.south_korea.seoul,changbong.hyeon.south_korea.seoul"
20021,20021,2021,3,PLoS computational biology,JSOM: Jointly-evolving self-organizing maps for alignment of biological datasets and identification of related clusters,"hong_seo.lim.usa.georgia,peng.qiu.usa.georgia"
